Unnamed: 0,recipe_number,recipe_code,recipe_name,comment_id,user_id,user_name,user_reputation,created_at,reply_count,thumbs_up,thumbs_down,stars,best_score,text
71,20,6504,Mom’s Meat Loaf,sp_aUSaElGf_6504_c_107250,u_1oKVZzUfYRrB1upjUnkcLIMmZYy,Guest3267,1,1622716887,0,1,3,5,120,"****20 YEARS OF PROOF****Being a working mom I was looking for a meatloaf  my whole family would LOVE...I made 6 different meatloafs one day and had the family try all. Hands down this was there favorite. My kids come home and still want this over almost anything else I make. One of there favorite foods and warm family memories go with this meal. I now make this for my grandkids, and for the stubborn eaters I now put chopped or mashed veggies in. I Cover with part of sauce not real heavy, then put the rest in a bowl warm for those who like more. Try with your family and you will have a new easy family favorite!!!!!"
72,20,6504,Mom’s Meat Loaf,sp_aUSaElGf_6504_c_306743,u_1oKZXasEvWFXehjG3R17daottqZ,EtaTornell,1,1622717861,0,0,1,5,100,This is a great recipe-I no longer use any other. I substitute panko for saltines and since my family doesn&#39;t love sage in beef I substitute granulated garlic.
73,20,6504,Mom’s Meat Loaf,sp_aUSaElGf_6504_c_308648,u_1oKVbVmO9FN4iqyRWuzGEiEJTOi,dig1,1,1622717871,0,0,1,5,100,This is a test comment.
74,20,6504,Mom’s Meat Loaf,sp_aUSaElGf_6504_c_348591,u_1oKb9Ir813phBSoox5id30HAPq4,FloridaMorrisse,1,1622718097,0,2,1,3,193,"Use ground chuck and a half pound of ground pork and also panko bread crumbs, no sugar or salt. Use some diced green pepper and onion for added background flavor. Maybe a couple of bacon strips on top. Best ever. And better meatloaf sandwiches the next day. (For Diabetes person)."
75,20,6504,Mom’s Meat Loaf,sp_aUSaElGf_6504_c_120207,u_1oKVh0w3QAumxRL8gsUzM5rgtqF,missteddybear,1,1622716942,0,1,0,5,193,"botanner, then tweek the recipe to cut down the salt."
76,20,6504,Mom’s Meat Loaf,sp_aUSaElGf_6504_c_112457,u_1oKVl0xJ7yt7MBx4r1ydmpewrh1,Margaret1234567890,1,1622716914,0,0,1,5,100,"Absolutely yummy, this is a keeper."
77,20,6504,Mom’s Meat Loaf,sp_aUSaElGf_6504_c_175463,u_1oKW5fKK9HDkZtuY7eUzxQzFWdZ,lamsden,1,1622717204,0,0,1,5,100,"I have made this many times. We love it. I cut the salt to 1/4 tsp or omit altogether. I use bread crumbs in place of crackers. I shape it to fit my crockpot, place it on aluminum foil with holes poked in it to release the fat, put it on a rack or a couple of jar covers side-by-side and cook it on low for 4-5 hours. Pour the sauce on the top of the loaf for the last 30-45 minutes. This is delicious!"
78,20,6504,Mom’s Meat Loaf,sp_aUSaElGf_6504_c_286740,u_1oKVbO64tMvsSlTf5L00ULp6h48,teryn69,10,1622717744,0,1,2,3,127,"The sauce I knew would be too sweet for our taste. I didn&#39;t use any of the brown sugar, and instead used less milk and a little ketchup in the meat mixture, and of course on top.  I also used more spice, garlic powder, marjoram and a lot of pepper as is our preference. Almost carmelizing the onions is something I&#39;ve always done, it adds a lot more flavor to the meatloaf. I&#39;ve never measured the crackers, I just crumble until it looks right :-)  This recipe, with my modifications, is how my mom made meatloaf, minus the onions."
79,20,6504,Mom’s Meat Loaf,sp_aUSaElGf_6504_c_146539,u_1oKW6BKuhYfGmGm4Yk9itNwmkrn,MandyFeagan,1,1622717058,0,0,1,4,100,"Good recipe, but the sauce was a bit too sweet and tasted more like a barbecue sauce. I would cut the amount of sugar by half next time. I baked mine in muffin tins at 350 for about 30 minutes."
80,20,6504,Mom’s Meat Loaf,sp_aUSaElGf_6504_c_126461,u_1oKVtOIe0WfPek7ZGQXlOF0CpE7,KiniaB,1,1622716986,0,0,1,4,100,Delicious!  This recipe is good I just changed two little thing. Instead of 1/2c sugar I do 1tbs and The sauce I  pore everything on the meatloaf. Made it like this every time including the very first. Love taste of home recipes everything I made was delicious.
81,20,6504,Mom’s Meat Loaf,sp_aUSaElGf_6504_c_321843,u_1oKVtgN8zqdum9cajbHYBHjrdLh,vsmith8403,1,1622717941,0,0,1,4,100,"This meatloaf was very good. My whole family loved it, and my husband is not a &#34;meatloaf guy&#34;. I didn&#39;t have any problems with it being dry at all or falling apart. I give it 4 stars only bc it was a little too sweet for me as well. And without the sauce the meat was pretty bland, although my husband liked the fact that the meat wasn&#39;t overly seasoned bc the sauce had a great taste. The only thing I may do next time is season the meat a little more and probably not put as much brown sugar. But I wouldn&#39;t make many changes bc my family (husband and 2 kids) LOVED IT. I paired it with some mashed potatoes and green beans. Overall a great meal."
82,20,6504,Mom’s Meat Loaf,sp_aUSaElGf_6504_c_161147,u_1oKXD1Yaev1WhjguILwJ0Inpykw,charirae,1,1622717119,0,1,0,1,193,"I am sorry but this was not good at all. Very dry. We threw what was left in the garbage. Followed the recipe exactly. I have two other go to meatloaf recipes that I will continue to use. What intrigued me was the crackers in it because mine falls apart a lot.  I will not make this again. No flavor either, I felt like I was eating dry hamburgers."
83,20,6504,Mom’s Meat Loaf,sp_aUSaElGf_6504_c_167947,u_1oKXG3VBhLHZ9WGh6lZuHmhG73n,plt99,1,1622717171,0,1,0,1,193,"I followed the recipe exactly and I ended up with a sloppy mess. The loaf just fell apart. Also, the sauce is way too sweet."
84,20,6504,Mom’s Meat Loaf,sp_aUSaElGf_6504_c_175163,u_1oKVpkiEoO23QoBBiHtJQo3aTvU,speechp,1,1622717204,0,0,0,5,100,I have made this in my crockpot for years. Best meatloaf recipe ever. I never liked meatloaf before trying this recipe.
85,20,6504,Mom’s Meat Loaf,sp_aUSaElGf_6504_c_340984,u_1oKVxg4A207YOTeBKlSQwHRbnzA,KimandTommy,1,1622718048,0,0,0,5,100,"This was really good. My husband was never a huge meatloaf fan but he also gave this 5 stars. I only put in half the brown sugar that the recipe called for because #1) I&#39;m trying to cut down on sugar, and #2) there were a number of reviews saying the sauce was pretty sweet. With half the sugar it still seemed pretty sweet to me. Next time I will put in a quarter of the sugar that the recipe calls for."
86,20,6504,Mom’s Meat Loaf,sp_aUSaElGf_6504_c_353043,u_1oKVaXJwLYVPfZHDZxIowFSyo7z,Wildfiremustang,1,1622718110,0,0,1,4,100,Very good flavor for a traditional meatloaf.
87,20,6504,Mom’s Meat Loaf,sp_aUSaElGf_6504_c_174978,u_1oKVZv53OoxaUD2jE14MmsDU0KQ,s_pants,1,1622717189,0,0,0,5,100,"I have made this for many years. It is my family&#39;s favorite. Love the sauce on top and having leftovers for sandwiches....though, I have to make 2 to have leftovers! I used Ritz crackers instead of the saltines this time and loved it just as much."
88,20,6504,Mom’s Meat Loaf,sp_aUSaElGf_6504_c_215458,u_1oKZOnn7iIXQ8Cdc4bXO8LLD2KU,LindseyLu,1,1622717414,0,0,1,5,100,"I was never a meatloaf fan, but reluctantly agreed to make it for my husband after constant requests, I used this recipie and now I LOVE meatloaf. I make it all the time and no matter who is eating they all go back to seconds and there are no leftovers."
89,20,6504,Mom’s Meat Loaf,sp_aUSaElGf_6504_c_311770,u_1oKVfPNzj0TA5cd6waE7KNjgzDF,Parkhart,1,1622717908,0,0,1,5,100,This is delicious!  We have made it several times and I doubt we will ever stop.
90,20,6504,Mom’s Meat Loaf,sp_aUSaElGf_6504_c_138903,u_1oKVZdmUbQTYMVdbXOpVfRQuHm9,No_Time_To_Cook,1,1622717013,0,0,1,5,100,Excellent!  I made this exactly per the recipe and will be making again for sure.  Served oven crispy potatoes.
91,20,6504,Mom’s Meat Loaf,sp_aUSaElGf_6504_c_242338,u_1oKY6TYvfPWsNPySWrGOnpUwLOR,gaylinda,1,1622717557,0,0,1,5,100,Made this for the first last week and have cooked it four times by special requests from family...they all LOVE it...i use 2 pounds of ground beef and increased other ingredients accordingly.  Since my family does not like catsup I use Sweet Baby Ray original sauce..this meatloaf is gourmet.  I also substitute Saltines in favor of Club or Ritz Crackers.  Instead of bulb onion I used about 6 green onions including the green parts.  This meatloaf has lots of flavor!
92,20,6504,Mom’s Meat Loaf,sp_aUSaElGf_6504_c_233849,u_1oKXzCzmcJyxsDCG8kSuS9Er1Ci,Catnip1,1,1622717485,0,0,1,5,100,"Love it!  I&#39;ve tried several different meatloaf recipes (my husband loves meatloaf) and this is the one my husband thinks is the absolute best.  I&#39;ve never been much of a meatloaf fan and even I truly enjoy it.  The only change I made was to reduce everything by a third since there are only two of us, and we still have leftovers for the next day&#39;s lunch (at least he does)."
93,20,6504,Mom’s Meat Loaf,sp_aUSaElGf_6504_c_254385,u_1oKYWd0zOhKdLjix04uZUnMdBFt,Hijinx1313,1,1622717604,0,0,0,1,100,"My husband loves my meatloaf.  But I&#39;m always on the lookout for new recipes and ways to make it. Mine rarely turns out the same two times in a row. But he always loves it.Seeing that this had 5 stars, I decided to try it.  I made it exactly as the recipe was written. Yes, it was moist, but it was the most bland, tasteless meatloaf I have ever made.  Totally a waste of good ground beef.  Sorry, but I won&#39;t be making this recipe ever again!"
94,20,6504,Mom’s Meat Loaf,sp_aUSaElGf_6504_c_313523,u_1oKVb9l5HK8fi2sT6moc1kMFLzh,roamerat98,1,1622717882,0,0,0,5,100,This is my favorite meat loaf recipe!
95,20,6504,Mom’s Meat Loaf,sp_aUSaElGf_6504_c_117507,u_1oKVZoIOMWJ2j7TA7py2BIbf1mm,mjlouk,1,1622716926,0,0,1,5,100,Awesome!  We really liked this meatloaf recipe.  I rarely make meatloaf but this recipe might change that!
96,20,6504,Mom’s Meat Loaf,sp_aUSaElGf_6504_c_182846,u_1oKXH0P3QWdvYcUh35kW7kbBSYF,rachelgattuso,1,1622717220,0,0,1,5,100,I love it but some times i use Italian bread crumbs instead of saltines
97,20,6504,Mom’s Meat Loaf,sp_aUSaElGf_6504_c_311084,u_1oKW5Cs4yc2kPkOjWE40d0YYDcW,kayjayc,1,1622717874,0,1,1,5,142,"This is baking in my oven right now, on a rainy, cool Sunday afternoon. I have made this meatloaf many times before.and I think the sage gives this meatloaf the unique flavor. It smells so good baking. I do use reduced sodium crackers, Worcestershire and catsup as a rule in cooking. It is moist and flavorful, served with yams and roasted carrots of many colors. This meal is a winner in our home. Thanks for sharing, Michelle!"
98,20,6504,Mom’s Meat Loaf,sp_aUSaElGf_6504_c_198908,u_1oKVZbcNg5NYW87grfhDXNePwbL,danielleylee,1,1622717331,0,0,1,5,100,I made this with 93/7 ground beef and skim milk. My husband liked the sauce and also said it was moist and tender but held together nicely. He still prefers his mom&#39;s meatloaf recipe.
99,20,6504,Mom’s Meat Loaf,sp_aUSaElGf_6504_c_119321,u_1oKVkh5iP3DHQhD9spRKKI2iYoR,lttlewok,1,1622716937,0,0,1,5,100,Best I have ever had.
100,20,6504,Mom’s Meat Loaf,sp_aUSaElGf_6504_c_250194,u_1oKYYL6Fe9ImaQdWsZec4nhczIg,Charlotte1975,1,1622717583,0,1,1,5,142,My family loves this recipe.  I do not use the sage.  I add a little ketchup to the meat mixture just cause I like a little tomatoy inside the loaf.    I sometimes poke holes on the loaf so the topping can seep into the loaf.
101,20,6504,Mom’s Meat Loaf,sp_aUSaElGf_6504_c_174540,u_1oKWAnqYaa1sJNDoGW8RjJovT93,Sunshinebakerpa,1,1622717217,0,0,1,4,100,"I have made this and &#34;Easy meatloaf&#34; several times.  For this recipe, we really like the ketchup mixture topping."
102,20,6504,Mom’s Meat Loaf,sp_aUSaElGf_6504_c_347048,u_1oKXH0ArGAqbrImmTMytP1mggAN,Maureen001,1,1622718078,0,0,0,3,100,"Too much sugar in this recipe, both added and hidden!  Try using tomato paste with a little Worchestershire sauce stirred in for your topping with bell pepper rings for garnish (I like the yellow ones).  Instead of a runnier sauce you will have a tangier topping that is absorbed into the flavor of the meatloaf in the top layer.  Change the saltines to seasoned bread crumbs (Italian or Garlic seasoned), add chopped sundried tomatoes to bring hints of the tomato tang throughout the meatloaf and use chopped sweet Hawaiian onions for a flavor balance."
103,20,6504,Mom’s Meat Loaf,sp_aUSaElGf_6504_c_221152,u_1oKVZlgwPbb4xAJfv7aJ5rVDToV,Psalm127-3,10,1622717472,0,0,0,5,100,"if I had ground beef in the house right now I would make this for dinner. it&#39;s freezing cold here in Los Angeles California and this sounds like it would warm our hearts &gt; perhaps I&#39;m on my way to the market :))) yep my husband had a Dr apt and took me to grocer. it&#39;s in the oven right now made exactly as written. I&#39;ll report back.!!!!!!!!!!!!!!!!!!&#39;DEEEEEEEE-LISH!!!!!!!!!!sgwing &gt; &#34;use less what?&#34;kittiekatt &gt; all due respect to you as well. my MIL without fail always used crushed saltines for her meatloaf and meatballs, they were always exactly the same and 2 of my favorite meals she made. our kids well, they adored it and her."
104,20,6504,Mom’s Meat Loaf,sp_aUSaElGf_6504_c_343996,u_1oKWTWlCIOwaodgG64yPaPhqBsZ,sgwing,1,1622718067,0,0,1,5,100,"This was very good, but a little too soft for my taste. I think next time I&#39;ll  use less and see if that might firm it up."
105,20,6504,Mom’s Meat Loaf,sp_aUSaElGf_6504_c_170499,u_1oKXRp5dez1t50GpDFmlRHslNNk,cacampbe,1,1622717189,0,0,1,5,100,"I had never made meatloaf before and have never cared much for it either, but my husband asked for it one night. This recipe was super easy to make and tasted delicious. My husband loved it and I did too! He especially liked the sauce. I used breadcrumbs in place of crushed saltines. I would highly recommend this recipe!"
106,20,6504,Mom’s Meat Loaf,sp_aUSaElGf_6504_c_222166,u_1oKXtEk5aTkCVC77UioZWQaUXO0,epeab3,1,1622717485,0,1,1,5,142,"I&#39;m a single Dad, who like many people, I&#39;m raising my child on my own. I&#39;ll be the first to admit that my cooking skills would make Chef boyardee and Martha Stewart blush in shame. However, last night I tried this Meatloaf and man you should have seen the look on my kids face after her first bite it was worth the time and effort. What topped it off she asked for thirds. Thank you!"
107,20,6504,Mom’s Meat Loaf,sp_aUSaElGf_6504_c_331250,u_1oKW9tHuEukRMgmX8L1DsUb9GRZ,Kartay,1,1622717979,0,0,0,5,100,"This stuff is dope!  I almost never eat ground beef, but was looking for something different to make for dinner.  Seriously delicious.  Made the recipe exactly as written, used the  extra sauce too and loved it.  Great combination of savoury and sweet.  Reminiscent of good Southern bbq.  Would gladly make again very soon.  Thanks for this scrumptious dish!"
108,20,6504,Mom’s Meat Loaf,sp_aUSaElGf_6504_c_346905,u_1oKVaoS2SiGTzMofqQNWS7iwhz2,bearwoman1975,1,1622718087,0,1,0,2,193,"Too sweet, would just use a little ketchup and not add brown sugar or add very little."
109,20,6504,Mom’s Meat Loaf,sp_aUSaElGf_6504_c_250762,u_1oKVyS7GaGSCgbaAJtr1jBji3K3,krysfielder,1,1622717591,0,0,1,4,100,"My family really liked this one and while I did too, I think I might tweak it a little. Maybe a little diced green pepper in it or a little more Worcestershire sauce. Definitely a keeper though!"
110,20,6504,Mom’s Meat Loaf,sp_aUSaElGf_6504_c_245385,u_1oKVkKJDvEFQKZM2b62wueqCvQX,hchambers,1,1622717543,0,0,0,5,100,"Meatloaf is a family favorite and this is a good one.  I usually mix a 1/2 pound of ground pork with 1 pound of ground beef in my meatloaf.  Served with some mashed potatoes, this is comfort food at its best."
111,20,6504,Mom’s Meat Loaf,sp_aUSaElGf_6504_c_152249,u_1oKWJLkHSf84O8H3e1MWz5Gvcki,cdurocher,1,1622717068,0,0,0,5,100,Great!
112,20,6504,Mom’s Meat Loaf,sp_aUSaElGf_6504_c_203990,u_1oKXncmbF6GwZReEPavkDP6VgnT,mistmich,1,1622717350,0,0,1,5,100,I really enjoyed this recipe. It made a lot of food and tasted great. I served it with mashed potatoes and smothered with brown gravy on top (instead of the reserved sauce) and it was filling and delicious. Perfect for a chilly night. Thanks for the recipe!
113,20,6504,Mom’s Meat Loaf,sp_aUSaElGf_6504_c_208688,u_1oKVbsjjlaeXXE57P8MPuFdO2gh,catlinrose,1,1622717373,0,2,0,5,253,I too have commented repeatedly about the rudeness of the  reviewers on this site. I don&#39;t see this as much on other cooking sites.  Sure hate to try and meet their standards.  I appreciate suggestions &amp; honest critiques..
114,20,6504,Mom’s Meat Loaf,sp_aUSaElGf_6504_c_374064,u_1oKVoJ5ej0tKbLp14qX1KxmyUeF,love2cook54,1,1622718207,0,2,0,5,253,"Wow!  Delicious!  I used thyme instead of sage because I don&#39;t care for sage.  Put a couple dashes of worcheshire and ketchup in the meat mixture (used 75% lean).  Other than that, I followed the recipe.  It is sooo juicy and delicious.  Served it with baked sweet potatoes.  Definitely a keeper!! Thanks :)"
115,20,6504,Mom’s Meat Loaf,sp_aUSaElGf_6504_c_378072,u_1oKbRrH7tzI1ufDaljlo6nFlbwW,GigiGreen,1,1622718227,0,0,0,5,100,Yummy!  I added1/4# of ground sausage  everyone raved. I&#39;m not usually a fan of this but it was the best I&#39;ve had!
116,20,6504,Mom’s Meat Loaf,sp_aUSaElGf_6504_c_212709,u_1oKYtcoe0lwkjI6qDtNGKC7rZxD,covPrincess,1,1622717377,0,1,0,3,193,I used oatmeal instead of saltines and did not add more salt. The meatloaf was bland without sauce. And I used coconut sugar instead of brown sugar great flavor on sauce. I will follow recipe as is to get the true flavor. And I used a meatloaf mixture instead of all ground  beef.  I will make recipe again and post another review. Some times it doesn&#39;t work when substitutions are made from early on or first time following recipe. My Bad.
117,20,6504,Mom’s Meat Loaf,sp_aUSaElGf_6504_c_171991,u_1oKXBB59ZXd4TNkodeYe1NZnbqJ,LindasPrincess,1,1622717200,0,0,0,5,100,"I have been making a recipe almost exactly like this for 40  years. The only difference is that I use quick rolled oats instead of saltine crackers and omit the sage, although I will try sage next time just to see if the family likes that spice in the meatloaf. Thanks for sharing. Our mothers before us knew what satisfied at the dinner table, that&#39;s why recipes like this are still around, albeit with slight differences."
118,20,6504,Mom’s Meat Loaf,sp_aUSaElGf_6504_c_313763,u_1oKbSCLlhz4zyc7U5Y7DMurgDsc,cb3lakes,1,1622717917,0,0,0,5,100,"This is my family&#39;s favorite meatloaf recipe. I have been making it for over 15 years. If I try a different recipe, they know it. I believe the sauce is what makes it so good."
119,20,6504,Mom’s Meat Loaf,sp_aUSaElGf_6504_c_145906,u_1oKVsYIxc7pWeB1Tu5tuaHjzaW0,KTMJ,1,1622717056,0,0,0,5,100,Good flavor!
120,20,6504,Mom’s Meat Loaf,sp_aUSaElGf_6504_c_131163,u_1oKVmcFS1yL0PZAlEFwenmbzy3L,WWJDASKHIM,1,1622716973,0,1,0,5,193,"Donalee2. First of all you don&#39;t type in all caps as you are shouting.  Secondly and most importantly, why on earth are you reviewing a recipe you haven&#39;t even tried. Seriously?"
121,20,6504,Mom’s Meat Loaf,sp_aUSaElGf_6504_c_305299,u_1oKVmQkS1FVSt6977sTnhPtAU8n,Srjr111,1,1622717833,0,1,1,5,142,"This is a good meatloaf recipe. I agree with the others, I wish reviewers would not bombard us with their negative comments. Not all recipies are to everyone&#39;s liking, but please be considerate of the submitter and professional about your review"
122,20,6504,Mom’s Meat Loaf,sp_aUSaElGf_6504_c_287854,u_1oKVuq0duwMjBwBlmbcFfwebpzb,hyburtt1966,1,1622717737,0,0,0,5,100,There are very few recipes that get this high a rating....agree with 120 out of 125 on this one.  Also agree with another reviewer...no need to be SO negative on a recipe.  It can be done tastefully if you do not care for it...ie: this has too much salt for me or it is a bit too sweet for my family...
123,20,6504,Mom’s Meat Loaf,sp_aUSaElGf_6504_c_107504,u_1oKVZg1DVmIpML6RYl0Vhh6hcJm,rebelwithoutaclue,10,1622716887,0,2,0,5,253,@Donalee;  not that many calories if you exercise a bit during the week.  You should wait till Sunday to do your preaching.  This is our go to meat loaf recipe except if we use saltines we eliminate the salt.  Most of the time we use Italian bread crumbs.
124,20,6504,Mom’s Meat Loaf,sp_aUSaElGf_6504_c_172637,u_1oKXWf1PIJiDijaw11bZig96ezC,herling,1,1622717202,0,0,0,5,100,I have been making this for many years.  Excellent recipe.
125,20,6504,Mom’s Meat Loaf,sp_aUSaElGf_6504_c_179239,u_1oKVho5a1ylQ7udzHm865i3nKbv,Donalee2,1,1622717209,0,0,3,4,100,I HAVEN&#39;T TRIED THIS RECIPE BUT IT SEEMS LIKE IT IS AN AWFUL LOT OF CALORIES FOR JUST ONE PIECE OF MEATLOAF. THAT IS ALMOST YOUR WHOLE MEAL WORTH OF CALORIES. DONALEE 2
126,20,6504,Mom’s Meat Loaf,sp_aUSaElGf_6504_c_228574,u_1oKXlNIKooAUMM15TZcwmPUKPgP,tamsea,1,1622717439,0,0,0,5,100,"I&#39;ve been making this recipe for years (11 ?) and it&#39;s one of my go to recipes. The meatloaf is moist and very flavorful!  Love, love, love it. And my husband, who grew up having meatloaf, loves it too!"
127,20,6504,Mom’s Meat Loaf,sp_aUSaElGf_6504_c_154728,u_1oKW4VISSzwb6zgALUvjHmo3GK5,EileenCu,1,1622717082,0,0,0,3,100,Held form well well and texture good.  A little too salty for my taste with saltines and salt.  May leave salt out next time
128,20,6504,Mom’s Meat Loaf,sp_aUSaElGf_6504_c_195283,u_1oKX4F2rShTDkKoFN8MxxzwWeqr,Cimorene,1,1622717285,0,0,0,5,100,"I made this into a spectacular BACON MEATLOAF!Fantastic base recipe.Changes: I fried 2 chopped thick bacon pieces in a skillet, and blended them with the milk and eggs for 15 seconds. Then, I added spices to the leftover bacon grease in the skillet, and sauteed the onions in it until they started to caramelize--before mixing it all together!Sauteeing the onions and adding the blended bacon gives the meatloaf an extra delicious kick without changing the yummy texture!!"
129,20,6504,Mom’s Meat Loaf,sp_aUSaElGf_6504_c_149089,u_1oKViYcsgLsMPuJqQWcDav8rnWB,dschultz01,1,1622717070,0,0,0,5,100,Great meatloaf recipe that was easy to make!
130,20,6504,Mom’s Meat Loaf,sp_aUSaElGf_6504_c_287870,u_1oKZOMzC2SdlPGcJ6GpMnhTiV9U,Mom2TwoFriend2All,1,1622717737,0,0,1,1,100,The worst meatloaf Ive ever tasted. I followed recipe to the &#34;T&#34;.Yak!!!!
131,20,6504,Mom’s Meat Loaf,sp_aUSaElGf_6504_c_140447,u_1oKVnK4WzG2tsG8vc5pujpxiybO,ekprice,1,1622717023,0,0,0,5,100,Excellent
132,20,6504,Mom’s Meat Loaf,sp_aUSaElGf_6504_c_337043,u_1oKa75WGgdtLuC65wpw7cgMNeKQ,Ant1qu1ty2002,1,1622718034,0,2,0,5,253,"This was excellent!!!  Thank you for sharing your mothers recipe with us.  Everyone&#39;s taste is different and tweeks things the way they want. I think if you do not have something nice  to say, you should not say it at all.We LOVED the recipe..."
133,20,6504,Mom’s Meat Loaf,sp_aUSaElGf_6504_c_127551,u_1oKVZpdzBp5PQHOM4PGQOZo1ujc,meaganteal,1,1622716962,0,0,0,5,100,Delicious!! Can&#39;t wait for leftovers.  Made mashed potatoes and Pioneers Womans Best Green Beans.  Also made a fruit salad.  Sooooo  good
134,20,6504,Mom’s Meat Loaf,sp_aUSaElGf_6504_c_364279,u_1oKcYKJufURfoYAfCaF0HdcQqyP,3akitalovers,1,1622718112,0,0,0,5,100,"We love this meatloaf, even my meatloaf hating son. The sauce is the winner and is sooo yummy! This isn&#39;t to sweet for us, but can easily be adjusted for others who don&#39;t like it this sweet. The only adjustment I do is use bread crumbs instead of crackers."
135,20,6504,Mom’s Meat Loaf,sp_aUSaElGf_6504_c_137507,u_1oKVw8ikioxgP29iRZ53hOCydKP,Robert,1,1622717024,0,0,0,5,100,Excellent meat loaf made 8 mini loafs with this recipe added a 1/2 pound of sweet Italian sausage to it will make this again
136,20,6504,Mom’s Meat Loaf,sp_aUSaElGf_6504_c_117597,u_1oKVZjPKhLDLXjT59RoLFX6cU1D,dawnrosanne,1,1622716930,0,0,0,5,100,awesome! i used only 1 lb of ground beef. Worked great.
137,20,6504,Mom’s Meat Loaf,sp_aUSaElGf_6504_c_365165,u_1oKVb6wkt6QqMIKYBpjDP0sbuC4,apschwartz,1,1622718182,0,0,0,5,100,"We loved this even though neither of us are big meat loaf fans.  Thinking I had enough ketchup, I ended up having to use about 1/2 cup of BBQ sauce to supplement.  Still turned out great!"
138,20,6504,Mom’s Meat Loaf,sp_aUSaElGf_6504_c_262235,u_1oKYjIbSGr0qQXncTh2N1GRg3ED,MrsBishop33,1,1622717646,0,0,0,5,100,OMG best meatloaf ever! Delicious!
139,20,6504,Mom’s Meat Loaf,sp_aUSaElGf_6504_c_184077,u_1oKX8V9F9qgOcm47YMBkavwcUO9,limirsh,1,1622717244,0,0,0,5,100,"I love this meatloaf. Been making similar one for years.  Instead of Worcestershire in the topping, I use tabasco.  We love the sweet hot taste. Especially good on those sandwiches made from the leftovers. Yum."
140,20,6504,Mom’s Meat Loaf,sp_aUSaElGf_6504_c_109860,u_1oKVb94tf9e0t5hkYT6bgERNem5,grammamaz,1,1622716899,0,0,0,5,100,A most excellent meatloaf. My husband claims it&#39;s the best he&#39;s ever had. I agree. I did substitute 1/2 lb. of mild Italian sausage for the 1/2 lb. of ground beef. I will never use another recipe for meatloaf again. Thanks.
141,20,6504,Mom’s Meat Loaf,sp_aUSaElGf_6504_c_325921,u_1oKaRV5HbouQDvPGlPzUKYInem1,Shebuddy,1,1622717959,0,0,0,5,100,This recipe is the exact same recipe as the one published in the Better Homes and Gardens Cookbook. My version of the cookbook is just over 30 years old.
142,20,6504,Mom’s Meat Loaf,sp_aUSaElGf_6504_c_335174,u_1oKbUFOQ2Tf6H3JLrc0xg9SOJdu,AMB118120,1,1622717993,0,0,0,5,100,This was awesome! Made it tonight for dinner and my family loved it. Will definitely make this again.
143,20,6504,Mom’s Meat Loaf,sp_aUSaElGf_6504_c_218331,u_1oKW5Ww9pUss4GcDxbyCTeEl8ed,bernerlover,1,1622717407,0,0,0,5,100,"I wouldn&#39;t have thought this would be so different but it was and it was wonderful.  My hubby loved it too.  I loved it and am making it again today, thanks for sharing the recipe"
