Unnamed: 0,recipe_number,recipe_code,recipe_name,comment_id,user_id,user_name,user_reputation,created_at,reply_count,thumbs_up,thumbs_down,stars,best_score,text
160,14,7178,Zucchini Cupcake,sp_aUSaElGf_7178_c_181714,u_1oKVaSDjHboOXWt1F16GUjug7gC,allaboutcookies86,1,1622717215,0,0,0,5,100,"I like trying new things and my Mother was talking about making zucchini bread which I don&#39;t believe I have ever eaten, but for some reason sounded good. I came across this recipe. I LOVE carmel so the idea of a carmel frosting on top sealed the deal. I just completed baking and frosting my cupcakes. They are pretty good. Like a spice cake as one review said. They weren&#39;t as moist as I had imagined from the reviews. I think I will make them bigger next time. I don&#39;t believe I made them big enough for the moistness. The carmel frosting is DEFINITELY worth the time and effort it takes to make it. I know I will use it on cakes and other things. It is DELICIOUS! I put the left over frosting in the fridge to put on brownies or something later. Or just eat like carmel. Thank you for the healthy alternative to normal cupcakes. We will see what my coworkers think of it tomorrow when I take it to work."
161,14,7178,Zucchini Cupcake,sp_aUSaElGf_7178_c_112147,u_1oKVbkaKDCs4JqmA3L5Vyub9CYD,senzascusa,1,1622716913,0,0,0,5,100,"Absolutely fantastic like everyone said. I expected nothing less. I too, like others, cut down the sugar and they were still fantastic. Could probably cut even more as icing makes up the sweetness. These tasted fantastic even without icing."
162,14,7178,Zucchini Cupcake,sp_aUSaElGf_7178_c_188975,u_1oKVyIQax5r11Sr5l8f1AG2ZRZJ,robynrenee,1,1622717253,0,0,0,5,100,"I made these cupcakes with my granddaughter and they were delicious. She carefully spooned the flour into the measuring cups without packing...and mixed together dry ingredients just until flour was blended. Her cupcakes were soooo tender.Quite by mistake we ended up making &#39;maple bar icing&#39; instead of frosting by adding two sticks butter, instead of one, and some additional confectioner sugar so icing could be swirled around on top of cupcakes. My oh my, was it ever delicious!!! Will try the frosting recipe next time, but will be keeping the &#39;Maple bar icing&#39; for this cupcake as well. Excellent treat for all ages."
163,14,7178,Zucchini Cupcake,sp_aUSaElGf_7178_c_264759,u_1oKVrL4ZUcOUQZlb7iU5hxpQ0pu,idawolf,1,1622717658,0,0,0,5,100,OUTSTANDING!!!
164,14,7178,Zucchini Cupcake,sp_aUSaElGf_7178_c_288741,u_1oKWP8JL4im7XwmXMbNqICmbpU6,jajm6,1,1622717795,0,0,0,5,100,These are amazing!  No one is ever going to know that I am using up my zucchini this way!!  They are so moist and yummy!
165,14,7178,Zucchini Cupcake,sp_aUSaElGf_7178_c_355792,u_1oKVg72qEFSq5ghl4SNQQ7ddx6g,Only by Grace,1,1622718120,0,0,0,5,100,"Very good.  Frosting was very sweet, but that can EASILY be solved by not putting as much on.  How could you complain?!  Nice spice.  I can imagine how they would make good gluten free too!"
166,14,7178,Zucchini Cupcake,sp_aUSaElGf_7178_c_297019,u_1oKYnfFRtubUWxjwoUaFgJo7nRz,Dcookiebaker,1,1622717834,0,0,0,5,100,"These were great, not oily like most zucchini recipes.  For my cooking class, we used a giant zucchini, and scooped out the seeds.  We also cut the amount of cloves to 1/4 teaspoon and doubled the recipe which yielded 45 delicious cupcakes.  Don&#39;t skip the frosting -- it was almost like fudge --yum!!"
167,14,7178,Zucchini Cupcake,sp_aUSaElGf_7178_c_332739,u_1oKb7tCTQZDz8QHcVgnwoCPxOaE,kegkeg,1,1622717991,0,0,0,5,100,"This was a great recipe - very tasty cupcake - a bit like a spice cake and the frosting went so well with it. Caution, the frosting is very sweet, but it frosting!"
168,14,7178,Zucchini Cupcake,sp_aUSaElGf_7178_c_289051,u_1oKZu1TELkUJIJCBAN9YTppV5zh,pennecandi,1,1622717751,0,0,0,0,100,"These are delicious! My frosting did not come out fluffy as shown, but then my mixer broke before I was done. Very moist. Cake and frosting are a great compliment to each other."
169,14,7178,Zucchini Cupcake,sp_aUSaElGf_7178_c_293455,u_1oKVeUPHyBNfFoEdCzcRXBoB0zM,nanascookies,1,1622717817,0,0,0,5,100,These cupcakes are moist and have a great deal of flavor. I also sometimes substitute cream cheese frosting for the caramel frosting. Still is a big hit for any event.
170,14,7178,Zucchini Cupcake,sp_aUSaElGf_7178_c_274776,u_1oKX8bYnlOhAXkhIOj2YJ88LJad,stressed_lulu,1,1622717697,0,0,0,5,100,So good...
171,14,7178,Zucchini Cupcake,sp_aUSaElGf_7178_c_374481,u_1oKVa2KqaJexUwPElqCI7OVfXKC,Jaroburk,1,1622718207,0,0,0,5,100,Wow! These cupcakes are great; the icing certainly sets these cupcakes apart from the many other recipes available. We made some to share with neighbors and they also enjoyed them much.
172,14,7178,Zucchini Cupcake,sp_aUSaElGf_7178_c_290994,u_1oKVZtSdpfy5KrVbAXHeHU0QI4v,shecooksalot,1,1622717799,0,0,0,5,100,These are so good.  It&#39;s such a nice alternative to zucchini bread and my kids love them!!!
173,14,7178,Zucchini Cupcake,sp_aUSaElGf_7178_c_212956,u_1oKYtKVCpMElhRh9tir7JLbhlK2,brandilp421,1,1622717377,0,0,0,5,100,I used rice flour instead to make gluten free and everyone loved them!
174,14,7178,Zucchini Cupcake,sp_aUSaElGf_7178_c_161924,u_1oKWBNRyBUD4awJNxj9w2rMYmMV,hrcrystalw,1,1622717134,0,0,0,5,100,I brought these to work and they were a hit! Many of my coworkers were suprised that they were zucchini cupcakes. A couple of people thought that the frosting was a little too sweet so next time I will try the suggestions listed here. Wonderful recipe!
175,14,7178,Zucchini Cupcake,sp_aUSaElGf_7178_c_168886,u_1oKX1K5nUSDhoxmRAsVcj1tYM7u,Jessie Fishel,1,1622717175,0,0,0,5,100,"I found that 2/3rd full was a little to much, next time I&#39;ll use less.  Tastes like spice cake, very moist and everyone loved them."
176,14,7178,Zucchini Cupcake,sp_aUSaElGf_7178_c_231019,u_1oKZYE7hu5pyBYjW3BG0fm6mXw1,dpbolen,1,1622717502,0,0,0,5,100,Just made these cupcakes!  What a great recipe!  So moist and a great way to use up that zucchini!
177,14,7178,Zucchini Cupcake,sp_aUSaElGf_7178_c_160251,u_1oKVa7sO2wPVeCbiBOTkVUhEwj3,MyRedSandals,1,1622717127,0,0,0,5,100,"I am a vegan so don&#39;t use eggs, butter or dairy milk when cooking. I substituted 3 Tbls of water + 1 Tbls of ground flaxeed for each egg used. Like other reviewers, I also substituted applesauce for the oil. and reduced the cloves to 1/4 tsp. As for the frosting, I skipped the one presented here - although I could have used vegan butter substitute, soy milk and vegan cream cheese - and instead made a &#34;streusel&#34; topping using 1/4 C flour, 3 Tbls brown sugar, 1/4 tsp ground cinnamon, 1/4 tsp ground allspice (or you could also use pumpkin pie spice), 1 Tbls canola oil and 1 C coarsely chopped pecans, all mixed together and sprinkled on top of cupcakes before they went into the oven. Yum!"
178,14,7178,Zucchini Cupcake,sp_aUSaElGf_7178_c_219221,u_1oKVjBrXVdFyP9GTvXvYvMXRYff,Mary_1959,1,1622717410,0,0,0,5,100,"I&#39;ve been making these since the original recipe came out in TOH. My kids grew up eating these almost every summer, and sometimes with frozen zucchini in the winter. A truly awesome way to use zucchini and enjoy a delicious treat, as well."
179,14,7178,Zucchini Cupcake,sp_aUSaElGf_7178_c_183725,u_1oKW23E5Tb7VdpUbdqarPstqfT0,god'slillgirl,1,1622717257,0,0,0,5,100,I LOVE THESE CUPCAKES!!!!!!!!  I have amde these many time &amp; each time I get only good compiments &amp; everyone askes for the recipe =D  I also entered them in our local fair this year &amp; got 1st Juges fav. best of class &amp; best of show!!!  My mom craves these cpucakes all the time ;)  Highly recomend them!!!!
180,14,7178,Zucchini Cupcake,sp_aUSaElGf_7178_c_175812,u_1oKVaZRjV5snsZRKtuKJMvV5rmj,jillanglemyer,1,1622717204,0,0,0,5,100,I have made this recipe again and again.  I really think it&#39;s the frosting!
181,14,7178,Zucchini Cupcake,sp_aUSaElGf_7178_c_197388,u_1oKWuKvDT0WchVbmIu6M47LBNBz,Shannon O,1,1622717317,0,0,0,5,100,"I made this recipe using sugar substitute (good hints on the Splenda site on how to bake with it) and added a half cup of ground flax for some added omegas. Moist, tasty and even without the decadent frosting, simply delicious. A real keeper. Thanks for this one."
182,14,7178,Zucchini Cupcake,sp_aUSaElGf_7178_c_168167,u_1oKVZdyhyNOltUh0APjvdCqrHQK,OhBarbi,1,1622717180,0,0,0,5,100,I followed the recipe to a &#34;tee&#34;.  These cupcakes were delicious.  Texture was perfect.  Icing is wonderful.  Definitely a keeper!
183,14,7178,Zucchini Cupcake,sp_aUSaElGf_7178_c_164274,u_1oKVlHDOM5Wy77miJXPlF3qoAmz,Kdavis50,1,1622717133,0,0,0,5,100,I did not use the cloves and the recipe was fantastic without them!
184,14,7178,Zucchini Cupcake,sp_aUSaElGf_7178_c_138010,u_1oKVlHDOM5Wy77miJXPlF3qoAmz,Kdavis50,1,1622717027,0,0,0,5,100,"Excellent recipe, the cupcakes went to my husbands work and they fought over them!  Very moist and full of flavor!  Thank you"
185,14,7178,Zucchini Cupcake,sp_aUSaElGf_7178_c_173346,u_1oKVpURpwEV8vvqiQ3p94OrT2OC,karisue10,1,1622717195,0,0,0,5,100,"I have been subscribing to Taste of Home since 1994, which is around the time that this recipe appeared as a contest winner.  I have made it many times and it is fantastic!  Some of the best cupcakes I have ever eaten."
186,14,7178,Zucchini Cupcake,sp_aUSaElGf_7178_c_186934,u_1oKVcGRYWhKZoxQjbxpAFHqr3o2,LynneD,1,1622717291,0,0,0,0,100,"I made 2 batches of these for my husband to take to work.  They were a huge hit.  I kept some home with no icing on them because I can&#39;t have dairy, and they were really good with no icing too!  If I were to change anything, I might use a touch less cloves.  I think people that don&#39;t like the intensity of cloves won&#39;t like these much, so try them with less and you might find another way to use all those zucchini!"
187,14,7178,Zucchini Cupcake,sp_aUSaElGf_7178_c_276740,u_1oKW8tHILoiSrVzesw0IdwYvXyu,tkdgal,1,1622717724,0,0,0,2,100,"sounded good, but, sorry didn&#39;t care for it"
188,14,7178,Zucchini Cupcake,sp_aUSaElGf_7178_c_239809,u_1oKXxJWUjp6GQdDem6OoJIA9Ks9,nanadean1,1,1622717520,0,0,0,5,100,Made these and boy did they get raves!  The caramel frosting was fabulous as well.
189,14,7178,Zucchini Cupcake,sp_aUSaElGf_7178_c_298348,u_1oKWsj6ecFrvvaP8B57WFVnbrok,bayrack101,1,1622717843,0,0,0,5,100,These were very good. Loved the spices and icing made it so good.
190,14,7178,Zucchini Cupcake,sp_aUSaElGf_7178_c_262391,u_1oKYtyhiPVe3YkxPUFaamthd36g,1HotFantasy,1,1622717649,0,0,0,5,100,OMG! Made for a bar-b-que.... ALL I HAVETO SAY IS EVERYONE WAS ASKING 4 THE RECIPE. THEY LASTED A WHOLE HR ON TABLE... FRIENDS WANTED MORE LOL I MADE 3 BATCHES FOR 30 PEOPLE ..
191,14,7178,Zucchini Cupcake,sp_aUSaElGf_7178_c_222329,u_1oKX7bGYP2vQ0VU8CtSpFVOvLa9,JCP24,1,1622717485,0,0,0,5,100,I&#39;m not a big zucchini fan but I loved these. My fiance and his kids really like zucchini so I thought I&#39;d try it. I was really impressed and the caramel icing was very good. I definitely will make these again.
192,14,7178,Zucchini Cupcake,sp_aUSaElGf_7178_c_277673,u_1oKXAeAiPpvAI36R3LGgBxfMmi1,verabb,1,1622717725,0,0,0,5,100,such a good recipe.! really like the cake and the frosting!~
193,14,7178,Zucchini Cupcake,sp_aUSaElGf_7178_c_293616,u_1oKZhqI4p02YhFVUCSw6SIZPBQ5,LisaB123,1,1622717814,0,0,0,5,100,These cupcakes are delicious!  Definitely a new family favorite.
194,14,7178,Zucchini Cupcake,sp_aUSaElGf_7178_c_197287,u_1oKX4F0FFQutGZeOpB5gPY8I2JB,tammy.d.martin,1,1622717289,0,0,0,5,100,"I made this recipe today and it was great!  Everyone loved it, and it smells wonderful baking!  The caramel icing just made it that much better!"
195,14,7178,Zucchini Cupcake,sp_aUSaElGf_7178_c_364063,u_1oKW5F2YPK2ed9x5nh6gzxsRqHt,melinanie,1,1622718107,0,0,0,5,100,We love these! Anyone I&#39;ve made them for has asked me for the recipe. The frosting is to die for.
196,14,7178,Zucchini Cupcake,sp_aUSaElGf_7178_c_183660,u_1oKX80OC0KZIojyzW6LOFkfl5Gb,crinehart,1,1622717256,0,0,0,5,100,I love these! I didn&#39;t have almond extract so I used vanilla instead in the actually batter they still turned out delicious!
197,14,7178,Zucchini Cupcake,sp_aUSaElGf_7178_c_349682,u_1oKc5CkbbKyGHn12geoSpxVOoBU,poorlin4,1,1622718056,0,0,0,5,100,Very delicious and moist!
198,14,7178,Zucchini Cupcake,sp_aUSaElGf_7178_c_245124,u_1oKVZdyhyNOltUh0APjvdCqrHQK,OhBarbi,1,1613042917,0,0,0,5,100,"<p>May I add...I scooped out all the zucchini seeds prior to shredding the zucs.  Also, I put the shredded zuc in a colander for a while and pressed some of the excess juice out.  I had maybe a tablespoon of liquid drain off the zucs.</p>"
199,14,7178,Zucchini Cupcake,sp_aUSaElGf_7178_c_228216,u_1oKZFSokPgC3ct6TbP0qEi5Ya1Z,darlingdori,1,1622717470,0,0,0,5,100,I&#39;ve been making these cupcakes for years from the original recipe printed in a ToH magazine from the &#39;90s.  They are outstanding!  The cupcakes are moist and spicy.  The frosting is wonderful!  I do end up with more frosting than I need though.
200,14,7178,Zucchini Cupcake,sp_aUSaElGf_7178_c_353420,u_1oKZn3vMPmStOogQNSD1iGtx3iN,kandy1271,1,1622718095,0,0,0,4,100,Very good recipe!  The frosting is a little time consuming.  Next time I will just use a quick cream cheese frosting to cut back on time a little.
201,14,7178,Zucchini Cupcake,sp_aUSaElGf_7178_c_172251,u_1oKVyQqaa7YoV61eGqIJUwQJVqy,rhonda1,10,1622717201,0,0,0,5,100,I have been making these for years. They are my daughters favorite. She especially loves the icing. They are so moist. Most of the time people wrinkle their nose when I tell them what are they then they are asking for the recipe as soon as they taste of them.
202,14,7178,Zucchini Cupcake,sp_aUSaElGf_7178_c_283497,u_1oKVbizeUGPTjiEpdjObap40E5m,salliegadden,1,1622717742,0,0,0,4,100,"The cupcakes were moist &amp; were liked by the crew of volunteers at the food pantry.  I did not like the frosting, much too sweet, so instead frosted them with cream cheese frosting."
203,14,7178,Zucchini Cupcake,sp_aUSaElGf_7178_c_374736,u_1oKVswuRUrLnhTAYVAsFh29UWNI,smjrks,1,1622718216,0,0,0,5,100,"WOW, this is a great recipe, I did add nuts and raisins. I will make this again and again."
204,14,7178,Zucchini Cupcake,sp_aUSaElGf_7178_c_239712,u_1oKXLPmHDeoWjFn39dLhkemgeAl,ndellabi,1,1622717536,0,0,0,5,100,"Made the cupcakes for friends and it was a big hit.  Great way to use up the extra zucchini in the garden.  The almond extract makes it unique.  It is also delicious with Philadelphia Cream Cheese frosting, although the maple is very good and easy to make.  Cream Cheese gives it a different but excellent flavor also."
205,14,7178,Zucchini Cupcake,sp_aUSaElGf_7178_c_333358,u_1oKVflvwbDwudzWGIaEC9uOGO7p,r&ao,1,1622718016,0,0,0,4,100,"This was a nice treat!  The frosting is very sweet, but my family loved it.  I think they tasted much better the second day as the flavors seemed to blend more, and the intensity of the frosting seemed to mellow a bit."
206,14,7178,Zucchini Cupcake,sp_aUSaElGf_7178_c_367485,u_1oKb0HvyQXY8Jh6gmwLL8tvLYDH,llwphw,1,1622718171,0,0,0,5,100,"Were easy to make, tasted great...quite moist. Did add some cream cheese to the original frosting."
207,14,7178,Zucchini Cupcake,sp_aUSaElGf_7178_c_112138,u_1oKVbghGRXJf76ofhc33PmUO4oU,koolcooky,1,1622716903,0,0,0,5,100,Absolutely loved these cupcakes. Loved the carmel frosting on the spicy cake.
208,14,7178,Zucchini Cupcake,sp_aUSaElGf_7178_c_260266,u_1oKZkZmjU6AQM5Txrapc7RFZ0uG,chrisboyce,1,1622717623,0,0,0,2,100,Not sure what everyone was so impressed with. I made these and they were really dry. Maybe I just didn&#39;t add enough Zucchini but still I had to smother my cupcake in creamcheese frosting to eat it. To be fair I did not try the caramel frosting.
209,14,7178,Zucchini Cupcake,sp_aUSaElGf_7178_c_352946,u_1oKawkq52CAzC29eVQnktIDk5XG,grluigi,1,1622718111,0,0,0,5,100,Very good cupcakes! Great spice flavor in the cupcake combines really well with the caramel frosting! My husband said it&#39;s THE best cupcake he&#39;s ever had! I made them exactly as written. It made exactly 24 perfect size cupcakes. Will definitely keep this recipe handy to use often!!
210,14,7178,Zucchini Cupcake,sp_aUSaElGf_7178_c_228270,u_1oKZHr3XJJGx8rvNu931qOApvlo,Barbie03,1,1622717476,0,0,0,5,100,I&#39;ve already made these 3 times.  Took them to a family get together and they were a hit!!  Really good and moist.
211,14,7178,Zucchini Cupcake,sp_aUSaElGf_7178_c_209359,u_1oKY0rt3j7AI5FJusJuqzw5Mx6Q,Sam's Mom,1,1622717375,0,0,0,5,100,I tried these cupcakes and gave them away. Everyone just loved them. I had to try one for myself since I was getting such great reviews. They are great. I most definitly will make them again. But keep more than one for myself.
212,14,7178,Zucchini Cupcake,sp_aUSaElGf_7178_c_245412,u_1oKY7hCpDTNSVMVJjpFJ3pwaGZF,dawnlog,1,1622717565,0,0,0,4,100,"Mine were a bit dry, even though I didn&#39;t drain my zucchini.  Good flavor, great frosting.  Leave the frosting get to room temp before adding confectioner&#39;s sugar and you won&#39;t have any problems with the consistency."
213,14,7178,Zucchini Cupcake,sp_aUSaElGf_7178_c_189373,u_1oKVkhPFHBlbiBnn4JtcuGO3nFC,rondha sullivan,1,1622717287,0,0,0,4,100,i made these for a sale at work they loved them rondha sullivan
214,14,7178,Zucchini Cupcake,sp_aUSaElGf_7178_c_327493,u_1oKZaeDxFTBeaTFd0PjG2dTDsY4,anisha,1,1622717952,0,0,0,0,100,This recipe was easy to make and delicious!!
215,14,7178,Zucchini Cupcake,sp_aUSaElGf_7178_c_298519,u_1oKZfuzrKKgqUda36885ta1qDv3,jsnjsc,1,1622717839,0,0,0,5,100,These were wonderful muffins.  The frosting was the icing on the cake!  Great recipe!
216,14,7178,Zucchini Cupcake,sp_aUSaElGf_7178_c_296592,u_1oKWTDRuqWEJFRoNltX7z8cC6aw,mamuwubu,1,1622717804,0,0,0,5,100,"These were gone in a flash. We did opt for a cream cheese frosting.  A nice light texture, not too sweet, but YUMMY!"
217,14,7178,Zucchini Cupcake,sp_aUSaElGf_7178_c_297664,u_1oKaYt7MISU2S7n6zXGgEPdUk4T,karadenise,1,1622717839,0,0,0,0,100,"These were so delicious, espcially the frosting! People just raved about how delicious they were! I would definitely make it again."
218,14,7178,Zucchini Cupcake,sp_aUSaElGf_7178_c_147917,u_1oKWYS1FECbfacfTywbShB388et,sue cirillo,1,1622717063,0,0,0,5,100,Great Cupcake!  These cupcakes were super moist and delicious.  The icing was a bit sweet but the caramel flavor was excellent .  I will definitely make these cupcakes again.  Everyone LOVED them
219,14,7178,Zucchini Cupcake,sp_aUSaElGf_7178_c_377715,u_1oKaHyuzooSw2GI1hjNASnvDy9q,korycle,1,1622718228,0,0,0,5,100,Yummy and semi-healthy!  Even those who gave me a funny look when I told them what kind it was were happy they tried it. I am ready to make some more this weekend!
220,14,7178,Zucchini Cupcake,sp_aUSaElGf_7178_c_188173,u_1oKXT4oJVq6J87XU6PsOwFcKXys,decadent2,1,1622717279,0,0,0,5,100,"I made the cupcakes for a potluck and was more than pleased with the flavor.  All those that tried them, loved them."
221,14,7178,Zucchini Cupcake,sp_aUSaElGf_7178_c_299093,u_1oKYqMGbr4IMqlqjk4MnZ0IiBci,emarie53190,1,1622717840,0,0,0,5,100,"They were delicious!!  I&#39;ll definitely make them again... I didn&#39;t make the frosting though,, maybe next time,,but instead I put on my favorite which is Cream Cheese Frosting..."
222,14,7178,Zucchini Cupcake,sp_aUSaElGf_7178_c_129546,u_1oKW4lmi1dOK85gmHwl5ULsXscv,aimsman27,1,1622716982,0,0,0,5,100,"Delish!. I had to use extra powdered sugar to get the frosting a little thicker, but it was a fantastic flavor! Will def.make again!"
223,14,7178,Zucchini Cupcake,sp_aUSaElGf_7178_c_134041,u_1oKWUPMNFuQvLkTv6yBEcr9o0pb,Superju,1,1622716982,0,0,0,4,100,"Easy to make.  Frosting took a while because of letting it cool, but well worth the effort!"
224,14,7178,Zucchini Cupcake,sp_aUSaElGf_7178_c_186954,u_1oKW6TeW5NkR1nELOKm7eCziQMa,Alouette,1,1622717233,0,0,0,5,100,I made 24 mini muffins and 12 regular muffins with this recipe......delicious!  I didn&#39;t peel or drain the zucchini and used half green and half yellow zucchini.  Men especially loved the frosting.
225,14,7178,Zucchini Cupcake,sp_aUSaElGf_7178_c_200106,u_1oKXDwQRY4FBAXKRtp0mPvcmCeQ,heidelberg21,1,1622717304,0,0,0,5,100,I make these every summer and we all love them!
226,14,7178,Zucchini Cupcake,sp_aUSaElGf_7178_c_150613,u_1oKWlwmqMt9FWXwky3bKD3lqoGy,blclemmer,1,1622717073,0,0,0,5,100,Great recipe.  Very easy to make and everyone enjoyed them
227,14,7178,Zucchini Cupcake,sp_aUSaElGf_7178_c_262231,u_1oKYisFgR2z4TQY7SD911Qm73t4,tyler751,1,1622717646,0,0,0,5,100,OMG these are wonderful I made them yesterday and another batch today. The icing is really good and I also did some with a Cream Cheese icing. And they even taste just as good with no icing.
228,14,7178,Zucchini Cupcake,sp_aUSaElGf_7178_c_251731,u_1oKW9LjxlLkfPB4xqNs1deyxpXv,chris and jenn,1,1622717573,0,0,0,4,100,My frosting did not turn out like the picture but the cupcakes were great.  I love the OJ and extract in them!
229,14,7178,Zucchini Cupcake,sp_aUSaElGf_7178_c_112258,u_1oKVbmHDCK2MBpqtv6GB3529Nw7,maggieaw,1,1622716908,0,0,0,5,100,"Absolutely scrumptious! I am with the reviewer Sillygirl- I do not peel or seed my zucchini or squeeze out moisture. I used a smallish tender zucchini. The cupcakes turned out beautifully. I wasnt sure about the frosting either, although it turned out ok and tasted Outrageously fabulous- next time I will add cream cheese and more confectioners sugar to make the frosting more fluffy but still have that fabulous carmel taste! The flavors are the best! Great recipe find! Thanks- Loved it!"
230,14,7178,Zucchini Cupcake,sp_aUSaElGf_7178_c_120750,u_1oKVkobrPs1k8WkI8ci1Ia1gIhn,NanaSueLeavitt,1,1622716939,0,0,0,0,100,Came across this recipe about 10 years ago in Taste of Home - LOVE it. I even grate &amp; freeze just the amount of zucchini I need &amp; use it all through the year. YUMMY!
231,14,7178,Zucchini Cupcake,sp_aUSaElGf_7178_c_349945,u_1oKbvLRp6wkBNlPJ8NRjgksobTf,jaynjen,1,1622718061,0,0,0,5,100,"Very delicious, but for me I&#39;d cut the cloves by half or leave them out and use applesauce instead of oil. My family enjoyed the smell of these as they were cooking just as much as when they got to eat them!!! Will definitly use the frosting on other breads, YUMMY!"
232,14,7178,Zucchini Cupcake,sp_aUSaElGf_7178_c_127121,u_1oKVafcSiM0pKFmpYPs5uGrJvVP,Sweet01,1,1622716978,0,0,0,5,100,Delicious! Love the frosting!
233,14,7178,Zucchini Cupcake,sp_aUSaElGf_7178_c_276315,u_1oKVapk0jsY6CWT9OhAipEerESy,nelda h. till,1,1622717720,0,0,0,5,100,Sooooooo delicious!!!  Can&#39;t wait to make them for my grandchildren and Agape Celebration at church.  Great even without the frosting.
234,14,7178,Zucchini Cupcake,sp_aUSaElGf_7178_c_174017,u_1oKX7wddYZaD43RsdKOT5pB4t2Z,tbearss,1,1622717216,0,0,0,5,100,I have made these for years and my kids gobble them up!  I never drain the zucchini and they always come out moist and perfect.
235,14,7178,Zucchini Cupcake,sp_aUSaElGf_7178_c_143473,u_1oKWN5hgl7T64eRQnUyoCuGpV6i,BonRic,1,1622717050,0,0,0,5,100,"followed another&#39;s advice and cut the sugar to 1 cup, replaced a little over half the oil with applesauce. Baked in bread loaf pans, one with walnut pieces, another with blueberries at 375 for 45 min. Cut the frosting recipe in half, and added more milk to make a glaze. Yummy!"
236,14,7178,Zucchini Cupcake,sp_aUSaElGf_7178_c_142969,u_1oKW7aCcvYI0IYZxyWEAIA1veLO,silly girl,1,1622717039,0,0,0,5,100,"Firstly, I never peel or seed my zucchini.  My mom&#39;s recipe for the cupcakes are similar so i just used hers.  I made the frosting and it was more like a glaze..should i cool it completely before adding conf. sugar?  Instead of putting it in when it&#39;s lukewarm?  It definately did not look like the picture.  I then added a pack of cream cheese and more conf. sugar and it turned out fabulous!!"
237,14,7178,Zucchini Cupcake,sp_aUSaElGf_7178_c_369567,u_1oKVZrlbGg4hfiNKmNE4igtyhj7,anncash,1,1622718167,0,0,0,0,100,"When I make zucchini cupcakes I do not drain the Zucchini but throw in some whole bran till right consistency.Added fiber and health benefits, the kids love them."
238,14,7178,Zucchini Cupcake,sp_aUSaElGf_7178_c_308496,u_1oKVadP7LxCJhGM73HAw1lyOptw,jslvsclf,1,1622717846,0,0,0,5,100,"This is a very good recipe; thanks!*Yes, drain the zucchini.*"
239,14,7178,Zucchini Cupcake,sp_aUSaElGf_7178_c_294988,u_1oKY1PRtZlxiBOzkGvmDWfA7S5G,tiggermari2,1,1622717771,0,0,0,5,100,These spicy cupcake are awesome!This will be made over and over!
240,14,7178,Zucchini Cupcake,sp_aUSaElGf_7178_c_293496,u_1oKZEg1d92R4V4Fi4VDWTGbiBu1,DakotaCook,1,1622717787,0,0,0,5,100,"These cupcakes are great! I reduced the sugar in the cakes to 1 cup, and they were still plenty sweet enough."
241,14,7178,Zucchini Cupcake,sp_aUSaElGf_7178_c_288602,u_1oKWveglKJ8yCsInPutiqqlaTEA,taraearly,1,1622717784,0,0,0,5,100,These are absolutely wonderful!!!
242,14,7178,Zucchini Cupcake,sp_aUSaElGf_7178_c_267109,u_1oKZo7C5erjhOh7tSpMZEtg14kp,ceb219,1,1622717687,0,0,0,0,100,Question... Do you have to drain the zucchini to release the moisture?
243,14,7178,Zucchini Cupcake,sp_aUSaElGf_7178_c_239935,u_1oKYcCekIeJCkjbLsREPgY3S9PW,brunkta,1,1622717536,0,0,0,0,100,"Made these cupcakes for our family gathering. They were a HUGE hit!  Love, love, love them."
244,14,7178,Zucchini Cupcake,sp_aUSaElGf_7178_c_119815,u_1oKW3KSWgrvs4ZaMJfGbmWDR4Xs,ktrum,1,1622716942,0,0,0,5,100,"Between having a crazy amount of zucchini to use and it being a lovely cool day, my friend and I wound up at this webpage and we just gotta say -- DELICIOUS. The spice and caramel combination is just awesome."
245,14,7178,Zucchini Cupcake,sp_aUSaElGf_7178_c_269664,u_1oKVsF8rShOt4qAoYgrcq9yjUYu,ahenry,1,1622717645,0,0,0,5,100,Really good. I used apple juice instead of orange and cream cheese icing. Worth making again.
