Unnamed: 0,recipe_number,recipe_code,recipe_name,comment_id,user_id,user_name,user_reputation,created_at,reply_count,thumbs_up,thumbs_down,stars,best_score,text
68,72,1821,Blueberry French Toast,sp_aUSaElGf_1821_c_351880,u_1oKWIGYgtZhQ3fjTkzHyDn20HJT,Jangirl,1,1622718071,0,0,0,5,100,Very good - I made this for a family breakfast and everyone enjoyed it.  I only used 1 package of cream cheese - and it was more than enough. I will make this again.
69,72,1821,Blueberry French Toast,sp_aUSaElGf_1821_c_150763,u_1oKWUoXD8hqEtTAk6oPbiuKIyrl,ashleigh34,1,1622717100,0,0,0,5,100,"Great recipe. Not too sweet and a great texture. I cut the recipe in half for my family as I would have had enough to feed an army, but amazing recipe. A keeper!"
70,72,1821,Blueberry French Toast,sp_aUSaElGf_1821_c_159989,u_1oKW7QTz0g4CTHlHN7z8BZIwJ9K,marlaje,1,1622717116,0,0,0,5,100,"I always make this recipe for our Easter Brunch.  It is very easy and you can make it up ahead of time.  Even if I wanted to bring another dish, this one is always requested."
71,72,1821,Blueberry French Toast,sp_aUSaElGf_1821_c_360741,u_1oKYLoSlgsfewvyOiEyY90RsDQz,jessicalynnmorris,1,1622718148,0,0,0,4,100,was a bit hard to tell when done i am a bit o.c.d about doneness and making sure things are cooked thoughly.  so mine was a bit over done...but still very good. i also halved the recipie and made this for me and my bf on xmas morning well i made it the day before and cooked it on the morning of xmas. love that its a make ahead deal the the syrpe that you make with the recipie is very yummy a bit bland as its just sugar and blueberries mostly but very very yummy.  i would recommend maybe cutting the cream cheese up alot smaller than i did to disperse it a bit more but other than that i loved it and he was sick but tasted it and said it was very good def will be making this again and again especial for xmas morning fantastic breakfast or brunch idea or maybe even dinner :)
72,72,1821,Blueberry French Toast,sp_aUSaElGf_1821_c_176590,u_1oKWG2A3tqFZMtcmxD6denSF0B9,kmclauchlin,1,1622717206,0,0,0,5,100,I have made this several times and it is a big hit each time.  I add a little salt and nutmeg to the egg mixture and then sprinkle a little cinnamon on top.  Super yummy and easy.
73,72,1821,Blueberry French Toast,sp_aUSaElGf_1821_c_264248,u_1oKYfwQZ3GpGplwSAXeQn3VdUwU,BethMarkel,1,1622717650,0,0,0,5,100,Our family has been making this on weekends and holidays since it was first published in the magazine.  It&#39;s totally yummy!
74,72,1821,Blueberry French Toast,sp_aUSaElGf_1821_c_319891,u_1oKVZtMRUdPhNsHbgdznZ6UHzsn,Gina23,1,1622717899,0,0,0,5,100,"This is the recipe requested for birthdays, holidays and company. Easy, delicious and memorable!"
75,72,1821,Blueberry French Toast,sp_aUSaElGf_1821_c_303746,u_1oKVp2vyp9jCtEPYysFDW6sYoSq,Whisk-karrs,1,1622717863,0,0,0,5,100,"This has been one of my all-time most favorite recipes since I found it in Taste of Home years ago!  And it&#39;s insane the number of reviews that people took time out to do on this, which should tell anyone of it&#39;s wonders!  This is in the Top Five foods of all time!"
76,72,1821,Blueberry French Toast,sp_aUSaElGf_1821_c_312972,u_1oKVadLzyQUPDTrtCNQIMn8QJTk,Hannah0418,1,1622717919,0,0,0,5,100,this is HEAVENLY!!! perfect for christmas morning
77,72,1821,Blueberry French Toast,sp_aUSaElGf_1821_c_315782,u_1oKaw6tyK3BKmJvuvUSdlth6xRY,djjaz mom,1,1622717884,0,0,0,0,100,This is our Christmas breakfast!  I always use 1/2 the cream cheese.  The last time I made this I put right in the oven (without the overnight soak) and I left out the syrup/honey.  IMHO it was just as good... You can&#39;t go wrong with this one!
78,72,1821,Blueberry French Toast,sp_aUSaElGf_1821_c_320746,u_1oKVZtMRUdPhNsHbgdznZ6UHzsn,Gina23,1,1622717900,0,0,0,5,100,This is what everyone in my family wants for their birthday breakfast/brunch. Guests always rave... Absolutely delicious!
79,72,1821,Blueberry French Toast,sp_aUSaElGf_1821_c_183412,u_1oKXsWGFecoHTLjbtWBbS8jkULz,laurelg1,1,1622717223,0,0,0,5,100,"I love the ease of preparation of this dish. Especially having it ready to bake in the morning. I may use only one block (8oz) of cream cheese next time, and cube it smaller so it will spread out more efficiently. Highly recommended."
80,72,1821,Blueberry French Toast,sp_aUSaElGf_1821_c_198966,u_1oKXrh2h2eXOV8480g23AVqCqm7,courtney01,1,1622717325,0,0,0,0,100,I made this when we had out of town guests stay with us. It was an absolute hit!!
81,72,1821,Blueberry French Toast,sp_aUSaElGf_1821_c_325556,u_1oKbyq5HwVGMd9TluIrhQxTO3ok,christashepard,1,1622717922,0,0,0,5,100,This recipe is so easy to make and is a crowd pleaser. It is great to make the night before so that the prep is so easy in the morning. I buy blueberry syrup to use instead of the sauce when I am short on time.
82,72,1821,Blueberry French Toast,sp_aUSaElGf_1821_c_193350,u_1oKXZpbMjjf4qcljpyGmrGGWmn4,rmillerchicago,1,1622717307,0,0,0,0,100,"I made this for a mother&#39;s day brunch yesterday.  My mom and my boyfriend&#39;s mom were meeting for the first time! I used Challah bread, and I mixed a little strawberry cream cheese in with the plain cream cheese.  It was delicious! Everyone absolutely loved it!"
83,72,1821,Blueberry French Toast,sp_aUSaElGf_1821_c_193098,u_1oKXZpbMjjf4qcljpyGmrGGWmn4,rmillerchicago,1,1622717320,0,0,0,0,100,"I made this for a mother&#39;s day brunch yesterday.  My mom and my boyfriend&#39;s mom were meeting for the first time! I used Challah bread, and I mixed a little strawberry cream cheese in with the plain cream cheese.  It was delicious! Everyone absolutely loved it!"
84,72,1821,Blueberry French Toast,sp_aUSaElGf_1821_c_193820,u_1oKVy6Urb1j7dYYuNwr2YwqmZYA,kimariewillman,1,1622717310,0,0,0,0,100,I made this for Easter and it was loved by all!!
85,72,1821,Blueberry French Toast,sp_aUSaElGf_1821_c_317029,u_1oKVsFIoT3aNkjy1rfRd2PMttwo,BasketCase61,1,1622717907,0,0,0,5,100,This is SO good!   This will be on our Easter breakfast table every year from now on.  I did make 1 little change in that I tossed the chunks of 1 pkg of cream cheese in a little sugar &amp; cinnamon.  Only about 1/3 c. sugar with 1 T cinnamon so not much sugar but the cinnamon was an especially nice touch.
86,72,1821,Blueberry French Toast,sp_aUSaElGf_1821_c_317545,u_1oKXi6i45ZUG1ZCeDht5pF5lymV,mayinkzoo94,1,1622717908,0,0,0,5,100,This is sooo great! I made it for an overnight Scrapbooking crop and now my friends want me to make it again for next weekends Crop! Yummy!
87,72,1821,Blueberry French Toast,sp_aUSaElGf_1821_c_277342,u_1oKXLem1GgfwFbfRYYlJUyIMYqY,truette,1,1622717726,0,0,0,0,100,sounds wonderful. always trying new ways for french toast. thank you.Lisa
88,72,1821,Blueberry French Toast,sp_aUSaElGf_1821_c_229067,u_1oKVoCKLkTHNEK3J5GXQcv0Tr6l,5493,1,1622717471,0,0,0,0,100,I&#39;ve made this as our traditional Christmas morning breakfast for about 5 years now and my children won&#39;t let me make anything else. It is fantastic and easy to make.  We used frozen whole rasberries this year and it was just as wonderful. I find that a loaf of french bread cubed works great. Lana G
89,72,1821,Blueberry French Toast,sp_aUSaElGf_1821_c_330213,u_1oKVjxM8ZG5qrBf7QZxpT5Z1cTF,Rodo,1,1622717975,0,0,0,0,100,This sounds wonderful.  I&#39;ve saved it to try.  Thank you. Rosemary
