Unnamed: 0,recipe_number,recipe_code,recipe_name,comment_id,user_id,user_name,user_reputation,created_at,reply_count,thumbs_up,thumbs_down,stars,best_score,text
138,8,6086,Apple Pie,sp_aUSaElGf_6086_c_141570,u_1oKVZangmN67bJNxpyD1j55VJCj,tsuop,1,1622717035,0,0,0,5,100,Fantastic pie.  I use 1 tab. cornstarch w/ 2 tab. flour.   I don &#39;t like nutmeg so I use ALL  cinnamon.
139,8,6086,Apple Pie,sp_aUSaElGf_6086_c_355615,u_1oKW1LDlfGsWGiouqPH3kLMJWI8,chocolateformyfour,1,1622718082,0,0,0,5,100,"Very good, just a bit too much nutmeg though since we don&#39;t really like it.  I&#39;ll try cloves instead next time."
140,8,6086,Apple Pie,sp_aUSaElGf_6086_c_372577,u_1oKcqLjVMwdBPYe0z7qlH4Uz8Ih,bhardin40,1,1622718201,0,0,0,5,100,Wonderful recipe. The only thing I did different was leave out all spices since I love the taste of only apples. I also laid a piece of foil over entire pie first 25 min then uncovered and finished baking 25-30 min until apples are tender when pie poked with thin knife.
141,8,6086,Apple Pie,sp_aUSaElGf_6086_c_313963,u_1oKZgsYSAWEJIrqqsefmJMlvIOy,lovesnewrecipes,1,1622717913,0,0,0,5,100,This is my go to apple pie recipe. So easy and so delicious.  Love it!
142,8,6086,Apple Pie,sp_aUSaElGf_6086_c_216794,u_1oKZIWBWboPovmU4Wmx1skkvCbq,michelleh21,1,1622717428,0,0,1,5,100,I wish there was a higher rating then five stars. This was my. First homemade apple pie and it came out the best I&#39;ve had in my life and that&#39;s not just because I made it haha. There were a few different changes I made and that is 1. I used the homemade pie crust recipe off of crisco container. 2. I skipped the egg white and made a melted butter with sugar and cinnamon to brush on before baking. I know it&#39;s not the healthier choice but it added some great flavor to the crust. 3. I substituted the flour for tapioca because my grandmothers secret is it adds a little extra sweetness and flavor.  Also I forgot to set the timer and didn&#39;t read the cover with foil part so I accidentally skipped out on that so it was uncovered for about 45 minutes. Apples weren&#39;t mushy but also not hard . Right in the middle. I used janigolds and  Mitzu apples that we picked at the orchard.
143,8,6086,Apple Pie,sp_aUSaElGf_6086_c_117225,u_1oKVdz91LTNPYrmuGCbYuMGtRgH,ivirna,1,1622716933,0,0,0,5,100,awesome pie.reminds me of home in the fall .playing outside as a kid down to my grandmothers. smelling the pie mixed with the ocean breeze. salt air .spruce trees and a homemade apple pie.cannot beat them three smells together. along with the waves crashing the beach.Ahhhhh wish i was back home in maine.
144,8,6086,Apple Pie,sp_aUSaElGf_6086_c_342894,u_1oKaTetW5QK4thcEe7u4gRiLNMA,fashionale,1,1622718049,0,0,0,5,100,"This was the best apple pie i have ever tasted in my life. I made it exactly as written, so simple and nobody believed i made it. Thank goodness my daughter witnessed it. Thanks so much"
145,8,6086,Apple Pie,sp_aUSaElGf_6086_c_137446,u_1oKVb196Dt4rtdMZgzcpR8tifmh,nightskystar,1,1622717003,0,0,0,5,100,excellent flavor....used Granny Smith apples..they are my favorite!!
146,8,6086,Apple Pie,sp_aUSaElGf_6086_c_264147,u_1oKYbjCKPPZfgop3EEIW2S9eO8V,bern22,1,1622717650,0,0,0,5,100,Only one thing I didn&#39;t go covet the pan first. The sticks at the bottom.
147,8,6086,Apple Pie,sp_aUSaElGf_6086_c_187491,u_1oKXmZlnRdjFlayhxln5s2Gt5rW,Gmajerrie,1,1622717235,0,0,0,5,100,I made it exactly as written. It turned out excellent!
148,8,6086,Apple Pie,sp_aUSaElGf_6086_c_163283,u_1oKX7QuJIOmephE2YW91ENBVUha,MooMooPIE11,1,1622717139,0,0,0,5,100,"I couldn&#39;t find any egg whites or some of the other ingredients but it turned out perfect none the less. I might be only 14, but this was very simple and exciting! It was the first thing I&#39;d ever made on my own. Adding extra butter made it even better. Sometimes accidents make things better. I used a Wholly Wholesome gluten free crust because I have celiac."
149,8,6086,Apple Pie,sp_aUSaElGf_6086_c_151043,u_1oKWjhtoaKUxTzsVArVWV6XVHzw,Isabell119,1,1622717087,0,0,0,5,100,Great recipie
150,8,6086,Apple Pie,sp_aUSaElGf_6086_c_324798,u_1oKaX2YPMSSrBFzaFL4fK06EJo7,yttikolleh,1,1622717959,0,0,0,5,100,"This recipe is fantastic. I would NOT, however, add much extra flour. I took the advice of some previous reviews and used 5 tbsp flour instead of the recommend 3 tbsp, and the pie filling was too sticky. Next time I will use 3-4 and it should be perfect :)"
151,8,6086,Apple Pie,sp_aUSaElGf_6086_c_186535,u_1oKVepPR4HDsIYcT1zK347AD8ZH,aicenhour,10,1622717233,0,0,0,5,100,I loved this recipe! It was simple and just what I was looking for. I loved the sugar on top of the crust. I used pink lady apples. The perfect combination of sweet and tart!
152,8,6086,Apple Pie,sp_aUSaElGf_6086_c_173405,u_1oKW0euqRkkgwvrfpeVlzJGXnTJ,anne1414,1,1622717185,0,0,0,5,100,"I have found THE apple pie recipe for keeps.  My husband and 29 yearold son were drooling over this pie!  I used granny smith apples,4 tablespoons of flour (not one drippy run), didn&#39;t have nutmeg, butused a little pumpkin pie spice, and cardamom in addition to cinnamonand ginger.  I used Trader Joe&#39;s pie dough and I&#39;m telling you it is utterlydelicious!!"
153,8,6086,Apple Pie,sp_aUSaElGf_6086_c_263818,u_1oKYd6tEHss69KEnt57JDkUYVrH,Kris2727,1,1622717640,0,0,0,5,100,Only 6 more days before my husband deploys and an apple pie was on his list of wants. I have never made an apple pie before and was scared this would be a big flop. To my surprise this is the best apple pie I have ever tasted. Glad I could make this for him. Thanks so much!
154,8,6086,Apple Pie,sp_aUSaElGf_6086_c_196313,u_1oKXr0Wc8XxEmRDcBH0bFdwcAQe,tinamack303,1,1622717281,0,0,0,4,100,"I made this pie for my very first Thanksgiving with the in-laws. Luckily I tried the recipe out a week before thanksgiving. I made the first pie exactly like the recipe says to. It turned out very runny, but tasty nonetheless. I then made another pie with the suggestions of other reviewers. I upped the flour to 5Tbsp and used a little more brown sugar than granulated. I was also stumped on which apples to use. So I went to my local market and grabbed 2 of each they had. I ended up with Gala, HoneyCrisp, and Sweet Tango. OMG! This pie was absolutely splendid. Thank you to everyone who submits a review so newbies like myself can bake something as easy as Apple pie."
155,8,6086,Apple Pie,sp_aUSaElGf_6086_c_257308,u_1oKa1qMoDn1m4u5LoT14xiIs3JC,Benniejean,1,1622717595,0,0,0,5,100,My very first Apple Pie and it was delicious ~
156,8,6086,Apple Pie,sp_aUSaElGf_6086_c_373046,u_1oKcojDHzKg96CkV9NL4hB84PnI,Morningstar335,1,1622718203,0,0,0,5,100,"Wonderful. I made this w my daughter, it was simple to make and delicious to eat!  Yum!"
157,8,6086,Apple Pie,sp_aUSaElGf_6086_c_117889,u_1oKVx0TUmTkIlCQaonHw0GYVZt4,BlastinBLuv,1,1622716934,0,0,0,5,100,"Awesome... Tapioca to thwart the runs... Winner! Also, NO ginger. Don&#39;t like!"
158,8,6086,Apple Pie,sp_aUSaElGf_6086_c_338971,u_1oKaAp8zoeOxYgsrM68eOJTMYR4,blackpie1,1,1622718035,0,0,0,5,100,"This was my first apple pie I&#39;ve ever made. My family and I loved it. Great flavor. Wouldn&#39;t change anything, it&#39;s perfect."
159,8,6086,Apple Pie,sp_aUSaElGf_6086_c_152159,u_1oKWJLkHSf84O8H3e1MWz5Gvcki,cdurocher,1,1622717067,0,0,0,4,100,"Great! Like it says, it&#39;s pretty runny but I just put it in the fridge overnight and it was perfect!"
160,8,6086,Apple Pie,sp_aUSaElGf_6086_c_257365,u_1oKa4EyYuTms04hbrHhzo9tofYw,Pgall59,1,1622717636,0,0,0,4,100,"My suggestion to stop runny juice...sprinkle 2-3 tablespoons of instant tapioca. Put some on bottom crust, some inbetween , and finish with a little on top. When juices are bubbling thru slits in top crust, tapioca will thicken this as it cools. Delicious!"
161,8,6086,Apple Pie,sp_aUSaElGf_6086_c_360887,u_1oKcctO8d3cOwghyBFOsO8JiRLV,Love4-H,1,1622718138,0,0,0,2,100,"Was disappointed in the runniest of this  pie. Had to use several paper towels to sop up runny juices. Did not read reviews  before putting top crust on. Would suggest  Taste of Home  re-write recipe. It for sure needs more flour. On the upside has a good flavor. We used HoneyCrisp, Gala, MacIntosh and some sort of fancy apple. Just disappointed it was runny."
162,8,6086,Apple Pie,sp_aUSaElGf_6086_c_145737,u_1oKVawFTOHfRH26YcGxCOhAZ2D4,mrs._white,10,1622717075,0,0,0,4,100,"Good flavor, but very runny."
163,8,6086,Apple Pie,sp_aUSaElGf_6086_c_202259,u_1oKYR3orccnfrQlfEnsgVBltA5N,RJCooks,1,1622717339,0,0,0,5,100,"I never  write reviews, but this pie was awesome! It was quick and easy to make and had the perfect combination of spices. Also, for those of you who were wondering, you&#39;d need about 5 regular sized apples.The only thing I would change is the sugar, it was a bit too much for my family. I would cut one of the sugars in half, also I did not listen others and increase the flour, but It may have helped the runnyness. It was not runny per say but could have used a bit of extra thickener.  Lastly I made this in a regular round metal cake pan with the same cooking time and it worked out great. Thanks for a lovely recipe!*I used criscos no fail pie crust recipe"
164,8,6086,Apple Pie,sp_aUSaElGf_6086_c_211183,u_1oKYH11GhPeFjmW24x7pduIONTe,turnipking,1,1622717344,0,0,0,5,100,"I used all granny smiths, which weighed 2.97 lbs. The spices and sugar amounts were right on, actually perfecto!  Sliced apples real thin, about 1/16 inch or so. Increased flour to 5 tblsps. Consistency of cooked mixture was very nice. My supreme critic, Wifey, said she would have used a couple of Macs or Fujis, thought a couple of apple slices were a little hard - though she gobbled it down. First time for me with a two crust pie. Will add a Fuji or two in the next attempt with this wonderful recipe.Which will be soon. With ice cream maybe? Perfect on its own.  I used a &#34;1-2-3&#34; crust recipe listed on the net. Excellent and easy pie crust recipe."
165,8,6086,Apple Pie,sp_aUSaElGf_6086_c_193412,u_1oKVZagX4nkLravRce6v3sDjTYT,Worshipguy,1,1622717271,0,0,0,5,100,I made this for a pie auction at church and it had the room buzzing!  The winning bidder told me later in the week that it was fantastic!
166,8,6086,Apple Pie,sp_aUSaElGf_6086_c_245110,u_1oKVmJgH4nT2KdUohI764LmOt9Q,Pinz,1,1622717560,0,0,0,3,100,May I request the complete recipe for the double crust?
167,8,6086,Apple Pie,sp_aUSaElGf_6086_c_342932,u_1oKbBtXxfwGIFgyhfJXxM2wyi26,vv0620,1,1622718048,0,0,0,5,100,This was the best pie ever. Easy to follow and easy to modify to own tastes (less sugar).Thank you.
168,8,6086,Apple Pie,sp_aUSaElGf_6086_c_143480,u_1oKWNBhp5zHCfTrv2HiUuzKDTHd,xrdixiechick,1,1622717049,0,0,0,3,100,"Followed the recipe word for word.  I let the pie cool over night, but it was runny!!! The flavor was great though! Guess I should have listened to other reviews, and added extra flour."
169,8,6086,Apple Pie,sp_aUSaElGf_6086_c_323974,u_1oKYgg9p2NctU9rPCljbl0jxNiw,7-Jan,1,1622717936,0,0,0,5,100,This recipe is AWESOME!!!! Simple and easy to follow directions.
170,8,6086,Apple Pie,sp_aUSaElGf_6086_c_337103,u_1oKVlSUIbWEOUoajBNtwpsR6ElO,wombie,1,1622718034,0,0,0,5,100,This was fabulous! Thank you for sharing
171,8,6086,Apple Pie,sp_aUSaElGf_6086_c_202312,u_1oKVcMcMkRngfkIFFw9fM00Gtbc,Timbergurl1,1,1622717332,0,0,0,4,100,"I never thought to put ginger in my apple pie. Pumpkin pie, sure, but NEVER apple. Then this recipe came along and showed me another way. It&#39;s SO yummy! It seems like an insignificant amount, but the ginger really adds some zing!"
172,8,6086,Apple Pie,sp_aUSaElGf_6086_c_238108,u_1oKYZzPHZ1UDGyJhWbxwmarwPOv,MommaPoppaLoosa,1,1622717510,0,0,0,5,100,Loved this!  It&#39;s beautiful to look at and so tasty too!
173,8,6086,Apple Pie,sp_aUSaElGf_6086_c_141914,u_1oKVeN9YNf07RT0P9R63Yu80P5A,JGa2595176,1,1622717025,0,0,0,5,100,"FANTASTIC! Made this for Thanksgiving dinner this year, after family agreed they wanted an apple pie. The filling set up perfect, so cut like  a dream. I loved the spice and sugar levels, was just perfect. Will be adding to my go-to list of desserts. :)"
174,8,6086,Apple Pie,sp_aUSaElGf_6086_c_171159,u_1oKW7JMyF88quMKaenLw0sr2C4X,TamiMP,1,1622717179,0,0,0,5,100,I had to use orange juice instead of lemon and I added 1/2 cup blueberries it was a great recipe
175,8,6086,Apple Pie,sp_aUSaElGf_6086_c_114594,u_1oKVbiY02JDASKfseeHkg0o1mYk,missrookie,1,1622716913,0,0,0,5,100,Am I the only one who cannot see what temperature to bake this at?
176,8,6086,Apple Pie,sp_aUSaElGf_6086_c_137381,u_1oKVzslhE1CdL8tf8Z03mQnJFuc,Machka1,1,1622717001,0,0,0,5,100,Excellent flavor! Everyone loved it.
177,8,6086,Apple Pie,sp_aUSaElGf_6086_c_133159,u_1oKW0J4JDQnCwK7RYpyXsVBg9Ql,artcor,1,1622716997,0,0,0,4,100,"Easy to follow recipe. Very easy prep, &amp; we baked a perfect home made apple pie. The entire house smelled wonderful! I highly recommend this recipe for the novice baker, along with accomplished bakers as well. We were very happy with the results.  We used a mixture of granny smith apples and fuji apples. It was beautiful,and tasted just as great! Highly recommend for anyone who wants to impress their family with a gorgeous, homemade pie. PS. It was just as good cold the next day, or even reheated in the microwave. I felt proud of our efforts. Sincerely, Mrs. Vance"
178,8,6086,Apple Pie,sp_aUSaElGf_6086_c_274986,u_1oKVatDcZOM2AvL566QyqUR7ofD,kbabe819,1,1622717686,0,0,0,5,100,So good.  And I even forgot to dot with the buter before adding the top crust! Rave reviews from entire family.
179,8,6086,Apple Pie,sp_aUSaElGf_6086_c_196251,u_1oKXnhWEic9OE17m1k7xY2IkAch,jabelb,1,1622717312,0,0,0,3,100,"I made this pie, the taste was excellent but it was so runny.  I went back through recipe to see if I missed anything but I hadn&#39;t.  Any idea why.  The apples were soft but still in shape."
180,8,6086,Apple Pie,sp_aUSaElGf_6086_c_168673,u_1oKVZouKxf9kEgBI2iNLhgLJaQW,NanZim,1,1622717164,0,0,0,5,100,I forgot to click on the stars to rate this recipe when I wrote my review.  I give it 5 yummy stars.
181,8,6086,Apple Pie,sp_aUSaElGf_6086_c_319129,u_1oKVZouKxf9kEgBI2iNLhgLJaQW,NanZim,1,1622717902,0,0,0,5,100,This is the first dessert our guests grab at our Labor Day barbecue.  I bake 2 of these delicious apple pies and they are gone almost as soon as I put them on the table.
182,8,6086,Apple Pie,sp_aUSaElGf_6086_c_201115,u_1oKViA7uuo4EoAN4PdjL19E3UOM,BakerAtHome,1,1622717306,0,0,0,5,100,I make this pie with soft white wheat flour and replace the sugar with succannot. EVERYONE LOVES it and we don&#39;t have to feel to guilty.:) I have made it for church and it is always gone.
183,8,6086,Apple Pie,sp_aUSaElGf_6086_c_308362,u_1oKVk3ueejaN7hOQ49mJNJTaId5,22susan,1,1622717871,0,0,0,5,100,"This is a very easy apple pie and delicious. I use orange juice if I don&#39;t have lemon . It is a good pie to make an impression, if you are a first time pie maker. The pie crust from a box is tasty. I have made this apple pie recipe a few times ."
184,8,6086,Apple Pie,sp_aUSaElGf_6086_c_251369,u_1oKVl0dXi4zeo9vKihLOIIhNE9Z,Pie_Pie_Pie,1,1622717563,0,0,0,5,100,"My first apple pie &amp; my lifelong recipe. Be sure to COOL COMPLETELY before slicing! I used this filling in empanadas &amp; wontons, too!"
185,8,6086,Apple Pie,sp_aUSaElGf_6086_c_345473,u_1oKXCi55oLE8g9PGfKrgaF8meX4,LCS456,1,1622718054,0,0,0,5,100,This will be my new go-to apple pie recipe - it&#39;s great!  I used all Granny Smith apples and added two extra tablespoons of flour as recommended here by some and it came out perfect.  I served it with a scoop of vanilla ice cream and a drizzle of caramel sauce and it was a huge hit!
186,8,6086,Apple Pie,sp_aUSaElGf_6086_c_138509,u_1oKW6A2FGpKXOTV8sfwY5MvSAnD,astrogea,1,1622717018,0,0,0,5,100,Excellent taste. Totally worth trying. Definitely a classic.
187,8,6086,Apple Pie,sp_aUSaElGf_6086_c_220743,u_1oKVaXcpN0u6QpaTrWEsZp69OSk,annaf27,1,1622717440,0,0,0,5,100,"I&#39;ve used this recipe for the last two Thanksgivings and it comes out great!  I read the reviews and decided to scoop the apples out of the large bowl, instead of pouring them.  That kept the pie from being too soupy.  This recipe is a keeper!"
188,8,6086,Apple Pie,sp_aUSaElGf_6086_c_310228,u_1oKZXIaYqG0ohLTGwvH0fmmEgMj,Hmf917,1,1622717897,0,0,0,5,100,This is an amazing Apple Pie - it is yummy and reheats very well! A big hit at our New Year&#39;s Eve party. Will repeat recipe for the next family/friends event. Highly recommended!
189,8,6086,Apple Pie,sp_aUSaElGf_6086_c_219964,u_1oKVvsDgqfwQCpwULR9umvDiP5Y,hannahjw88,1,1622717462,0,0,0,5,100,"I&#39;ve made this pie twice now and it was delicious both times! One variation that my dad remembers from his childhood is to use an oatmeal crisp on top rather than a second pie crust. I used the crisp recipe from this site &#34;Winning Apple Crisp&#34; but made the rest of the pie as directed on this site, covering the entire pie for the first 20 minutes. Incredible!"
190,8,6086,Apple Pie,sp_aUSaElGf_6086_c_242882,u_1oKVpMcYOEFSSvnHv1EyjSkJ31I,farm diva,1,1622717526,0,0,0,5,100,"Made this pie for Thanksgiving, was going to make a pumpkin pie, but then my son-in-law gave me some apples, so made this one instead, and everyone loved it."
191,8,6086,Apple Pie,sp_aUSaElGf_6086_c_196131,u_1oKWUk9VUaVeYzwsLj79ySq5amU,Santa O'Neill,1,1622717290,0,0,0,5,100,I made this pie for thanksgiving dinner. It was great. Will make it again.
192,8,6086,Apple Pie,sp_aUSaElGf_6086_c_197159,u_1oKXb8Jgseu4TfMI5nbPhfymwnJ,LonnaOLeary,1,1622717316,0,0,0,5,100,I made this recipe for Thanksgiving and found it to be the absolute best apple pie I have ever tasted. Thank you for sharing this fantastic recipe.
193,8,6086,Apple Pie,sp_aUSaElGf_6086_c_223549,u_1oKZ33BAfAj4ZsrsiinnRdkp0CB,nutsfromnam,1,1622717451,0,0,0,5,100,instead of all tart apples I used granny smith buabaum abd fujie apples and increast the cinnimon to 1 1/2 teaspoons turned out fantastic
194,8,6086,Apple Pie,sp_aUSaElGf_6086_c_182279,u_1oKXFxbl5Zeded6MkxgUGEwd5rQ,kasper2007,1,1622717241,0,0,0,5,100,I lost my Mom&#39;s recipe and tried this one.  It was easy to make and had great flavor.  My fiance went back for a second serving so I know it was good!
195,8,6086,Apple Pie,sp_aUSaElGf_6086_c_256871,u_1oKVZhrnNwRcxmUDVcErr7TGlOt,VictoriaElaine,1,1622717613,0,0,0,5,100,"My review didn&#39;t show the 5 stars I gave this recipe, so resubmitting."
196,8,6086,Apple Pie,sp_aUSaElGf_6086_c_191498,u_1oKVZhrnNwRcxmUDVcErr7TGlOt,VictoriaElaine,1,1622717269,0,0,0,5,100,I made this at the spur of the moment for company today.  I had the pie prepared &amp; in the oven in less than an hour.  I used the silicone pie crust protector that I got from the Shop Taste of Home web site &amp; it worked great!  My pie turned out perfect &amp; the only thing I will change next time is I will bake it just a tad longer or maybe at a slightly higher temp as I am at a high altitude.
197,8,6086,Apple Pie,sp_aUSaElGf_6086_c_331798,u_1oKVdpotk8j55JIT4Cm4cmfip9q,pinkiepie,1,1622718003,0,0,0,5,100,This turned out great family loved it and like another person I forgot the butter too.  It was still great with out it.  Would be really good with homemade whip cream.
198,8,6086,Apple Pie,sp_aUSaElGf_6086_c_169676,u_1oKXA0YfhK5Oe0E5sRS9scwUIxg,darb922,1,1622717162,0,0,0,5,100,I get asked for this recipe all the time!
199,8,6086,Apple Pie,sp_aUSaElGf_6086_c_188319,u_1oKVZmwriM0KG2XqP8kbU6HI0zG,carolynstowers,1,1622717253,0,0,1,5,100,I made the Apple Pie today. Came out ok. I read the other reviews several cooks said they added additional flour to thicken the mixture. I used granny smith apples so they don&#39;t produce a lot of juice so I didn&#39;t need the addition flour that is required in with more juicy apples. I did find the pie was a bit too sweet. My fault again I should have tasted my apples.
200,8,6086,Apple Pie,sp_aUSaElGf_6086_c_199571,u_1oKX8pDN4UhAf6IFnVy9Pcsio7h,gory,1,1622717332,0,0,0,5,100,I maid this for my brother and  sister in law but as I was putting it in I realizedthat I forgot the butter.They said that it was the best apple pie that they ever had.(I still think that it could of used butter:)
201,8,6086,Apple Pie,sp_aUSaElGf_6086_c_157371,u_1oKWx5cgf7fncDAhGq38ZqeJ80N,mkencat143,1,1622717102,0,0,0,5,100,I add some oatmeal to absorb some of the juice.
202,8,6086,Apple Pie,sp_aUSaElGf_6086_c_274454,u_1oKVqm9yMaMhX7l5hQOn01OGtwV,SassyLacey,1,1622717685,0,0,0,5,100,So good and so easy.  My husband loves it so It is definitely a keeper.  I used green apples since that was what I had on hand and they were delicious.
203,8,6086,Apple Pie,sp_aUSaElGf_6086_c_347640,u_1oKVajU5l9y7amO5mdzrW39uc3T,deannasnz,1,1622718090,0,0,0,5,100,Truly delicious.  I&#39;ve found my favourite pie recipe.
204,8,6086,Apple Pie,sp_aUSaElGf_6086_c_159571,u_1oKWtT2VM0qLuH3l9xBzzzMfWJM,dstrader,1,1622717105,0,0,0,5,100,I also use the additional 3 Tablespoons of flour.  I also normally use two or three different kinds of apples.  This is by far our favorite recipe!
205,8,6086,Apple Pie,sp_aUSaElGf_6086_c_354787,u_1oKVgHiCC1CvJytvtZiVsL01Gap,Green.devonna,1,1622718101,0,0,0,5,100,Very good!! First apple pie I made..definately will make again!
206,8,6086,Apple Pie,sp_aUSaElGf_6086_c_319123,u_1oKY3rtdJx31ygHwZ4iAqNhsA2s,Diane Cormack,1,1622717899,0,0,1,5,100,"This is the first apple pie I have made and it got rave reviews.  I went by the recipe using 7 cups of apples. I used half Gala and half Braeburn and sliced them pretty thin.  I found the pie to be a good consistency, not runny at all, even after cutting, the filling does not run out in the empty area."
207,8,6086,Apple Pie,sp_aUSaElGf_6086_c_239595,u_1oKa0i2nt3h5FC37C9tvwUQU2dJ,granny2many,1,1622717515,0,0,0,5,100,"Made only one of these pies for Thanksgiving. I cut it into tiny slices so that none would be wasted by my grandchildren and great-grandchildren. Only those who were at my house first got any! My son who does not care for sweets ate about half of the pie. His son who does not like apple pie ate two slices of it and loved it. The rest of us got a sliver of it and wanted more!! I made it with Splenda in place of the sugar as my husband and I are diabetic. Needless to say, I am making at least three or four of these pies for Christmas. I am sure there will be none left over!!"
208,8,6086,Apple Pie,sp_aUSaElGf_6086_c_243481,u_1oKZGjLPX4oI4ZcwDvL25nqtc80,memere0211,1,1622717538,0,0,0,5,100,Made this recipe today to take to friends&#39; for dinner.  She&#39;s diabetic so swapped out the sugars for Splendas &amp; added 5 T. of flour - got 2 thumbs up!!!  It set up beautifully!  Everyone loved it (better than my mom&#39;s &amp; i didn&#39;t think that was possible!!).  Definitely a keeper!!
209,8,6086,Apple Pie,sp_aUSaElGf_6086_c_322170,u_1oKXw7hLvjplrgpZUE3juD7bjTV,sflg,1,1622717952,0,0,0,5,100,This pie filling is the best I have ever had....and I didn&#39;t use a regular pie crust...I used the pie crust from the Dutch Apple Pie recipe...to die for!!!!
210,8,6086,Apple Pie,sp_aUSaElGf_6086_c_319358,u_1oKbKokKiH0iRuwUiU5Kib2RV2j,Sipycup22,1,1622717939,0,0,0,5,100,"This is the first Applie Pie I have ever made, and I recieved many compliments from it.I did additional flour as the reviews had said.One family member actually said that it tasted just like Grandma&#39;s pies used to.... that is the best compliment anyone could give me! =)I will definatley make it again."
211,8,6086,Apple Pie,sp_aUSaElGf_6086_c_202220,u_1oKYPg0ZKw718HnDkZZ09cBgMUN,JaneneAnne,1,1622717328,0,0,0,5,100,"I never made an apple pie before so this was my first attempt.  Everybody loved it!  In fact, I&#39;ve made this 4 times in just 2 weeks."
212,8,6086,Apple Pie,sp_aUSaElGf_6086_c_197045,u_1oKX8QND5w8IBf9nUAM7OFNbOkR,Viviant73,1,1622717317,0,0,0,5,100,"I made this recipe for the first time on Thanksgiving this year. I had read through the reviews and I added 3 tbs of flour to the dry mix. After tossing the apples there was still some mixture left in the bowl, which I proceeded to sprinkle evenly over the apples before placing top crust. It came out great. It was my first time making apple pie myself and this was as easy as can be. I will definitely make this one again. I did not find it too sweet at all, but I will try different apples with it as the Granny Smiths I used were really tart. The sweetness is a matter of taste. Thank you for sharing this recipe."
213,8,6086,Apple Pie,sp_aUSaElGf_6086_c_361244,u_1oKaIVXPpNfB29g4uruVdZvshoE,oneproudmom,1,1622718124,0,0,0,1,100,Way to watery.
214,8,6086,Apple Pie,sp_aUSaElGf_6086_c_332659,u_1oKVrQKUk45OwfHipN29hHUqkiD,Coolchikaboom,1,1622718011,0,0,0,4,100,"This was a great recipe and really easy to make! I used granny smith apples. It was a little sweet but by reading other reviews, maybe I will add a little mor flour next time. Yum!"
215,8,6086,Apple Pie,sp_aUSaElGf_6086_c_113827,u_1oKVevUOcSbRecVa1qjeE1n8WGi,treek73,1,1622716913,0,0,0,4,100,"All in all, it&#39;s a good pie. The 5 stars deceived me though.  It&#39;s way, way, way too runny.  I should have read the reviews in addition checking the star rating.  So if you&#39;re getting ready to bake this pie, do NOT dump the coated apples onto the pie crust under any circumstances (unless you like apple pie soup)."
216,8,6086,Apple Pie,sp_aUSaElGf_6086_c_204964,u_1oKWVvfr89AqBEiDBIWDlVwm9jb,sksand,1,1622717339,0,0,0,5,100,"I recently went to an apple festival in NC. I had never made a pie before, any pie, and wanted to give it a try. I used honey crisp apples from Grandads Farm and a pie crust recipe from this site. I carefully followed all directions. Absolutely wonderful!"
217,8,6086,Apple Pie,sp_aUSaElGf_6086_c_236163,u_1oKZ8ateCWWaZPieFr0laQ5i4UM,tracyjacobs007,1,1622717506,0,0,0,5,100,Loved it and so did everyone that tried it.  Great thank you!
