Unnamed: 0,recipe_number,recipe_code,recipe_name,comment_id,user_id,user_name,user_reputation,created_at,reply_count,thumbs_up,thumbs_down,stars,best_score,text
144,20,6504,Mom’s Meat Loaf,sp_aUSaElGf_6504_c_118978,u_1oKVgYHP5WfWWw480iUZQBHqO1A,CookinLovin,1,1622716932,0,0,0,5,100,"Been making meatloaf this way for years, except I use 1 1b ground beef and 1/2 lb ground pork.  I add a little minced celery and saute them with the onions and clove of garlic to soften them up as we don&#39;t like crunchy veggies in meatloaf. I also use crushed onion crackers vs saltines and add a pinch of dried mustard. Excellent meatloaf."
145,20,6504,Mom’s Meat Loaf,sp_aUSaElGf_6504_c_228640,u_1oKXoCyDGMaluBHTp5ySnsfJIJF,sg29,1,1622717470,0,0,0,5,100,I&#39;ve been making this recipe for years.. Won&#39;t make any other meatloaf but this one.  Plus it&#39;s so easy to put together.  Everyone loves it just the way it is.    Delicious
146,20,6504,Mom’s Meat Loaf,sp_aUSaElGf_6504_c_210687,u_1oKXxo0LGOWmQBqIi04SetEw8iR,mickey110257,1,1622717344,0,0,0,5,100,"I use this same recipe except I exchanged the saltines with oatmeal, and instead of Worcestershire sauce I use mustard, I use ground turkey instead of beef. My family loves it. Thanks for sharing."
147,20,6504,Mom’s Meat Loaf,sp_aUSaElGf_6504_c_285488,u_1oKVZangmN67bJNxpyD1j55VJCj,tsuop,1,1622717768,0,0,0,4,100,"The only thing I changed was half the sugar, I don&#39;t like sweet meat.    YUM!!"
148,20,6504,Mom’s Meat Loaf,sp_aUSaElGf_6504_c_228711,u_1oKWe1BAKuSgInmbgvS5atRrqAw,Ivyscaped,1,1622717439,0,0,0,5,100,"I&#39;ve been searching for a meatloaf as good as Grams used to be and this is it! Moist flavorful and thumbs up from the whole supper table! Only changes I made were used 2lbs of 80/20 ground beef because that&#39;s what I had and omitted the sage because I didn&#39;t have any, it still turned out delicious! Thanks for sharing this is a keeper!"
149,20,6504,Mom’s Meat Loaf,sp_aUSaElGf_6504_c_242052,u_1oKY5CJ2aLdQyImmB76cWw0HoBx,jen623,1,1622717545,0,1,0,5,193,"Made this for my family tonight &amp; it was a hit! Future husband told me it was better than his mom&#39;s :-)  super easy to make as well, will definitely be my go to meatloaf recipe!"
150,20,6504,Mom’s Meat Loaf,sp_aUSaElGf_6504_c_211240,u_1oKVrMA8t4zPd9w5iIY6rABWjRt,Yourmom242,1,1622717378,0,0,0,5,100,"I used a little bit of ground pork with the ground beef and used poultry seasoning instead of sage... I didn&#39;t think such a simple meatloaf recipe would come out so simply DELICIOUS!!!  So much more easier than the meatloaf I usually make, this is ridiculously good!!!  My family loved it!!"
151,20,6504,Mom’s Meat Loaf,sp_aUSaElGf_6504_c_173176,u_1oKWtYWXsQ4SdY4tBua57NVygPO,Sally65,1,1622717167,0,0,0,5,100,"I have been using this meatloaf recipe for almost 17 years now, and there are never any leftovers!!! I have played with it some over the years and it can be as sweet as you want it to be or just use less of the brown sugar. My family loves this recipe, thank you for sharing."
152,20,6504,Mom’s Meat Loaf,sp_aUSaElGf_6504_c_118174,u_1oKVv9HdHGNJrVJkXNLqYeoKQwj,radavlin,1,1622716930,0,0,0,1,100,Awful to sweet
153,20,6504,Mom’s Meat Loaf,sp_aUSaElGf_6504_c_175768,u_1oKWC9J6Q9jrp30w0xm4qVe8Z2p,Salbo,1,1622717195,0,0,0,5,100,I have made this recipe for several years! sometimes I add grated cheese inside. sometimes I make into about 7 or 8 small loaves and bake about 45 minutes when I&#39;m in a hurry.
154,20,6504,Mom’s Meat Loaf,sp_aUSaElGf_6504_c_175424,u_1oKXb3ugINHinzB0p8Vdbd7zUQu,Micahman07,1,1622717192,0,3,0,5,297,I have made this meatloaf for years.  I have 5 boys and double the recipe.  We never have leftovers!  I also made this for my parents 50th wedding anniversary party (50 people) everyone loved it and wanted the recipe.  This is the best meatloaf ever.  Would not understand how someone would not like it.
155,20,6504,Mom’s Meat Loaf,sp_aUSaElGf_6504_c_269738,u_1oKWkq6LCvj58L8XvMnO2HZHqYP,myziggygirl,1,1622717686,0,1,0,5,193,"Really good!!!! I didn&#39;t have any cracker&#39;s so I used breadcrumbs, also only one egg. Turned out GREAT"
156,20,6504,Mom’s Meat Loaf,sp_aUSaElGf_6504_c_320576,u_1oKW7yN9RJAYxle84piFTWh8neZ,whymessz,1,1622717927,0,0,0,5,100,"This is very tasty!  We both loved it.  I used club crackers in place of saltines, 1/2 tsp salt, 1 tsp pepper, minced garlic cloves (2-3) and used 2 to 2-1/2 lbs meatloaf mix and 1 lb 80/20 ground beef.  I have tried so many recipes for meatloaf but this is my go to now."
157,20,6504,Mom’s Meat Loaf,sp_aUSaElGf_6504_c_335342,u_1oKbli7JnNRjG0RPvGpqRPpep0Y,alliec1224,1,1622718029,0,0,1,1,100,This was AWFUL!!! My husband loves meatloaf so I thought I would give this recipe a go. I couldn&#39;t finish my meal &amp; he proceeded to throw away the leftovers. Thanks for the $12 waste!!!
158,20,6504,Mom’s Meat Loaf,sp_aUSaElGf_6504_c_345836,u_1oKWBKJYT3hzVeQSrO8gyCFy1hQ,bbunkowske,1,1622718069,0,0,0,4,100,"To &#39;buddystar&#39; - rubbed sage is just crushed sage that is rubbed between your fingers and then added to your mix.  This is a very good recipe, but I omit the sage; but at times I will add some chopped green pepper."
159,20,6504,Mom’s Meat Loaf,sp_aUSaElGf_6504_c_333451,u_1oKW6duXF00GrR75ADjarJYuqW1,Disir,1,1622717991,0,0,0,4,100,This was a pretty good meatloaf.  I usually don&#39;t like putting raw onion in meatloaf (want to saute it) but this came out really well.  Will definitely make it again.
160,20,6504,Mom’s Meat Loaf,sp_aUSaElGf_6504_c_140506,u_1oKWO7DHOhMhDv12P6w3XLI14EN,Soonerdevil,1,1622717032,0,0,0,5,100,Excellent
161,20,6504,Mom’s Meat Loaf,sp_aUSaElGf_6504_c_254381,u_1oKYWXMfjsb4xrrMgN3kXZU2dez,annettedilley,1,1622717604,0,0,0,5,100,"My husband loves meatloaf, this is the first one I have made that his loves"
162,20,6504,Mom’s Meat Loaf,sp_aUSaElGf_6504_c_219986,u_1oKY1MvPbDvh01yJ8ShP2NtPefK,kknight65,1,1622717410,0,0,0,5,100,I&#39;ve made this meat loaf several time &amp; never have any left over&#39;s.. If I don&#39;t have crackers I use oatmeal or break up bread &amp; add a little garlic salt..I add ketchup in meat &amp; top off with sugar &amp; ketchup on top &amp; bake. .very good ! *****
163,20,6504,Mom’s Meat Loaf,sp_aUSaElGf_6504_c_368942,u_1oKb31FPzHeMZ3fdkb5AL00TJDB,BuddyStar,1,1622718189,0,0,0,5,100,What is &#34;rubbed sage?&#34;
164,20,6504,Mom’s Meat Loaf,sp_aUSaElGf_6504_c_163825,u_1oKWD9ZKpnurISFlEfrP2CSgMmV,dezaraesorganics,1,1622717131,0,0,0,5,100,"I did make some alterations to this recipe, first change was I used Almond milk (used Original, that is what I had on hand) because I have a son highly allergic to dairy milk, then the 2nd change is that I added about 1/4 cup of A1 sauce to the ketchup mixture to add a little more of a kick.I absolutely love the way it turned out. If you need to substitute the milk because of allergies, this is a great recipe."
165,20,6504,Mom’s Meat Loaf,sp_aUSaElGf_6504_c_252399,u_1oKZjIxSdSBHrS1MEAUQ1HbMR21,HRGSCS,1,1622717576,0,0,0,5,100,"My husband and I have been together for 11 years and I have only made meatloaf once or twice.  He loves meatloaf, but I hate it...until now. The recipe is simple to make and full of flavor. My husband requested that I make it once a week. I also cooked this recipe for a family get-together and everyone kept telling me how good it was! Next day leftovers are amazing too."
166,20,6504,Mom’s Meat Loaf,sp_aUSaElGf_6504_c_185277,u_1oKXmUewn2jk3z5GaRsTZ8pYoQy,12Shirley12,1,1622717246,0,0,0,5,100,"I love this recipe.... I accidentally added all ingredients together......topping and all.  It was too moist but my family loved it.   Next time I still put all ingredients together.....just cut back on the ketchup.  The flavor were great together...  Brown sugar, sage and  ketchup.  It is our family favorite.  Out of mistakes comes something awesome."
167,20,6504,Mom’s Meat Loaf,sp_aUSaElGf_6504_c_279451,u_1oKZRLkluDEmLadaAqWajRfLJWi,super grammy,1,1622717753,0,0,0,5,100,Tasted just like my mother mae it. Good memory
168,20,6504,Mom’s Meat Loaf,sp_aUSaElGf_6504_c_180531,u_1oKWEIri8hO8nKASzKFs9owKISt,Sandybeach6565,1,1622717236,0,0,0,5,100,I just made this today and it came out perfect! I will never need to try another meatloaf recipe. My husband loved it! This is my first review...I joined just to tell you how good this meatloaf and sauce was. Thanks for sharing it.
169,20,6504,Mom’s Meat Loaf,sp_aUSaElGf_6504_c_126237,u_1oKVomAo60WWFGTqAAiigq1r1rI,Mom_ForLife,1,1622716966,0,0,0,5,100,"Delicious!  Made this for the first time today (doubled the recipe) and my husband said he could eat an entire loaf himself.   My 11 year old son was amazed about how much he liked it .  In fact, he said, &#34;...Mom, I want you to make that meatloaf for my birthday!&#34;  For the sauce, I didn&#39;t have ketchup, so I used tomato sauce instead and cooked the sauce for a few minutes on the stove  to thicken it a bit before spreading on the meatloaf."
170,20,6504,Mom’s Meat Loaf,sp_aUSaElGf_6504_c_304604,u_1oKXYnB6KYePVfNZ1VysasYi8aQ,Dutchess83,1,1622717857,0,0,0,5,100,This is a delicious tender meatloaf.  I am not a fan of  ketchup on meatloaf but loved this one-the brown sugar and worcestershire sauce make all the difference.  Its our family&#39;s favorite meatloaf recipe.
171,20,6504,Mom’s Meat Loaf,sp_aUSaElGf_6504_c_178438,u_1oKX5WmAwMuvbVgD4foQacGz93u,KristiCooke,1,1622717216,0,0,0,5,100,"I have tried so many good meatloaf recipes, but this one is soooo delicious!!!  I will definitely be making this one more often.  So easy and the house smells wonderful while it&#39;s cooking!"
172,20,6504,Mom’s Meat Loaf,sp_aUSaElGf_6504_c_309744,u_1oKVtKkG69EZIRET92IBeZ4fDMf,kcrihfield89,1,1622717872,0,0,0,5,100,This is a yummy classic meat loaf recipe.  Who doesn&#39;t love a classic meat loaf?!
173,20,6504,Mom’s Meat Loaf,sp_aUSaElGf_6504_c_321680,u_1oKXGZCEwTbaSCGEn0JQ40s8L4n,bablack,1,1622717945,0,0,0,5,100,This meatloaf is out of this world! I did use breadcrumbs instead of saltines since I didn&#39;t have any in the house and it still came out beautifully. I will make this again and again for my friends and family!
174,20,6504,Mom’s Meat Loaf,sp_aUSaElGf_6504_c_342326,u_1oKaPnowUVFUwxMMYEwfPeut4Wl,alyssa.dannielle,1,1622718012,0,0,0,5,100,This was SOO good and so easy! First time I&#39;ve ever made meatloaf and it came out excellent. Can&#39;t wait to make it again. Oh and i doubled the Worcestershire bc we love it so much haha
175,20,6504,Mom’s Meat Loaf,sp_aUSaElGf_6504_c_350968,u_1oKVbHqc4psEbzrHssOTHIBaO9t,jfurnas,1,1622718104,0,0,0,5,100,"Very easy to make and will definitely make it again.  It makes a lot of sauce for the top, so the second time I made it, I cut the sauce part in half and still had plenty for the top of the meatloaf."
176,20,6504,Mom’s Meat Loaf,sp_aUSaElGf_6504_c_273370,u_1oKabmB1eOVNuJXxQl3ga4OITGR,lizp909,1,1622717722,0,0,0,5,100,So delicious made with ground turkey!  I also placed some sliced pickled jalapenos on the meatloaf before pouring on the sauce!  YUM!
177,20,6504,Mom’s Meat Loaf,sp_aUSaElGf_6504_c_195776,u_1oKX6mna0O18cv2k6eD9E8QtUvC,writeaway,1,1622717311,0,0,0,5,100,"I made this meatloaf recipe (times 2) and some mac &#39;n&#39; cheese to send to two different families who are coping with sick loved ones. I was a little nervous because I hadn&#39;t made it before. I cut it into nice slices before packaging it up for sending, which allowed me to taste a slice first. It was delicious! Both families prefer simple, home-cooked foods and this was just the ticket. When I told my sister about the recipe, she reminded me that our Mom used to use crumbled saltines in her meatloaf way back when...! I only made a couple of slight variations to the recipe here. I used 2 lbs of ground round and I added about 1/3 of a packet of Lipton Onion Soup mix to the recipe (something my Mom always used in meatloaf. I also only made up a half-quantity of the topping sauce because I didn&#39;t send any with the meatloaf for serving.  I kept a couple slices behind for dinner that night and my husband asked for seconds (there weren&#39;t any!).  He doesn&#39;t even usually like meatloaf!"
178,20,6504,Mom’s Meat Loaf,sp_aUSaElGf_6504_c_219434,u_1oKZ2X3joZuNOFNVjF15FC1aC29,Marty D.,1,1622717428,0,0,0,5,100,"I&#39;ve been making this recipe for years, and everyone loves it. It&#39;s easy, uses ingredients I usually have on hand, and is great left over. The only thing I change is that I usually add either fresh garlic or garlic powder."
179,20,6504,Mom’s Meat Loaf,sp_aUSaElGf_6504_c_314436,u_1oKZgRYrbqZReY2Kajj12Y7XdnM,Rileysmom39,1,1622717921,0,0,0,5,100,This is my most requested dish. When I tell everyone I am making meatloaf the first time they are not so excited but once they eat it they are mad at me if I dont invite them over when I make it.
180,20,6504,Mom’s Meat Loaf,sp_aUSaElGf_6504_c_152276,u_1oKVh5D1KoqTVfWyUUiSfdXoba8,lberry222,1,1622717088,0,0,0,4,100,Great!
181,20,6504,Mom’s Meat Loaf,sp_aUSaElGf_6504_c_159791,u_1oKVyXIHd9DmEQxtdTcQr1sUcTd,FrHornist,1,1622717105,0,0,0,5,100,"I always cut the topping down by half because I&#39;ve found it to be more than enough to cover the meatloaf and still leave some extra for a topping after it cooks.Also, since I usually don&#39;t have sage handy, I substitute 1/4 tsp. thyme, 1/4 tsp. oregano, and a few pinches of dried parsley.Oh, and the more onion, the better!"
182,20,6504,Mom’s Meat Loaf,sp_aUSaElGf_6504_c_137630,u_1oKVztZtxxw1k9q7zg02DZKS4dR,Delores14,1,1622717014,0,0,0,5,100,Excellent meat loaf recipe. I made a few adjustments to sub for ingredients I had on hand: garlic &amp; herb breadcrumbs for saltines; garlic powder for sage; honey bbq sauce for ketchup. Also added bacon strips to the top before backing. Both my husband and seven year old love it!
183,20,6504,Mom’s Meat Loaf,sp_aUSaElGf_6504_c_149532,u_1oKVa2T2GRB9bmCJ0R5edTbAKwr,Suzzzannna,1,1622717072,0,0,0,5,100,"Great recipe for a basic meatloaf. I used 2# hamburger and increased the other ingredients a little. I made 2 small loaves, and poured all of the sauce on top before I baked them. My family thought this was delicious. I&#39;ll definitely make this again."
184,20,6504,Mom’s Meat Loaf,sp_aUSaElGf_6504_c_205603,u_1oKXWhXhY0D2zBu7eV3Zh0SSEqh,larissa1216,1,1622717357,0,0,0,5,100,I served this at a dinner party and everyone loved it!  It was the best meat loaf I have ever eaten!  I don&#39;t think there was any left over.
185,20,6504,Mom’s Meat Loaf,sp_aUSaElGf_6504_c_158352,u_1oKVnCNuF3gMSKc109ouTzvcWRw,mrichards1993,1,1622717102,0,0,0,5,100,I added some diced celery and 1/2 tsp of garlic powder and substituted thyme for the sage (because I didn&#39;t have any sage).  It was very tasty and I will make it again.
186,20,6504,Mom’s Meat Loaf,sp_aUSaElGf_6504_c_321797,u_1oKVjNrywFg5dn7DTBvdV12Bidu,fallongrrl,1,1622717922,0,0,0,5,100,"This meatloaf is the best I&#39;ve ever had.  I made it one night, my mother doesn&#39;t even like meatloaf....but she loves this one!"
187,20,6504,Mom’s Meat Loaf,sp_aUSaElGf_6504_c_227251,u_1oKVaTPSHgkIpRiGEFaahLqvK69,ekatiakarpova,1,1622717458,0,0,0,5,100,It was very tasty.
188,20,6504,Mom’s Meat Loaf,sp_aUSaElGf_6504_c_193641,u_1oKWogHvgRqsG1S1FbYRBCmfN6F,lovelymomee,1,1622717305,0,0,0,5,100,I made this for dinner tonight. It was easy and perfectly done. All my family (even my 3 picky eating kids) loved it. I will definitely add this to my weekly recipes. :)
189,20,6504,Mom’s Meat Loaf,sp_aUSaElGf_6504_c_333088,u_1oKYNICr4ZlYD6Ar2awLsw08tpi,zinger01,1,1622717991,0,0,0,5,100,This was a hit with my picky eaters! Will definitely make this again.
190,20,6504,Mom’s Meat Loaf,sp_aUSaElGf_6504_c_141650,u_1oKVc55ShSKWXN7dxWHCQUrvB64,martylb,1,1622717037,0,0,0,5,100,Fantastic recipe.  Definitely a keeper.
191,20,6504,Mom’s Meat Loaf,sp_aUSaElGf_6504_c_128785,u_1oKVmRWnHO8aaUyUQDzArz208ac,blackoctober13,1,1622716982,0,0,0,5,100,Delicious. I added garlic powder and dried thyme. The sauce on top makes it special.
192,20,6504,Mom’s Meat Loaf,sp_aUSaElGf_6504_c_245917,u_1oKVbHqc4psEbzrHssOTHIBaO9t,jfurnas,1,1613040051,0,0,0,5,100,"<p>Moist and very tasty.  It makes a lot of sauce, so I cut the sauce portion of it in half and still had plenty of sauce.</p>"
193,20,6504,Mom’s Meat Loaf,sp_aUSaElGf_6504_c_145999,u_1oKVacBHwedX5Hf1nE0fWzDw1cz,lisa53202,1,1622717070,0,0,0,5,100,Good meatloaf!  My husband said it reminds him of his mother&#39;s meatloaf.
194,20,6504,Mom’s Meat Loaf,sp_aUSaElGf_6504_c_352712,u_1oKXyxsSRB2saqudCZw7ebBoIrK,judi5165,1,1622718074,0,0,0,4,100,Very good and very tasty.  I changed a little bit by replacing some of the crumbs with bran and added garlic.
195,20,6504,Mom’s Meat Loaf,sp_aUSaElGf_6504_c_140209,u_1oKW6kdcz9YvJRUKqmJCj7BXjCV,Tumbleweeds,1,1622717019,0,0,0,5,100,Excellent.  Just the right size for two people.
196,20,6504,Mom’s Meat Loaf,sp_aUSaElGf_6504_c_376381,u_1oKVsT7DAVrOpbmMDVAf6hPbbWj,kmfest2009,1,1622718183,0,0,0,5,100,"YUM YUM YUMMY Will make again, I also didn&#39;t have an onion on hand so we used dried minced onions that you get off the spice aisle(The conversions were on our bottle). Great to make if you have are running low on ingredients to make most other ground beef recipes :D"
197,20,6504,Mom’s Meat Loaf,sp_aUSaElGf_6504_c_257486,u_1oKVdjz8a2OHvPFjiM6Z7H5jgcw,needsomezzzs,1,1622717595,0,0,0,5,100,my this meatloaf is one my whole family loves. I made some gravy from the pan drippings for the mashed potatoes. yummy!
198,20,6504,Mom’s Meat Loaf,sp_aUSaElGf_6504_c_173544,u_1oKVxHR3kqYrPwd6eaopBOjNrgs,Mamacheese2004,1,1622717179,0,0,0,5,100,I have made a lot of meat loaf recipes but this is by far my favorite. My family loves it just as much as I do. It&#39;s so full of flavor. I have made this meat loaf many times and never get tired of it.
199,20,6504,Mom’s Meat Loaf,sp_aUSaElGf_6504_c_306144,u_1oKZRNV8y026nHYi7jybpzuoUw4,deejeedoll,1,1622717866,0,0,0,5,100,This is a great recipe and the only meat loaf recipe I use.  We like the use of sage and the flavor it gives. Makes a wonderful sandwich from leftovers.
200,20,6504,Mom’s Meat Loaf,sp_aUSaElGf_6504_c_170122,u_1oKXJYzsa1wTZL9JBFcPh6gXjdg,Cindy3703,1,1622717162,0,1,0,5,193,"I had been looking for a great meatloaf recipe and bought the magazine specifically for this recipe. I have made this meatloaf several times, and I absolutely love it.  I add in about 1/16 tsp of dry mustard, and as I don&#39;t like ketchup, I substitute  BBQ sauce, and it works great!  The meatloaf is tender and very flavourful.  Also, because I&#39;m single, I actually double the recipe and make two loaves, slice them after cooling, and freeze into individual portions.  I generally have some at least once a week - it&#39;s that good!!"
201,20,6504,Mom’s Meat Loaf,sp_aUSaElGf_6504_c_260152,u_1oKW2t0z3zbE1bc6aUjibx5QXAC,44473,1,1622717616,0,0,0,5,100,"Not my husband nor myself cared for meatloaf until I tried this recipe.  Now it is a favorite dish! I have made this meatloaf for company many times, and EVERYONE likes it.  I break up the brown sugar and warm the ketchup...that seems to help the sauce mix better."
202,20,6504,Mom’s Meat Loaf,sp_aUSaElGf_6504_c_156509,u_1oKVdX5LwOisWJ5CwenoNpWXfBe,teri396,1,1622717104,0,0,0,5,100,Husband loved it
203,20,6504,Mom’s Meat Loaf,sp_aUSaElGf_6504_c_175453,u_1oKVii4b8ONweU1ipfse4rXcnaL,Pat,10,1622717193,0,0,0,5,100,I have made this more times than I can count and it is always delicious.  I double the Worcesteshire sauce for added flavor.
204,20,6504,Mom’s Meat Loaf,sp_aUSaElGf_6504_c_361053,u_1oKVjVqaW2HOvncSDNF3uY6krMd,lj211,1,1622718138,0,0,0,5,100,Was told to put this meatloaf in the rotation for dinner.
205,20,6504,Mom’s Meat Loaf,sp_aUSaElGf_6504_c_208741,u_1oKXhOOXc67E4rGLXeVQzt34ON1,MissDavida,1,1622717362,0,0,0,5,100,"I took out the sage and worst. sauce I have picky eaters to feed.  I also cut the ketchup to 1/4 and I glazed it after 30 mins it was so good I half wished I made more.  It was soooo good.  I served it with scalloped potatoes, and steamed carrots and corn, and a salad with red onion, cucumbers, mushrooms, grated cheddar cheese, and home made ranch dressing."
206,20,6504,Mom’s Meat Loaf,sp_aUSaElGf_6504_c_238647,u_1oKVa2fPtT5nLm5ML0xYxnDMI1T,johnsen,1,1622717549,0,0,0,5,100,"made 1/2 recipe, put in buttered loaf pan.Excellent"
207,20,6504,Mom’s Meat Loaf,sp_aUSaElGf_6504_c_110461,u_1oKVauuLoZFmi40ThN15tIlvSRY,rmjjjamadori,1,1622716903,0,0,0,5,100,A true favorite of my husbands! He loves the sauce.
208,20,6504,Mom’s Meat Loaf,sp_aUSaElGf_6504_c_164052,u_1oKWJ8j77wecDRyQgLAnDTdgWRH,micahp,1,1622717140,0,0,0,5,100,I did not like meat loaf or meatballs until I tried this recipe.  I make this quite often and just love it!
209,20,6504,Mom’s Meat Loaf,sp_aUSaElGf_6504_c_273888,u_1oKVZhrnNwRcxmUDVcErr7TGlOt,VictoriaElaine,1,1622717723,0,0,0,5,100,So easy to make and the glaze is delicious!
210,20,6504,Mom’s Meat Loaf,sp_aUSaElGf_6504_c_318518,u_1oKav4MEnNiQZcqUOspoSCDORTu,tralyn28,1,1622717924,0,1,0,5,193,This is the best meatloaf ever.  I&#39;ve been using this recipe since its publication.  I gave the recipe to a co-worker who could not find a meatloaf recipe that her kids would eat and she ended up making it three times that first week (at the kids request).
211,20,6504,Mom’s Meat Loaf,sp_aUSaElGf_6504_c_319541,u_1oKWDWTf4VzVP5txz4XdqpI10Aj,fishrgal,1,1622717924,0,0,0,5,100,"This is the only meat loaf I ever use anymore. Have made it dozens of times, not only for family but for special guests, and people go back for seconds."
212,20,6504,Mom’s Meat Loaf,sp_aUSaElGf_6504_c_125963,u_1oKVv4xLBCVBWZivD1QNDTBCHce,smj2552,1,1622716974,0,0,0,5,100,Delicious!  I followed the recipe exactly and my family thoroughly enjoyed it.
213,20,6504,Mom’s Meat Loaf,sp_aUSaElGf_6504_c_328453,u_1oKbogSc2G1os0I31nDr0MnIU5U,carlyv,1,1622717969,0,0,0,5,100,This recipe was quite easy.  Everything was mixed in one bowl so clean up was minimal.  It has a sweet and tangy flavor.  Very good.
214,20,6504,Mom’s Meat Loaf,sp_aUSaElGf_6504_c_228115,u_1oKVZziatsguILPnEKQrWOutR64,cwbuff,1,1622717480,0,0,0,5,100,"It&#39;s the topping that for me really makes this recipe - I use it all the time, even on top of other meatloaf recipes. Much better than ketchup!"
215,20,6504,Mom’s Meat Loaf,sp_aUSaElGf_6504_c_205812,u_1oKXx30Ll3ZZWC7tOmGbEyGtrrG,Toni_Armstrong,1,1622717357,0,0,0,5,100,I started making this recipe when it was first published in TOH and my family LOVES it.  They will not let me make meatloaf with any other recipe!
216,20,6504,Mom’s Meat Loaf,sp_aUSaElGf_6504_c_184855,u_1oKWkeZLNCOlLskEuNNgf1j2orq,lsnyder,1,1622717283,0,0,0,5,100,"I love this recipe, in fact I have shared this with many of my family members who rave about it too!  My youngest son who is 8 requests this one often!Lara"
217,20,6504,Mom’s Meat Loaf,sp_aUSaElGf_6504_c_323329,u_1oKVaLDEOqvfPeO0oCipaQ6II2g,colleyho,1,1622717906,0,0,0,5,100,This recipe has been a hit in our home since publication. The only change I have made is we omit the sage.
218,20,6504,Mom’s Meat Loaf,sp_aUSaElGf_6504_c_272566,u_1oKYpFzhhfvz055akqbfysxds3S,Dottyamaha1,1,1622717649,0,1,0,5,193,"Simple... moist... tasty... meatloaf... Also, recommend meat mixture for italian meatballs... Dott"
219,20,6504,Mom’s Meat Loaf,sp_aUSaElGf_6504_c_170517,u_1oKVa5FSx8thvFfGGM6whXv482h,delowenstein,1,1613052705,0,0,0,5,100,"<p>I had prepared this meatloaf when it first was featured in Taste of Home! I did make the following adjustments: I used ITALIAN bread crumbs, 1 onion, chopped, 1/2 tsp. Italian seasoning, 1/4 tsp. pepper, and 1 cup of Barbecue sauce at that time since I didn&#39;t have the ingredients to make regular BBQ sauce!  I&#39;d used a meatloaf pan to bake this meatloaf!</p><p>I would  probably omit the brown sugar in this sauce if I choose to use prepared BBQ sauce and I&#39;d probably omit the Worcestershire sauce since BBQ sauce has all the additions in it already! As I recall, this meatloaf was really good!  Thank you for sharing it with Taste of Home!  delowenstein</p>"
220,20,6504,Mom’s Meat Loaf,sp_aUSaElGf_6504_c_150583,u_1oKVxBYJhN4m40v7ERvP7Kr1CZi,mcamii7,1,1622717081,0,0,0,5,100,"great recipe, my picky eaters ate it all up!"
