Unnamed: 0,recipe_number,recipe_code,recipe_name,comment_id,user_id,user_name,user_reputation,created_at,reply_count,thumbs_up,thumbs_down,stars,best_score,text
0,20,6504,Mom’s Meat Loaf,sp_aUSaElGf_6504_c_2FbJItyq8bieqM7pmTqkxtJkiky,u_aOjtaJSDJXEd,John481,1,1664754773,0,0,0,5,526,"I have made this several times and my wife and I love it. Recently my wife is on a special diet and has lost a lot of weight. Because of this diet, she cannot use crackers or breadcrumbs. Her weight loss coach told her to use pork rinds/Chicharones as a binder. I used that and it did not affect the taste at all. She also cannot use the topping, so she has special ketchup that her coach told her to use."
1,20,6504,Mom’s Meat Loaf,sp_aUSaElGf_6504_c_2EBjXvtfJuQJyJJcuZD6SbMrAas,u_eCzDpg7zv31F,lvarner,160,1662075915,0,9,0,4,854,"<p>I liked this recipe quite a bit. The one thing I would change is the amount of brown sugar. I have a real sweet tooth, but this seemed like a bit too much sugar to me (especially for an entree). Next time, I will likely reduce the amount of brown sugar by half. But overall - a very good meal loaf! </p>"
2,20,6504,Mom’s Meat Loaf,sp_aUSaElGf_6504_c_2DRyEOLNbfw6DdreC3PzA6PetpG,u_BGfZ0WmwAhG2,rgnchar,1,1660676078,0,0,0,5,504,The best meat loaf recipe!  The sauce for the top really makes it special!  I will make it again!
3,20,6504,Mom’s Meat Loaf,sp_aUSaElGf_6504_c_2DAT7nhb68ExqoC4FNf5SJgqvj3,u_OxgrCHoe1yY1,Sheila271,1,1660140724,0,6,2,0,697,Try catsup with horseradish. Family favorite.
4,20,6504,Mom’s Meat Loaf,sp_aUSaElGf_6504_c_2BtkryeSrHoT5sMdklrp4Zpih4L,u_eITrlbIgUclk,IAM893,1,1657732971,0,6,1,0,727,I used crushed cheez-its instead of saltines &amp; sloppy joe sauce for the top.
5,20,6504,Mom’s Meat Loaf,sp_aUSaElGf_6504_c_2BLbPEuVOyamVuLZNEgoUqMYt0b,u_DKulcbz6XYNm,Melody813,1,1656688286,0,2,13,3,561,I usually just use ketchup for the topping.  Too much sugar in one&#39;s diet isn&#39;t very good. The recipe is great. I give it 3 stars.
6,20,6504,Mom’s Meat Loaf,sp_aUSaElGf_6504_c_2A4j3SjhPaZCKoO4V6Mx4LQDGf6,u_BXjoblUXjfYM,Dave216,1,1654275552,0,8,5,5,686,"I think many of us take a recipe and add/change things to make it our own.  I have never had very good luck making meatloaf.  It was either way too dense or it would fall apart.

This recipe is absolutely fantastic!  I did, however, add/change a couple of things.
A while back I ordered &#34;tomato powder&#34; from the Spice House.  I always forget that I have it.  But I saw it in the refrigerator (keeps it from getting hard as a rock), and figured I&#39;d add it in to the ground beef.  I used about a tablespoon.  I suppose you could always use a couple of tablespoons of the double concentrated tomato paste that comes in a tube.

I also used mostly 90/10 ground beef, but figured I&#39;d add some 80/20 in for some extra moisture (and obviously more fat).   My mom always used Ritz crackers for meatloaf or meatballs....so I combined Ritz crackers and saltines...not really sure it made a difference.  Then I added about one or two teaspoons of Kitchen Bouquet to the mixture.

I&#39;m not sure if my changes made any difference at all from the original recipe, but this was absolutely the best meatloaf I have ever eaten.  My 29 year old son, asked me if it was any good, and I told him to taste it and let me know.  He called from the kitchen and said,   &#34;Dad, this is the BEST meatloaf!  What the world did you put in this?&#34;"
7,20,6504,Mom’s Meat Loaf,sp_aUSaElGf_6504_c_29eOgljUVyF2R24fl43e7pr4f8g,u_Bp3JhaLariSN,Louis044,1,1653470197,0,9,13,0,516,Almost all meatloaf recipes lack one thing that will take it to the next level. That is one medium grated carrot.
8,20,6504,Mom’s Meat Loaf,sp_aUSaElGf_6504_c_27wpQW3waaVZ72ixyRKuj5GjTIW,u_lVXBe20e4b3j,Cheryl6905,1,1650240986,0,9,0,5,809,OMG… This recipe reminds me of my mom’s! It’s so moist and seasoned so well! I just finished the last bite! Thank you for this delicious- ness!
9,20,6504,Mom’s Meat Loaf,sp_aUSaElGf_6504_c_24QlIzlU5Ux1DiusKYh0bxZa7vp,u_WYsR1y64AyOy,Virginia100,1,1645029246,0,15,2,0,829,"Family&#39;s favorite recipe.  Is easy to put together, and the leftovers make great meatloaf sandwiches."
10,20,6504,Mom’s Meat Loaf,sp_aUSaElGf_6504_c_23nwtSgeBamjJMrACGdoRtHgXMH,u_5u8a4pdhBQ8n,Patty579,1,1642383373,0,6,6,5,661,"Fabulous meatloaf. The only tweaks I made was to add 1/2 cup A1 steak sauce and 1/4 cup brown sugar, but I doubled the recipe. Made my top glaze from another 1/2 cup A1 steak sauce and 1/4 cup brown sugar."
11,20,6504,Mom’s Meat Loaf,sp_aUSaElGf_6504_c_236fYLAGr96Isj2IV2ZO9f1R6AO,u_try8G8groJ34,Jim063,1,1641059503,0,22,15,5,731,"I had never made a meatloaf before but decided to make one using this recipe with a couple small modifications. I only used 1/3 cup of milk, I used Panko bread crumbs instead of crackers and I baked it for 75 minutes. It came out absolutely fantastic."
12,20,6504,Mom’s Meat Loaf,sp_aUSaElGf_6504_c_20BVMXsN6ZAaN3zpfi7rlKjYAZy,u_pGLVdbgsF67u,Lyndi916,1,1635517920,0,33,4,5,866,I started making this recipe years ago when I was about 14 years old my grandmother gifted me a taste of home recipe book and I found this recipe. After I made it the first time it the first time for my parents and brother it was a hit. Now I make it for my husband and five daughters! Such a wonderful recipe and turns out delicious every time!
13,20,6504,Mom’s Meat Loaf,sp_aUSaElGf_6504_c_1yXTQFCofNGDzwHTpAfsk78ok6U,u_KIQp2IK3hYP8,Lynda984,1,1635278703,0,13,62,1,505,"this was the worst meat loaf ,there was no taste and it was too runny will never make again"
14,20,6504,Mom’s Meat Loaf,sp_aUSaElGf_6504_c_1waeKvdQrQ2PPLak9K8uA5O38xZ,u_nXd7wr2Nb7mv,Karla189,1,1628701066,0,10,11,5,661,"Loved this recipe.  To cut calories, I didn&#39;t put any sauce on until the very end and only used a mixture of 1/4 cup BBQ sauce, 1/8 cup ketchup, and a T. of mustard.  Still very moist.  Used 1/2 pork sausage and 1/2 beef.  I didn&#39;t have sage in the house so I skipped that."
15,20,6504,Mom’s Meat Loaf,sp_aUSaElGf_6504_c_1s7ef9iWc7IjV5cGSGBciFnkCwl,u_69WEUeQTYvdD,momofajj,1,1620228155,0,4,0,5,759,We loved this meatloaf recipe! Great flavor and taught me how to make it moist while still holding together! I threw some mushrooms on top and some cheddar cheese.
16,20,6504,Mom’s Meat Loaf,sp_aUSaElGf_6504_c_1rp52X3vYghOP2CPwHiCabvcqsW,u_4TU6lafAnJrT,Judy426,1,1619659983,0,24,9,5,782,"Amazingly easy to prepare.  First, I cook on auto pilot.  This means I end up with a modified recipe, bu it turned out perfect and delicious.  Plus, I have never made meatloaf without tomato sauce.  I choose this recipe as I could not bare making my mom’s fabulous recipe today.  She was a wonderful cook.  It’s almost Mother’s Day and I miss her every day.  I find healing though cooking and am even inspired by asking my 91 year old dad to share his own cooking tips with me.  May will be a celebration by sharing with my family some of Mom’s favorite dishes."
17,20,6504,Mom’s Meat Loaf,sp_aUSaElGf_6504_c_432016,u_1tOHufWN8489tipOKgQbjfQ36TI,Amy,1,1622648873,0,7,1,5,338,"I have five kids of varying ages and this is something they all love. I’ve made it for guests before thinking it may be too simple for a “company” meal, but everyone left raving about it. All asked for the recipe. This one is a definite winner!"
18,20,6504,Mom’s Meat Loaf,sp_aUSaElGf_6504_c_391531,u_1oKbd774a2X38vfK0ZjxNsb7Ifr,Lori Erokan,1,1622718244,0,12,7,5,284,"I don&#39;t know how many meatloafs I&#39;ve made over the years, or how many different versions I&#39;ve tried, but this is my very favorite. I make a couple of changes, though. I use 2 pounds of ground beef (or meatloaf mix; that&#39;s good, too). Otherwise, it turns out too &#34;loose&#34; for our taste. I grate the onion instead of chopping it. That way, its taste is distributed evenly throughout the loaf. And finally, instead of one free-form loaf in the middle of my 13&#34; x 9&#34; pyrex pan, I make two. That way, there&#39;s more surface to be covered with the sauce, and we just like it better that way. Leftovers make awesome sandwiches, too!  Thanks for sharing this great recipe, Michelle Beran!"
19,20,6504,Mom’s Meat Loaf,sp_aUSaElGf_6504_c_383201,u_1oKWPovKK0QcPbQ8ANsxf8rm6bH,resalee,1,1622718251,0,2,0,5,253,Delicious!  Next time though I&#39;ll follow the advice of a previous review and add the Worcestershire sauce to the meatloaf and skip the sauce.  My family only likes a little sauce on top and this recipe made way more than we needed.  Instead I&#39;ll just add a little ketchup to the top before cooking.  I used 2.25 pounds of ground beef instead of 1.5 pounds because that&#39;s how it was packaged and I didn&#39;t have a need to save a small amount.  It still turned out fantastic.  Much better than using the meatloaf seasoning packet like I&#39;ve always done before.
20,20,6504,Mom’s Meat Loaf,sp_aUSaElGf_6504_c_392371,u_1oKdCBVsggqK2sG3jsBerSMl9Bn,ScottRome,1,1622718306,0,21,0,5,480,"I have 4 very very picky kids the oldest is 13. They pretty much all 4 live on pizza every day. No kidding! Until,!!!! I made this and made all 4 of them at least try it. Guess what? I am now making it at least once a week and all 4 of them absolutely love it so I&#39;ve been doubling everything and they eat every last bit of it at least by the next evening. All 4 kids and myself would like to thank you for this wonderful meatloaf. It&#39;s a huge hit in our home. God bless."
21,20,6504,Mom’s Meat Loaf,sp_aUSaElGf_6504_c_418970,u_1oKbPTp8TE68CTohHdLlpH57j6j,BarbThompson,1,1622718409,0,7,2,0,303,This is very similar to my mother’s with a couple of small exceptions.  She added the Worcestershire sauce to the meatloaf and then just used ketchup to top it.  I don’t think I would miss the brown sugar.  Delicious and thank you for sharing your version!
22,20,6504,Mom’s Meat Loaf,sp_aUSaElGf_6504_c_407608,u_1oKdeVO1vCNehtC306vh2caXKe7,CarenKeller,1,1622718362,0,9,1,5,368,"Never made a decent meatloaf, which family didn’t care for anyway. Found this recipe in Taste of Home’s Copycat Favorites book.  BINGO! Didn’t change a thing and has now become a favorite.  I am feeling ‘victorian’ !"
23,20,6504,Mom’s Meat Loaf,sp_aUSaElGf_6504_c_424063,u_1oKe6Gg5xkaGgRA7lmglnSAV486,WendyKenyon Lynema,1,1622718447,0,1,1,0,142,"Very similar to my mom&#39;s meatloaf. Though we use Ritz crackers, a couple eggs and the topping is brown sugar, ketchup, mustard, worcestershire sauce. I do like the comment to wet d oi wn your &#34;crumbs&#34; prior to adding to the meat mix."
24,20,6504,Mom’s Meat Loaf,sp_aUSaElGf_6504_c_417357,u_1oKVdmRaSqpT8i9wvYNGsGhUY9k,susnan,1,1622718444,0,1,1,5,142,"This is basically the recipe I’ve used for many years, minus the sage (which I only like in cornbread dressing).  I like to soak the crackers in the milk until they are soft before adding to the meat. You can also add chopped bell pepper for extra flavor. The only meatloaf recipe I’ll ever use."
25,20,6504,Mom’s Meat Loaf,sp_aUSaElGf_6504_c_401643,u_1oKbIuc33s5TvdLpbfiycjcEkya,FREDBELLI,1,1622718342,0,1,0,0,193,"Instead of baking in the oven, I cooked it on my smoker. We all loved it."
26,20,6504,Mom’s Meat Loaf,sp_aUSaElGf_6504_c_400582,u_1oKi2i2p7sMqJbbq2wuSoXCH6OA,dmichelle2,1,1622718327,0,0,0,5,100,"I&#39;ve been making this recipe for years and we love it! I substitute plain bread crumbs for the saltines, but it is great either way!!"
27,20,6504,Mom’s Meat Loaf,sp_aUSaElGf_6504_c_407229,u_1oKaqe7Zsn1fO4kWiMsQZesgi0p,Guest75361888,1,1622718342,0,0,1,0,100,My mom always made her meatloaf with 80/20 ground beef
28,20,6504,Mom’s Meat Loaf,sp_aUSaElGf_6504_c_422701,u_1oKW364UUMSuITJHNm7mgOVI1na,Nonniebakes,1,1622718422,0,0,0,5,100,Tried this recipe last year and we love it!  Makes tasty sandwiches the next day too!
29,20,6504,Mom’s Meat Loaf,sp_aUSaElGf_6504_c_392599,u_1oKc9zg0CGZyU7q1kfOX8pDezaU,NancyLambert,1,1622718280,0,1,0,5,193,I have always loved meat loaf but didn’t know how much till I tried this recipe. It is now my go to meat loaf recipe. LOVE IT!!!!
30,20,6504,Mom’s Meat Loaf,sp_aUSaElGf_6504_c_406833,u_1oKd5iu2c7cFBcyZw2UuvgMsU8u,LizWhitney,1,1622718389,0,1,1,5,142,My husband and kids loved this meatloaf!  This recipe is a keeper!
31,20,6504,Mom’s Meat Loaf,sp_aUSaElGf_6504_c_422849,u_1oKc8TBqGIFyRTmSczepgnr7281,stuhazzard,10,1622718422,0,2,7,3,128,"Trying to eat healthier, used ground turkey - also added minced garlic, good bread crumbs, and chili sauce."
32,20,6504,Mom’s Meat Loaf,sp_aUSaElGf_6504_c_417215,u_1oKXvXFcvDp4sNo04DNupOqaWWE,CarrieBerry4Chad,10,1622718418,0,0,1,5,100,"This is always a hit! My husband devours this meatloaf! He even admitted that after all the years of loving his mom&#39;s meatloaf, he thinks this is even better!"
33,20,6504,Mom’s Meat Loaf,sp_aUSaElGf_6504_c_405381,u_1oKcCHVRADUgyVJBDUkTWNRWwVh,MargeryCravath,1,1622718356,0,2,1,5,193,margycravath@gmail.com  Great recipe..I added a touch  of prepared mustard and a capsule apple cider vinegar to ketchup
34,20,6504,Mom’s Meat Loaf,sp_aUSaElGf_6504_c_400309,u_1oKVdXJVj0FvjvOHkePwEUxmEWq,oreo95,40,1622718327,0,0,1,5,100,"I&#39;m not a big fan of meatloaf, but this was very good. Made it exact, but will cut back on the milk next time. Great comfort meal, thanks Michelle"
35,20,6504,Mom’s Meat Loaf,sp_aUSaElGf_6504_c_398651,u_1oKdYghj0wOzZouZjuYcASnDVZW,logan1969,1,1622718330,0,0,6,5,100,"I tried this recipe without the milk, onion and saltines....used italian bread crumbs for the saltines...a huge hit with my husband and I. Can&#39;t wait to make it again and tweak it a bit!"
36,20,6504,Mom’s Meat Loaf,sp_aUSaElGf_6504_c_394263,u_1oKd9Zsm64shmu4xZFVB06Bkztz,DarlaGrimm,1,1622718315,0,1,2,5,127,"I learned this from my mom, too.  The brown sugar is that secret ingredient that is the game changer.  I try to stay away from sugar but meat loaf without it is just &#34;meh&#34;"
37,20,6504,Mom’s Meat Loaf,sp_aUSaElGf_6504_c_402579,u_1oKc5A0TuzOKBPTIj7uXzg2Ebmg,JohnWhite,1,1622718331,0,0,2,5,100,It&#39;s goooood!
38,20,6504,Mom’s Meat Loaf,sp_aUSaElGf_6504_c_392043,u_1oKc6ewGuQpQ5S6fVjKWZ1d95es,mthrfudger,1,1622718290,0,3,1,5,235,I got this from you magazine several years ago. First of all it is delicious ! Several homes I’ve brought it to LOVE it. At holiday time I am asked to bring it for our main recipe. It’s just the best recipe you will ever have. It’s also very easy to make. You owe it to yourself and family and friends to try this one!
39,20,6504,Mom’s Meat Loaf,sp_aUSaElGf_6504_c_390000,u_1oKbY4fuSkITILopAYxodBx1HbC,MarianneMcCombs,1,1622718257,0,1,6,0,111,I always add diced bell peppers to my meatloaf.  And several  slices of bread.  Crackers would add to much salt.
40,20,6504,Mom’s Meat Loaf,sp_aUSaElGf_6504_c_394684,u_1oKbG5jvrFHeG7LCseTkgikAkwH,AllisonWilliamson,1,1622718306,0,2,1,5,193,"I love this meatloaf.  Very flavorful, and the leftovers are great as well.  This one&#39;s definitely a keeper!"
41,20,6504,Mom’s Meat Loaf,sp_aUSaElGf_6504_c_393319,u_1oKVajR7TJgzhWP1fi1W1NXa4BI,xenazoe,1,1622718297,0,2,1,5,193,"I have never been a fan of meatloaf either, but this recipe won me over!  The only change I made was omitting the sage. The meatloaf came out moist and flavorful!  My kids loved it and the leftovers didn&#39;t last very long.  This is now my &#39;go to&#39; recipe when my husband requests meatloaf from now on!"
42,20,6504,Mom’s Meat Loaf,sp_aUSaElGf_6504_c_388601,u_1oKd8ha8oNspoenHZFqd8xaqZol,lisa.hepfer,1,1622718285,0,8,1,0,354,Hello.....just recently made your meatloaf but it didn&#39;t turn out.  I followed the directions exactly but it seemed overly moist when trying to form into the loaf.  It actually fell apart during cooking.  Any suggestions??  Smelled wonderful and tasted great but would want it to hold its shape to be able to slice for presentation and sandwiches for leftovers.
43,20,6504,Mom’s Meat Loaf,sp_aUSaElGf_6504_c_395415,u_1oKXFXGSJxS3VkXOLrCBqbL6aIB,pung,1,1622718297,0,1,1,5,142,"I made a meatloaf for my sweeties sister - she loves meatloaf, him, not so much.  I had some caramelized onions left over from something else and decided to put them in a small portion of the meatloaf mix for just him.  Then, I topped it with bar-b-que sauce.  I lined the loaf pan with foil and made a separate section for his meatloaf by making a foil partition.  He loved it!  They will be getting both now, she loved this recipe:)"
44,20,6504,Mom’s Meat Loaf,sp_aUSaElGf_6504_c_428165,u_1oKVaUdfLrgfh13O9CDw0d1RZpO,suefalk,20,1622718451,0,0,0,5,100,Yummy! A simple and delicious meatloaf. Having fewer veggies in the recipe makes for a denser meatloaf. So it makes it easier to cut into slices for sandwiches.
45,20,6504,Mom’s Meat Loaf,sp_aUSaElGf_6504_c_391691,u_1oKcyUBZEhlG19npiWmRPpmS6tg,Christine,1,1622718281,0,1,0,0,193,"I find best meatloaf is a combination of ground beef, pork, and veal."
46,20,6504,Mom’s Meat Loaf,sp_aUSaElGf_6504_c_174672,u_1oKVZxvqhgInO8WHSN1ysf4eOPN,LeslieH,10,1622717217,0,0,1,5,100,"I have made this a few times, although I always halve the recipe as there are only two of us eating it.  It is a very nice meatloaf, being easy to make and very tasty.  Today I used the ground veal that I got on sale at the store and it was just as tasty as the ground beef.  I think you would use whatever ground meat you have on hand."
47,20,6504,Mom’s Meat Loaf,sp_aUSaElGf_6504_c_282027,u_1oKVa55UEruwKBMEy1Uaut6Iy8z,Laurie73,1,1622717718,0,0,1,5,100,The best meatloaf I have ever had!
48,20,6504,Mom’s Meat Loaf,sp_aUSaElGf_6504_c_364188,u_1oKcSssXRHiWJhyqUFxhWvzmJu3,CarlaFitzgerald,1,1622718108,0,2,1,5,193,We love this recipe so much that we had it for a Christmas party. It was a big hit. Reqested recipe.
49,20,6504,Mom’s Meat Loaf,sp_aUSaElGf_6504_c_210220,u_1oKYMkGFmHIJWTYOXerUytDwZMx,KieranSam,1,1622717367,0,1,5,3,113,"I use 2 lbs ground beef and 12 ozs of Jimmy Dean Sage Sausage.  No brown sugar and 1 Chopped green pepper.  Also, 1 can of evaporated milk and a whole sleeve of crackers.  The sausage and green pepper takes it to another level.  Still use the sage seasoning and one8 oz of tomato sauce instead of catsup.  Use half in the meatloaf and half as the topping."
50,20,6504,Mom’s Meat Loaf,sp_aUSaElGf_6504_c_313663,u_1oKbN08GiqDuOkJDPOq4atlPYlY,bratz02,1,1622717884,0,0,0,5,100,This is my favorite recipe but instead of the crackers I’ll use bread crumbs
51,20,6504,Mom’s Meat Loaf,sp_aUSaElGf_6504_c_158842,u_1oKWxdufDb8DTMjNJA0ZKxjlAyR,Guest800,0,1622717123,0,3,5,1,161,"I agree with Randall. I made it today and followed recipe exactly as said.  Sorry, but this is the worst meatloaf I ever made.  I landed up giving it to my cats!"
52,20,6504,Mom’s Meat Loaf,sp_aUSaElGf_6504_c_282471,u_1oKa8ysVJbST9DrknAT8NRzyuqC,DarrinHayhurst,1,1622717757,0,2,1,3,193,The blending is great. The ketchup and brown sugar combo topping is like having candy for diner. I suggest using  half a ketchup/Worcestershire in the  blend and the rest as the topping . No brown sugar!!!!
53,20,6504,Mom’s Meat Loaf,sp_aUSaElGf_6504_c_196050,u_1oKXp2PQXvx4jY2uWk8Vq77mI58,MartinV,1,1622717312,0,0,2,5,100,"I made this meatloaf today and it turned out awesome. I used chicken stock instead of milk,  and added more saltine crackers (I used a whole sleeve).  At the end of 60 minutes, I turned the oven off, opened the oven door and let it sit there for another hour. Meatloaf was juicy and delicious. I also used less brown sugar in the recipe.,"
54,20,6504,Mom’s Meat Loaf,sp_aUSaElGf_6504_c_242680,u_1oKYUlIKgmUvaxNFpBFgHdV6AZt,Kay,1,1622717548,0,1,2,5,127,"Made this last night, OMG, it is the best.  I must say I did make some changes, but my hubby has always liked my usual meatloaf, but he loves this one. I replaced the milk with a can of golden mushroom soup, packet of Lipton onion soup, deleted the sage, not big sage fans,  The amount of cracker crumbs had to increased.  I used almost a full sleeve of crackers and probably could have been ok with the whole sleeve. It is a winner in our book."
55,20,6504,Mom’s Meat Loaf,sp_aUSaElGf_6504_c_257868,u_1oKYhEQbAzRjqhYmHJjO9UEr0rL,RandallBryan,1,1622717618,0,1,9,2,108,My wife and I made this just by the recipe and it was nasty. Thought we had made a mistake so we did it again. This is the worse tasting meat loafs I have ever tasted. I&#39;ll never make it again.
56,20,6504,Mom’s Meat Loaf,sp_aUSaElGf_6504_c_353571,u_1oKb5m1jLgbJyJMFQFO0F3K7hy8,MichaelBradley,1,1622718113,0,0,1,5,100,"Very good recipe, my go to. I read all the comments and altered it like this:I used 80/20 ground, so I doubled the cracker to 1 1/2 cups Ritz, and I used 1/2 cup cream instead of milk to help make it firmer. It&#39;s important to let the meatloaf rest 10 minutes before serving.I also altered the topping, adding prepared mustard, using less ketchup, and adding less brown sugar.Came out great."
57,20,6504,Mom’s Meat Loaf,sp_aUSaElGf_6504_c_371925,u_1oKVZkwou43a0PL7Aw0NCrDXTLL,Debglass11,30,1622718162,0,0,0,5,100,"Wonderful meat loaf recipe!  The saltines, milk and eggs make it super tender and the sage doesn&#39;t overpower at all....just adds a nice earthy warmth to it.  The sauce was a bit too sweet for us, so next time I&#39;ll cut back on the brown sugar.  But this is a great meatloaf, and something I&#39;ll definitely make again!Volunteer Field Editor"
58,20,6504,Mom’s Meat Loaf,sp_aUSaElGf_6504_c_215272,u_1oKZGkN41NF8baTwKTPeJQlVGJh,AlyciaKraker,1,1622717395,0,2,1,5,193,"I was never a meatloaf fan, but I substitute Ritz crackers and we love this recipe. My 4 year old son cried when I told him I was making meatloaf.. he ate 4 helpings and now both him and his dad ask for this ATLEAST once a week. The sauce makes it perfect!! And it&#39;s so simple. Definitely a staple in our house!"
59,20,6504,Mom’s Meat Loaf,sp_aUSaElGf_6504_c_131472,u_1oKWKQrdMEtkh68C6REodILzvr6,JennyBaker,1,1622716973,0,0,0,5,100,Doubled the recipe and made 2 I did not make the sauce just used ketchup straight from the bottle. There was none left and everyone loved it. Thanks for the recipe.
60,20,6504,Mom’s Meat Loaf,sp_aUSaElGf_6504_c_148956,u_1oKVaTD6LdTQHMzJ3QpGM2lTUyy,K.,1,1622717094,0,0,1,5,100,"Great meatloaf recipe, the sage gives a special touch.  I love the sauce on the side to use as much as desired."
61,20,6504,Mom’s Meat Loaf,sp_aUSaElGf_6504_c_279272,u_1oKa0qmub6EbqCKJQ5i0J91MAm7,SaundraHaney,1,1622717748,0,0,1,5,100,Switched milk with tomato sauce and it was amazing!My very picky family loves it and ask for it often ?
62,20,6504,Mom’s Meat Loaf,sp_aUSaElGf_6504_c_166000,u_1oKX6LaRVFIBkfEe8UCR94Ykjxq,Guest6541,1,1622717165,0,0,1,5,100,I don&#39;t even like meatloaf but this was amazing!!! Kids loved it too.  My daughter who is very picky was nibbling at it all night.  Very moist and the sauce was wonderful!
63,20,6504,Mom’s Meat Loaf,sp_aUSaElGf_6504_c_278038,u_1oKYrqcDTSN70qttzJpLXM2d0eY,J. GlenCarr,1,1622717706,0,1,3,0,120,Sugar in a beef meatloaf just doesn&#39;t sound right.
64,20,6504,Mom’s Meat Loaf,sp_aUSaElGf_6504_c_346909,u_1oKd1ioHRnWBrjmfI6aMGjEhQzE,DavidCatlin,1,1622718087,0,1,0,0,193,"Too sweet. Maybe cut the brown sugar in half? Also think it needs more crackers as the texture was &#34;sloppy&#34; (basically fell apart as soon as I lifted it out).I absolutely hated it but my wife liked it. I&#39;d give it a ZERO, she gave it a 4...so my rating is half way between. To each their own. Sorry for her but since I&#39;m the cook, I won&#39;t be making this again. If you like a sweeter tasting meatloaf, this is the one for you."
65,20,6504,Mom’s Meat Loaf,sp_aUSaElGf_6504_c_313255,u_1oKVcB1UMjb8Lc0Bsr8xQ850hmw,Jellybug,10,1622717916,0,0,0,5,100,"This is hands down the best meatloaf I have ever eaten..My 13 year old grandson loved it, what better compliment than that!! There was enough for dinner and leftover for hot meatloaf sandwiches..the sweet and sour sauce is amazing!!"
66,20,6504,Mom’s Meat Loaf,sp_aUSaElGf_6504_c_186256,u_1oKWBOcjzq66gE7Muf6YOfq6cal,Nurses4Ever,1,1622717252,0,0,2,4,100,"I loved this meatloaf! I would have given this a 5 star however, My family  did not like the barbecue sauce."
67,20,6504,Mom’s Meat Loaf,sp_aUSaElGf_6504_c_234997,u_1oKXuWTg0K0i4569nuL16buEb3X,KJMelat1,1,1622717466,0,0,0,5,100,Love this recipe!  I cook it in the crock pot!  I have substituted venison for the ground beef.
68,20,6504,Mom’s Meat Loaf,sp_aUSaElGf_6504_c_352387,u_1oKX9p3fbEotm8UnRCOKI6MrVve,Guest3592,1,1622718101,0,0,0,5,100,Very good and simple recipe. It&#39;s a go to at our house! Husband loves making meatloaf sandwiches the next day. Been making this for years and everyone  always raves about it! We love the sauce!
69,20,6504,Mom’s Meat Loaf,sp_aUSaElGf_6504_c_321650,u_1oKVZzipo1u8lcqQzDUcw4UBn9e,2124arizona,20,1622717901,0,0,0,5,100,This meat loaf is moist and flavorful. Another keeper!!
70,20,6504,Mom’s Meat Loaf,sp_aUSaElGf_6504_c_175149,u_1oKWCD0E7JlEd7W5Rlk8WoQB6IN,MikeChambers,1,1622717221,0,1,1,5,142,I have made this hundreds of times.  Everyone raves about it.  I have modified it sometimes.  Sometimes I add celery.  I often use 1# hamburg and 1/2# lean ground pork.  I put chopped green peppers in occasionally and used it to stuff green peppers.  I think is the sauce that people really like.
