Unnamed: 0,recipe_number,recipe_code,recipe_name,comment_id,user_id,user_name,user_reputation,created_at,reply_count,thumbs_up,thumbs_down,stars,best_score,text
83,33,32535,Creamy Grape Salad,sp_aUSaElGf_32535_c_152849,u_1oKVqI6nTx07cdsLMxWnpDJk8sH,1914skin,1,1622717107,0,0,0,5,100,"Had to promise my family I&#39;d make this awesome salad/dessert every weekend, and I have. As of this review , I&#39;ve now made it 7 times. .... Thanks a bunch for sharing!!!  I added the brown sugar to the pan a soon as  the pecans toasted, stirred them around till the sugar melted and ended up with the best tasting pralines!!!  Almost forgot ..... one time I had a bit of unsweetened coconut flakes on hand so mixed them in with the creamed mixture ..... Must remember to buy some again, as it was also delicious ...."
84,33,32535,Creamy Grape Salad,sp_aUSaElGf_32535_c_226377,u_1oKZ6haBun7YLhbq5737RX60sBa,hair2,1,1622717432,0,0,0,5,100,It was just WONDERFUL!!!
85,33,32535,Creamy Grape Salad,sp_aUSaElGf_32535_c_196979,u_1oKXddKSpxxkNmBxPO72IHwFYis,Jessicarb40,1,1622717316,0,0,0,5,100,I made this recipe for the first time with my Teen cooking class at the Boys and Girls Club and the kids absolutely LOVED IT!!! The kids would ask me for this at least once a week so we made it quite a few times. Thanks for this wonderful recipe!
86,33,32535,Creamy Grape Salad,sp_aUSaElGf_32535_c_263251,u_1oKVa1vU0P0wtIMwn8FBys0ptHj,gunslinger,20,1622717625,0,0,0,5,100,"One of my very favorite salad recipes! Very pretty, delicious and easy to make! Definitely a winner in my book!"
87,33,32535,Creamy Grape Salad,sp_aUSaElGf_32535_c_172502,u_1oKXaAQkDgileuDFdvZPy6aPwBc,marchhare,1,1622717180,0,1,0,5,193,"I have been making this for years and the only tip I can give you isn that  u do not need the brown sugar, it is just as tasty without it"
88,33,32535,Creamy Grape Salad,sp_aUSaElGf_32535_c_172458,u_1oKX6HpRKpu9ZekMrRnQxDzFg8n,behar,1,1622717201,0,0,0,5,100,"I have been making this for many years, it is always a hit. I have my Mother&#39;s old Betty Crocker&#39;s Hostess Cookbook from 1967 and the recipe is in there. We love this."
89,33,32535,Creamy Grape Salad,sp_aUSaElGf_32535_c_306747,u_1oKZXkFqdceGxk88qCM35m37h4l,LanaMore,1,1622717869,0,1,0,5,193,This is a GREAT salad.  I put praline peacans chopped on top instead of the brown sugar and got rave reviews.
90,33,32535,Creamy Grape Salad,sp_aUSaElGf_32535_c_175083,u_1oKWBQ9uNbFwlyhBvUjZWzZZ4Js,UTgal,1,1622717218,0,0,0,5,100,"I have made this for years and always get rave reviews. I prefer it with grapes but have made it with many fruits. It is pretty good with blueberries and strawberries on the 4th of July. The only thing I do differently is to combine the pecans and the brown sugar and sprinkle it on the salad before I refrigerate it for several hours. Right before I serve it, I give it a final stir to mix it in. The brown sugar melts a little bit into the pecans and is not quite as &#34;grainy.&#34;"
91,33,32535,Creamy Grape Salad,sp_aUSaElGf_32535_c_110963,u_1oKVljSGN9igBGc773IbyabtlCV,bakesalot1,1,1622716896,0,0,0,5,100,absolutely amazing and so quick to whip up !  refreshing salad with great color to compliment any meal.  tasty with cinnamon crusted pecans crushed on top.  helpful hint:  allowing the grapes to dry after rinsing made the cream cheese mixture stick to the grapes much better.
92,33,32535,Creamy Grape Salad,sp_aUSaElGf_32535_c_236085,u_1oKXeRKu2nl6TCmaI8uZL3Qwi0s,phylleri,1,1622717507,0,1,0,5,193,"Love this...have made it in smaller batches, too, just for me, myself and I!!"
93,33,32535,Creamy Grape Salad,sp_aUSaElGf_32535_c_315722,u_1oKatEBJwn88836S1KjzEJITPTG,mfrick1yahoocom,1,1622717929,0,1,0,5,193,This is one of the most delicious salads I have ever made.  My family loves grapes and  with the combination of cream cheese and sour cream it makes it so tasty.
94,33,32535,Creamy Grape Salad,sp_aUSaElGf_32535_c_174980,u_1oKVZangmN67bJNxpyD1j55VJCj,tsuop,1,1622717189,0,0,0,5,100,"I have made this for many years, it is ALWAYS a big hit.  My grandson who is not fond of fruit absolutely loves this!!    I don&#39;t add the brown sugar, it melts too soon into the creamy mixture."
95,33,32535,Creamy Grape Salad,sp_aUSaElGf_32535_c_128942,u_1oKWCUgzlMS1lYWPUyqkXMYvxXy,FlGrdma,1,1622716978,0,1,0,5,193,"Delicious. The recipe is always requested.  I left out the brown sugar.  And yes it can be served as a salad or a dessert, depends on the presentation.  Love it."
96,33,32535,Creamy Grape Salad,sp_aUSaElGf_32535_c_248296,u_1oKXQbYXwiHCOKmLk3VT4271XNb,cindysunflower,1,1622717580,0,0,1,3,100,My family found this to be extremely sweet with too much of the cream mixture for the amount of grapes. It also seems like more of a dessert than a salad.
97,33,32535,Creamy Grape Salad,sp_aUSaElGf_32535_c_244362,u_1oKVaXmCqwd9UEyOt5zB7mF4Dwf,maryHodges,1,1622717542,0,0,0,5,100,Made with no changes for a potluck. It was a hit! Really good recipe.
98,33,32535,Creamy Grape Salad,sp_aUSaElGf_32535_c_349739,u_1oKW11ZpsltSKuUh3axJ9Po6JgW,MaryAliceH,1,1622718098,0,0,0,5,100,"Very delicious!  I made it for a graduation open house and got lots of requests for the recipe.    I, too, used the lower fat cream cheese and sour cream.  I found that the total amount of brown sugar and nuts was a bit more than really necessary for the presentation in the bowl I used."
99,33,32535,Creamy Grape Salad,sp_aUSaElGf_32535_c_336205,u_1oKbM5PjZwjhbgUlZvindc6VISk,Noralynn71,1,1622717973,0,0,0,5,100,This was delicious. I used lower fat cream cheese and vanilla Greek yogurt instead of sour cream. I only used 1 Tablespoon of sugar. I would definitely recommend this.  I may even use it for other fruit next time!
100,33,32535,Creamy Grape Salad,sp_aUSaElGf_32535_c_325656,u_1oKZzRdDvLpdOAIcys3ejkBXK0h,chloefoster05,1,1622717961,0,0,0,5,100,This recipe is so tasty and refreshing that I add this so my summer entertaining menu and everyone raves about it!
101,33,32535,Creamy Grape Salad,sp_aUSaElGf_32535_c_167666,u_1oKVZmYPulmUFbvGiBA8U3uRR6D,justmbeth,30,1622717174,0,0,0,5,100,I first made this for a cookout after having it at Christmas potluck.   It is really wonderful.  I found the grape / cream mixture ratio was a bit off.  I find1/2 to 3/4 of the creamed mixture is plenty.
102,33,32535,Creamy Grape Salad,sp_aUSaElGf_32535_c_270881,u_1oKYpfXFjCmGRirCl9wbtATUyLs,gayfinch,1,1622717708,0,0,0,5,100,Refreshingly delicious
103,33,32535,Creamy Grape Salad,sp_aUSaElGf_32535_c_177149,u_1oKXAys7iZu0qzzMKIJmHCiWnA7,snuffsmom,1,1622717259,0,0,0,5,100,I have made this the past several years. I often omit the brown sugar and pecan topping and substitute crushedbutterfinger candy bars. Gives it a different taste with the peanut butter and chocolate. Really good this way.
104,33,32535,Creamy Grape Salad,sp_aUSaElGf_32535_c_250255,u_1oKWcNcbPZJGisru5Oq9gctgZkJ,jslilboxx,1,1622717572,0,0,0,5,100,"My family loves this salad, especially on a warm summer day and the salad is nice and chilled... its awesome"
105,33,32535,Creamy Grape Salad,sp_aUSaElGf_32535_c_168678,u_1oKXGT5URLWBiiFAUJRbnXjr6tf,Robin72,1,1622717155,0,0,0,3,100,I found that a little of this goes a long way as it is somewhat on the sweet side.
106,33,32535,Creamy Grape Salad,sp_aUSaElGf_32535_c_140308,u_1oKVZlbJsKnks4yML21aFN0AsFC,saw-whet,1,1622717019,0,0,0,5,100,Excellent
107,33,32535,Creamy Grape Salad,sp_aUSaElGf_32535_c_141345,u_1oKWGfVWwW2qm9ucsQYoeds6QUR,Patty48cake,1,1622717034,0,0,0,5,100,Fantasic recipes and so good.
108,33,32535,Creamy Grape Salad,sp_aUSaElGf_32535_c_152218,u_1oKVbOzFe1yuIWbPevIiv45XKei,MurphyNJ,1,1622717106,0,0,0,5,100,GREAT!  I made no changes!
109,33,32535,Creamy Grape Salad,sp_aUSaElGf_32535_c_251204,u_1oKVsGeHrCUvlpKI1KpoetT18m4,DeboraLZ,1,1622717573,0,0,0,5,100,"My favorite salad of the year-5 days later it tastes just as good as the first day.  Had a party of 12 people  with a lot of other food, had just a third left over.  I made it the day before to save time-fast and easy to make."
110,33,32535,Creamy Grape Salad,sp_aUSaElGf_32535_c_308634,u_1oKafzIErTIiV2mwydTWhKLPROH,hulslander,1,1622717870,0,1,0,5,193,This is a taste of heaven! You can not go wrong with this recipe. Everyone will love this. I eat it as a dessert sometimes. Just wonderful! Love it!! It gets better the next day if it last long. Enjoy!!!
111,33,32535,Creamy Grape Salad,sp_aUSaElGf_32535_c_117653,u_1oKVg7BsLNaz3ggAImlPaht54hc,3frauhuppert,1,1622716933,0,0,0,5,100,Awesome! I take this for pot lucks and everyone always asks for the recipe!
112,33,32535,Creamy Grape Salad,sp_aUSaElGf_32535_c_282403,u_1oKZZOa1Q6IstlE7o5RKl7KbWGm,Grannysandy6,1,1622717739,0,0,0,5,100,The best salad I&#39;ve ever made. Have sent the recipe many places.
113,33,32535,Creamy Grape Salad,sp_aUSaElGf_32535_c_242536,u_1oKVa02WhUsYEWRYjMCMwjbZZUd,lorstout,10,1622717538,0,0,0,5,100,"Made this for Thanksgiving. It was a HUGE hit! I don&#39;t like pecans, so I used toasted almonds instead. Tasted even better the next day."
114,33,32535,Creamy Grape Salad,sp_aUSaElGf_32535_c_212748,u_1oKYvMUTqHwRJYiWVlcdTaQy7NX,bettinam31,1,1622717350,0,0,0,4,100,I used plain greek yogurt instead of sour cream(adds protein for same taste). I also used less sugar all the way around and plain chopped baking walnuts instead of pecans. Delicious!
115,33,32535,Creamy Grape Salad,sp_aUSaElGf_32535_c_197695,u_1oKVxDKw5PqfNNxjqYkRHPZ0OrQ,mikelssword,10,1622717317,0,1,0,5,193,I made this salad for our church homecoming and it got rave reviews. It is quick to make and has an excellent flavor. I will make this again!
116,33,32535,Creamy Grape Salad,sp_aUSaElGf_32535_c_348635,u_1oKVnhBcQGC4EVI2mSDSvDzkk4l,CathyOMichigan,1,1622718099,0,1,0,5,193,"Upon taking this for dinner to share, my friend stated something was missing . I had forgotten to put brown sugar and nuts on the top. What a difference they make!"
117,33,32535,Creamy Grape Salad,sp_aUSaElGf_32535_c_198766,u_1oKXahYmvEfqcN2I7FpccS4v7Gr,cahplus,1,1622717331,0,0,0,5,100,"I made this twice in the past several weeks for two different family parties.  It was a hit at both of them.   I didn&#39;t use the brown sugar/pecan &#34;topping,&#34; and we still loved it!"
118,33,32535,Creamy Grape Salad,sp_aUSaElGf_32535_c_197710,u_1oKVaUyPsO6nLJyBKLh96wugkPm,MarineMom_texas,20,1622717317,0,0,0,5,100,I made this salad yesterday and took it to a salad supper. Nothing but rave reviews. I came home with an almost empty dish. This salad is so good. Several wanted the recipe. Definitely a five star recipe. I highly recommend this recipe as a Volunteer Field Editor for Taste of Home.
119,33,32535,Creamy Grape Salad,sp_aUSaElGf_32535_c_163443,u_1oKWuKL5weIY3NzLh3XwRQLxc7G,constancek,1,1622717143,0,0,0,5,100,I cut my grapes in half and put the brown sugar and nuts in the mixture.  I reduced the white sugar and the vanilla to my personal taste.   I only used about 2 lbs of grapes also.  You can do anything you want to this recipe and it&#39;s still going to be fabulous.   Great recipe.
120,33,32535,Creamy Grape Salad,sp_aUSaElGf_32535_c_133255,u_1oKVvX3x3TnooMdZTZ7FPIi6htC,KimberlyV65,1,1622717010,0,0,0,4,100,Easy to make and a refreshing new way to eat grapes.
121,33,32535,Creamy Grape Salad,sp_aUSaElGf_32535_c_152434,u_1oKVZtjpAd6NHkGeOEGAxusDfKE,mkaskela,1,1622717106,0,0,0,5,100,Great
122,33,32535,Creamy Grape Salad,sp_aUSaElGf_32535_c_333294,u_1oKbyhmi94bECO1MbguGv0wikFn,MomKerley,1,1622717988,0,0,0,5,100,This was a hit at our church dinner today.  Nothing left to bring home!
123,33,32535,Creamy Grape Salad,sp_aUSaElGf_32535_c_151413,u_1oKVmUzoDhDiKjQaU8AKkL12FTQ,REHT,1,1622717088,0,0,0,5,100,Great summer salad. Made it for a picnic and it was a hit. Very easy to make and a refreshing way to enjoy grapes
124,33,32535,Creamy Grape Salad,sp_aUSaElGf_32535_c_128429,u_1oKW1i4Cd3hdJKbYEhs39HypOfG,Jschmitz4,1,1622716966,0,1,0,5,193,"Delicious, easy easy to make and just the right amount of sweetness.  I melted the brown sugar, added a little cinnamon and roasted the nuts.  Made a sweet crunchy topping- perfect!"
125,33,32535,Creamy Grape Salad,sp_aUSaElGf_32535_c_175067,u_1oKWBP40Witwn4DTVLnAVxsJqg7,loopyjane3377,1,1622717190,0,0,0,5,100,I have made this for a few years. It is delicious. Everyone I have made it for loves it.
126,33,32535,Creamy Grape Salad,sp_aUSaElGf_32535_c_222942,u_1oKVwPkDOgAUuUMu9n6E6FHQ4rn,auntiegps,1,1622717453,0,0,0,5,100,"in my &#39;younger&#39; years, waldorf salad was my fav, but some years ago I added halved grapes, cooked shell noodles and some chopped roasted chicken, diced peppers (any color)..I also toasted the pecans before adding them to the salad..what a wonderful summertime salad..cool n refreshing !"
127,33,32535,Creamy Grape Salad,sp_aUSaElGf_32535_c_306580,u_1oKVe8M8UQfcGZBrxxgqexWQWwt,JulieS211,1,1622717839,0,0,0,5,100,"This is a great recipe! I&#39;d always considered that doing anything to grapes except eating them right off the bunch was gilding the lily, but after tasting this, I decided if you are going to &#34;gild,&#34; this was the gilding to do! I&#39;d never made this myself before today, though. We had a bunch of white grapes that were just a bit too tart for us to enjoy eating by themselves, so I mixed this up. It&#39;s so quick and so easy, and very forgiving of substitutions--I found that I didn&#39;t have sour cream, so used 0% plain Greek yogurt, and then discovered that I&#39;d accidentally grabbed fat free cream cheese at the store, which is a slightly different creature to me than regular or lowfat. And I had no pecans, so I chopped up some almonds. Even with all that, this came out wonderfully, and tasted very similar to what I&#39;ve had in the past at various gatherings."
128,33,32535,Creamy Grape Salad,sp_aUSaElGf_32535_c_315695,u_1oKVZq0tGK7kyYh5lp0OIz0R5lr,lmmanda,1,1622717929,0,0,0,5,100,"This is one of those recipes that have become a staple at family get togethers, everyone loves it.  I always substitute Neufchâtel cheese and fat free sour cream and no one knows the difference."
129,33,32535,Creamy Grape Salad,sp_aUSaElGf_32535_c_281912,u_1oKZAaenJQ98CDTLYKbgXeWyhDO,krystals2sence,1,1622717762,0,0,0,5,100,The best ever!!!
130,33,32535,Creamy Grape Salad,sp_aUSaElGf_32535_c_124050,u_1oKW4vOrinCPv6VXr8uxuQpALkP,Love2Eat40,1,1622716951,0,0,0,4,100,"Delicious - easy to make healthier - use low fat cream cheese and non fat plain yogurt.  I used Splenda and only 1/2 of  1/3 cup and no brown sugar on top.  Also, dry roasted almonds instead of sugared nuts.."
131,33,32535,Creamy Grape Salad,sp_aUSaElGf_32535_c_263263,u_1oKYNVfcMeIgg7OYKiw0OtucZSd,slj0823,1,1622717633,0,1,0,5,193,"One of our children made it after we had dinner. It was a surprise to the entire family! We all thought it was delightful! I will make it for New Years. I will only use green grapes because my family are not fond of red grapes and instead of pecans, I may use almonds."
132,33,32535,Creamy Grape Salad,sp_aUSaElGf_32535_c_320269,u_1oKZlO11oQbXxF2t67xIjSzCpsy,tia1975,1,1622717905,0,0,0,5,100,This is very good!
133,33,32535,Creamy Grape Salad,sp_aUSaElGf_32535_c_170526,u_1oKXSiXIILHVgKuZZVrsLYAILBd,HoneyBee1,1,1622717185,0,1,0,5,193,"I had never made this salad before I ate it at a picnic..delicious!  got the recipe and made it the next day, tossed in some chopped apples and chopped celery.  Also, melted the brown sugar and pecans together and poured over top for a crunchy, toffee like topping."
134,33,32535,Creamy Grape Salad,sp_aUSaElGf_32535_c_145478,u_1oKVZw9BdEJB0t5N5hVkeydkHkg,sd20,1,1622717061,0,0,0,3,100,Good but didn&#39;t think it was as great as the reviews made it out to be! Probably would have liked it better with less sour cream taste. Was easy to make!!
135,33,32535,Creamy Grape Salad,sp_aUSaElGf_32535_c_273569,u_1oKX89Ekt5sQC9wbQOh7RClK2Jp,mom_jam,1,1622717683,0,0,0,5,100,So easy and always a hit!
136,33,32535,Creamy Grape Salad,sp_aUSaElGf_32535_c_325375,u_1oKX89Ekt5sQC9wbQOh7RClK2Jp,mom_jam,1,1622717948,0,0,0,5,100,This recipe is so easy and always a hit!
137,33,32535,Creamy Grape Salad,sp_aUSaElGf_32535_c_314709,u_1oKaL5dVNNTvBR8x4QfO5Gnj5xo,Hatpinlady,1,1622717914,0,1,0,5,193,This is one of my families favorite fruit salads.   It&#39;s great for large family gatherings and potluck dinners.
138,33,32535,Creamy Grape Salad,sp_aUSaElGf_32535_c_149363,u_1oKVeiiFYbtmbFK5ikfJF2ixMCI,apple3891,1,1622717079,0,0,0,5,100,Great recipe and easy!  Definitely will make again!  Makes a large batch for a potluck!
139,33,32535,Creamy Grape Salad,sp_aUSaElGf_32535_c_138691,u_1oKWS9qIMGbv89i7ckmJDXnhjQQ,Dani03,1,1622717027,0,0,0,0,100,excellent summer salad
140,33,32535,Creamy Grape Salad,sp_aUSaElGf_32535_c_108295,u_1oKVfTnQePLBMYmvHuHHchAdamS,Cam625,1,1622716889,0,1,0,5,193,A big hit with everyone at family dinners and potlucks
141,33,32535,Creamy Grape Salad,sp_aUSaElGf_32535_c_256719,u_1oKX2qNc7hHkB5OATySu83THzEL,smokefish,1,1622717606,0,1,0,5,193,My sisiter-in-law brought this for Thanksgiving. She used the big purple globe grapes and everyone thought it was some kind of black olive salad. Boy were we surprised! It was fantastic! I will be making this the next time I go to a pot luck.
142,33,32535,Creamy Grape Salad,sp_aUSaElGf_32535_c_155259,u_1oKWycm5yqnq8pOdOoURk6YQRza,Hannaniah,1,1622717112,0,2,0,0,253,Hi I havent actually tried this recipe yet but I was wondering if I could made it the day before serving it and let it set in the fridge all night?  I appreciate any help.
143,33,32535,Creamy Grape Salad,sp_aUSaElGf_32535_c_163712,u_1oKWnN0fYumnn3TVCgezwCr6hLp,Little Lizzie,1,1622717157,0,0,0,5,100,I decrease the amount of brown sugar in the topping and add a couple of broken up Butterfinger candy bars. It is a huge hit!
144,33,32535,Creamy Grape Salad,sp_aUSaElGf_32535_c_117133,u_1oKVcKf3EfqiMBANkTX99DvgwW7,jessicajoyce,1,1622716929,0,0,0,5,100,Awesome i made this for a party and next time i&#39;ll have to double it! Everyone wanted seconds!
145,33,32535,Creamy Grape Salad,sp_aUSaElGf_32535_c_275397,u_1oKaUxJc96fkwbRdkE9yKuWosfz,lavendarlady61,1,1622717721,0,1,0,5,193,So simple and everyone loves it! I toast the pecans for a richer crispier taste.
146,33,32535,Creamy Grape Salad,sp_aUSaElGf_32535_c_117385,u_1oKVfTAAv4ClKoTZpweI8JVKCuk,kristensmith,1,1622716929,0,0,0,5,100,"Awesome recipe!!!  My mother-in-law first made this recipe and now I can&#39;t get enough of it.  We don&#39;t always use the pecans, due to my nephew being allergic.  This is a keeper recipe!!!"
147,33,32535,Creamy Grape Salad,sp_aUSaElGf_32535_c_169449,u_1oKWszOVI0W0pblYDINd6aYgsXc,Thygienist,1,1622717159,0,0,0,5,100,I get rave reviews every time I bring this dish to a picnic or dinner.  Kids and adults love it!
148,33,32535,Creamy Grape Salad,sp_aUSaElGf_32535_c_221490,u_1oKVZzAQmX5vMT4C2F17HmePGCM,kebmod54,1,1622717425,0,0,0,5,100,"If you have friends over and serve this, a good word of advice, &#34;make copies of the recipe&#34;."
149,33,32535,Creamy Grape Salad,sp_aUSaElGf_32535_c_247200,u_1oKZ9ZkBi6WA1M9R5HUq7ggStSS,susanifft,1,1622717559,0,0,0,5,100,My daughter (age 16) and her boyfriend (age 18) made an entire meal for our family.  This was one of the recipes they chose.  It was a big hit and I am sure we will make it many times again!  Thank  you Taste of Home!
150,33,32535,Creamy Grape Salad,sp_aUSaElGf_32535_c_316625,u_1oKXE1vPBlOFNGgEduipO71IOXR,housebunny715,1,1622717922,0,0,0,5,100,This is so creamy and so good! I made it for Christmas and all of it was gone before the end of the night! Will definitely be making this again!
151,33,32535,Creamy Grape Salad,sp_aUSaElGf_32535_c_341438,u_1oKXwytkgopgrGf51OaHpQTNe0f,pudlea,1,1622718045,0,0,0,5,100,This was so creamy and delicious!!  Will be making again.
152,33,32535,Creamy Grape Salad,sp_aUSaElGf_32535_c_329207,u_1oKVcakuPZyL7ZvvPVmLWSU1Yz1,grannygourmet,1,1622717976,0,1,0,0,193,"This salad is easy to make and uses a minimum of ingredients, which results in a delightful dish.  The tartness of the grapes matches perfectly with the sweetness of the dressing.  We will definitely be making this again at my house."
153,33,32535,Creamy Grape Salad,sp_aUSaElGf_32535_c_303482,u_1oKbG3LEaOa6PA0hUZlNdNBjftL,loghome,1,1622717849,0,0,0,0,100,This has become our traditional salad for cookouts and even Thanksgiving.  I add a couple of delicious apples with the mix..great
154,33,32535,Creamy Grape Salad,sp_aUSaElGf_32535_c_256902,u_1oKXvv7m5EVs6cIU8vdo9jExmbm,mmnana23,1,1622717613,0,0,0,5,100,"My sister raved about this and made it for me to try. It was wonderful!! She even used fat free sour cream and low fat cream cheese to cut down on the fat in it and that made absolutely no difference in it, it was just delicious!"
155,33,32535,Creamy Grape Salad,sp_aUSaElGf_32535_c_221103,u_1oKVfvobNgMQkN94ESLJysmOpYa,Jessica2783,1,1622717410,0,0,0,3,100,"If I do ever make this again, I would cut the cream cheese mixture in half."
156,33,32535,Creamy Grape Salad,sp_aUSaElGf_32535_c_304388,u_1oKamWG1XgJJpcBxqbXjb1SXtNk,jessicalynnhaynes,1,1622717827,0,0,0,5,100,This is a delicious recipe.  It is a great summer treat.  Very addictive!
157,33,32535,Creamy Grape Salad,sp_aUSaElGf_32535_c_135720,u_1oKVcHCoAqJ0FSbm96rqbLctpke,Aug-95,10,1622716999,0,0,0,5,100,Everyone looked at it funny and then had seconds!  A winner.
158,33,32535,Creamy Grape Salad,sp_aUSaElGf_32535_c_347892,u_1oKb7lLz7Qe8cH683DuzxuEqBy4,KaronS,1,1622718082,0,0,0,0,100,try toasted coconut with brown sugar/pecan mixture..Took it to a Halloween party and called it Hairy eyeballs..a big hit
159,33,32535,Creamy Grape Salad,sp_aUSaElGf_32535_c_153508,u_1oKWtWcmB7P9Hd9qXrMAFrJepnr,LorryC,1,1622717085,0,0,0,5,100,Have been making this salad for years --since I saw it in the Bowling Green city paper. We love it. Easy to make and delicious. I use Splenda instead of sugar to cut down on calories. Also use the Splenda blend brown sugar.
160,33,32535,Creamy Grape Salad,sp_aUSaElGf_32535_c_227290,u_1oKWswoi431tBTcPHHhs9YbLYKU,jlduron,1,1622717437,0,0,0,5,100,"It was very tasty.Everyone loved it. I used light sour cream and light cream cheese. Substituted splenda for the sugar. Next time I think I will add some apple, strawberries and blueberries."
161,33,32535,Creamy Grape Salad,sp_aUSaElGf_32535_c_176727,u_1oKX4wm9I6KiO0AKQjXXlPmr7TD,ss_kory,1,1622717197,0,0,0,5,100,I have made this salad many times for holiday dinners and have taken it to potluck dinners as well.  I always get asked for the recipe!So good ....I could almost eat the whole bowl myself.
162,33,32535,Creamy Grape Salad,sp_aUSaElGf_32535_c_310082,u_1oKXKejdRNnbYq2wR9eJTgXgDmC,Sunshine78,1,1622717873,0,0,0,5,100,This is always a hit with our family. Someone makes it for every gathering.
163,33,32535,Creamy Grape Salad,sp_aUSaElGf_32535_c_329142,u_1oKWnN0fYumnn3TVCgezwCr6hLp,Little Lizzie,1,1622717955,0,0,0,5,100,"This salad is always a hit! I also use 2 Butterfinger candy bars and 1/4 C. of brown sugar for the topping. Also, you can make it the night before."
164,33,32535,Creamy Grape Salad,sp_aUSaElGf_32535_c_347117,u_1oKWZz3IXXAM7phpu2PFJRvh4gR,Shelliebug,1,1622718066,0,0,0,5,100,Took this to our Pig Roast and it was all gone. The flavor is great!
165,33,32535,Creamy Grape Salad,sp_aUSaElGf_32535_c_108681,u_1oKVbJBR69GamBGDli5D88hZ2Sw,janet losinski,1,1622716887,0,0,0,5,100,a delicious change to any meal especially take to potlucks.
166,33,32535,Creamy Grape Salad,sp_aUSaElGf_32535_c_173003,u_1oKX2X7YmpbnBEJno4rlR6RNSEK,kathihanson,1,1622717209,0,1,0,5,193,"I have been making this recipe for years and we LOVE it.   My kids have affectionately renamed it &#34;Eyeball Salad&#34; since, in a clear bowl that&#39;s what it kind of looks like. :)  I put the nuts and brown sugar on top several hours before serving and it starts to carmelize on top and makes it even better.  (I also increase the brown sugar on top)"
167,33,32535,Creamy Grape Salad,sp_aUSaElGf_32535_c_165672,u_1oKXHddnYOZ6iXKQ6dfznzQA6nK,donaldt,1,1622717145,0,0,0,0,100,I do not put the brown sugar on top.  It gives it a gritty taste that my family does not like.  I put it in the sour cream.
168,33,32535,Creamy Grape Salad,sp_aUSaElGf_32535_c_306729,u_1oKVpNtMRAAQGXgFatgzIHKdvwD,yodi82,1,1622717868,0,0,0,5,100,"This is a great salad.  The 1st time I made it, family was unsure but at the end of the day nothing was left and I have to make it almost all the time now for everything."
169,33,32535,Creamy Grape Salad,sp_aUSaElGf_32535_c_114500,u_1oKVeMtsNEng1JY9lxzpovhBfsq,thnkucn,1,1622716919,0,1,0,5,193,Always a hit.  I use powdered sugar instead of granular.  I think it mixes in better.
170,33,32535,Creamy Grape Salad,sp_aUSaElGf_32535_c_176658,u_1oKWJXj184F59chEzbXHUbiVztO,mondak66,1,1622717195,0,0,0,5,100,I have made this several times and our grandchildren love this salad and think it is a wonderful treat.
171,33,32535,Creamy Grape Salad,sp_aUSaElGf_32535_c_170694,u_1oKXQTGYM9TtD6fG97BuQ2IrYck,delewis,1,1622717162,0,0,0,5,100,"I had this at a baby shower and loved it. I have shared the recipe with many others and have made several times, and always get rave reviews."
172,33,32535,Creamy Grape Salad,sp_aUSaElGf_32535_c_170753,u_1oKXSRaopxC94a7KehGeYIQcLpG,lele314,1,1622717194,0,0,0,5,100,I had this at a pot luck at work and a co-worker refused to give me the recipe. Only thing different is she used crushed Butterfingers on top and it was awesome. Thanks for the recipe!
173,33,32535,Creamy Grape Salad,sp_aUSaElGf_32535_c_130416,u_1oKW1Tc99noEAfTNG5shWjAoiJs,reneesue43,1,1622717004,0,0,0,0,100,divide by 8 and round up or down. depending if u want left-overs.Zach
174,33,32535,Creamy Grape Salad,sp_aUSaElGf_32535_c_377494,u_1oKWD7LdSnswGjqJSaSFr5T9tbo,sjanz,1,1622718193,0,0,0,0,100,Yummy =)  Everyone loved it.
175,33,32535,Creamy Grape Salad,sp_aUSaElGf_32535_c_202836,u_1oKVpGYXpPQmrU156G5pNWtiDhz,Allspice_Mo,1,1622717348,0,0,0,0,100,"I only need about 4 servings of this, do you have the breakdowns for just this many?"
