Unnamed: 0,recipe_number,recipe_code,recipe_name,comment_id,user_id,user_name,user_reputation,created_at,reply_count,thumbs_up,thumbs_down,stars,best_score,text
246,14,7178,Zucchini Cupcake,sp_aUSaElGf_7178_c_171617,u_1oKW7aCcvYI0IYZxyWEAIA1veLO,silly girl,1,1613039656,0,0,0,5,100,<p>I have already written something about this recipe but I have to write again.  Previously I used my mom&#39;s zucchini recipe and this frosting recipe.  I decided to try this recipe just as it is written and they were incredible.  I did not drain the zucchini either...and there was a lot of liquid too.  This is how good they are...I first made them and accidentally added 1 third cup sugar instead of 1 and a third cup ( my bad handwriting).  My 6 nephews and nieces ran in from outside and grabbed one even though I told them what I did.  They were all gone in less then 5 minutes!!!  I personally didn&#39;t care for them but they still raved about how good they  were.  I then made a second batch...to me it was much better:))</p>
247,14,7178,Zucchini Cupcake,sp_aUSaElGf_7178_c_315917,u_1oKWA49VonjJtQKCRDWKLaEx5f9,sugarlou,1,1622717887,0,0,0,5,100,This is our new favorite zucchini recipe.  The frosting is just like my mother in law&#39;s Danish fudge.
248,14,7178,Zucchini Cupcake,sp_aUSaElGf_7178_c_182969,u_1oKW8yQIsAnMXDK5LR6rlh3LvSu,towanda7,1,1622717256,0,0,0,0,100,I love feeding my grandkids healthy desserts. They truly devoured these. The first time I made them they were very dense. I set the grated zucchini in a colander to drain before I made them the next time and they were perfect.
249,14,7178,Zucchini Cupcake,sp_aUSaElGf_7178_c_288376,u_1oKZPFzSLDXvRKpdnoVDYFeB5mj,pjdour,1,1622717793,0,0,0,0,100,These are a favorite with my kids.  They love them!
250,14,7178,Zucchini Cupcake,sp_aUSaElGf_7178_c_251403,u_1oKZkq6vXixFEuJE3vD65BHZAkY,Karav,1,1622717573,0,0,0,0,100,My favorite of all my zucchini recipes!
251,14,7178,Zucchini Cupcake,sp_aUSaElGf_7178_c_268498,u_1oKVxaz56wrkMuS7Jt2KUcXnqKG,ppeart,1,1622717666,0,0,0,0,100,re: zucchini cupcakes---these are so moist and full of flavor--if you don&#39;t want to frost em just have them with cool whip!!
252,14,7178,Zucchini Cupcake,sp_aUSaElGf_7178_c_119346,u_1oKVl7ROk9bFqnOMUIvqNB1vgcq,browneyes326,1,1622716940,0,0,0,5,100,Best cupcakes I ever made. Great cake &amp; great frosting. They compliment each other so well.
253,14,7178,Zucchini Cupcake,sp_aUSaElGf_7178_c_148036,u_1oKW4RKcN14wNsxRcJbernuBcZh,jane428,1,1622717092,0,0,0,5,100,GREAT cupcake the frosting was yummy!
254,14,7178,Zucchini Cupcake,sp_aUSaElGf_7178_c_161471,u_1oKVnJ1VxzMNOsoSzeyS4f399bM,Chris Recipes,1,1622717138,0,0,0,0,100,"I baked in a 9x13 pan for 31 min., substituted milk for OJ and omitted cloves. Great!  Use 1 1/2 c. powd. sugar for frosting, otherwise it&#39;s too stiff to spread  "
255,14,7178,Zucchini Cupcake,sp_aUSaElGf_7178_c_360355,u_1oKc9p0PGc1LvKFYfbnSgBMTTBp,aaemgilbert,1,1622718148,0,0,0,4,100,"Very Yummy, and the frosting is Fabu!"
256,14,7178,Zucchini Cupcake,sp_aUSaElGf_7178_c_298963,u_1oKY0hOoF9Ege8PQWAgmDEje5gQ,lollygag_CA,1,1622717812,0,0,0,0,100,"They are good, but even though there is zucchini in there, it&#39;s got too much sugar, fat, and white flour in them to be thinkin&#39; the veggies in there will make them &#34;good for you&#34;. It is a good excuse to make cupcakes though, when you have alot of zucchini, lol."
257,14,7178,Zucchini Cupcake,sp_aUSaElGf_7178_c_188972,u_1oKXJ4I0nm7nqBILRPfstrU24cT,Pattyn,1,1622717253,0,0,0,0,100,I made these cupcakes due to the over abundant supply of zucchini we have in our garden and they were absolutely delicious!  I brought them to work and EVERYONE raved about them.  The carmel frosting really added that special touch. I would definitely make them again.
258,14,7178,Zucchini Cupcake,sp_aUSaElGf_7178_c_181606,u_1oKVafJad2iPVszxQVhWyHmBEcd,Monarchsmomma,1,1622717246,0,0,0,5,100,I like to make these cupcakes with only half of the frosting.  They are pretty sweet with the whole amount.  I have also served them without the frosting.
259,14,7178,Zucchini Cupcake,sp_aUSaElGf_7178_c_328880,u_1oKYBCh0j8Vft5a80KIhuK96dNG,mdv6253,1,1622717954,0,0,0,0,100,This recipe yielded surprised comments from those friends who tried it to find it contained zucchini. Next time I make it I will add raisins and/or nuts and use a cream cheese frosting to take away some of the sweetness. Very good!!
260,14,7178,Zucchini Cupcake,sp_aUSaElGf_7178_c_406034,u_1oKcJUJ0eNVXgU17KeugzmgqTxI,norsen9390,1,1622718354,0,0,0,4,100,My 4 year old helped me make these so she could take a &#39;treat&#39; to daycare! They were a big hit!! They never knew that they were eating their vegetables! Great recipe!
261,14,7178,Zucchini Cupcake,sp_aUSaElGf_7178_c_371427,u_1oKXdDjBSbktC4iMm8GnxHQD3ZW,trudy turcotte,1,1622718152,0,0,0,5,100,With the abundance of zucchini in our garden it made sense to try this recipe and am I glad I did!!!!I took the cupcake to work and everyone RAVED about them!! The ones I left at home the kids ate up and wanted more! I did not frost my cupcakes and no one noticed!!I actually shred my zucchini and vacuum seal it in 1 cup bags then have it in my freezer when I want the taste of summer in the middle of the winter!Thanks for sharing the recipe it is awesome!
262,14,7178,Zucchini Cupcake,sp_aUSaElGf_7178_c_136496,u_1oKWMTaO8bqVTF8OV4nmFsTEY2m,kazylady,1,1622717007,0,0,0,0,100,Eveyone loved these especially the grandkids said tasted like reeses peanut butter cups.
263,14,7178,Zucchini Cupcake,sp_aUSaElGf_7178_c_373723,u_1oKbiFvnheQxgD52T5s5eiNFHpb,oneofnine,1,1622718177,0,0,0,5,100,Wow are these good!  My husband who does not really like zucchini really loves these cupcakes.
264,14,7178,Zucchini Cupcake,sp_aUSaElGf_7178_c_183822,u_1oKXELRvMjZBd8kdUkVUamzq3Nu,brendabrown,1,1622717245,0,0,0,0,100,"I love the peel left on.  If you pick them before any large seeds form and then shred them in the food processor, you will never be able to tell there are seeds or peels except for the pretty green flecks in the finished product.  Besides, the peel has most of the nutrition."
265,14,7178,Zucchini Cupcake,sp_aUSaElGf_7178_c_224961,u_1oKVZsc5N0Y7ltHsKAfmNihfU08,jetluvs2cook,1,1622717429,0,0,0,0,100,it is whatever you prefer. my dh doesn&#39;t like the peeling so i always peel and seed it for my recipes. i like it myself and will eat it with the peel and the seeds. if you have picky eaters its best to go ahead and peel it.
266,14,7178,Zucchini Cupcake,sp_aUSaElGf_7178_c_222652,u_1oKY3Qnyo0mPV0F6YELlpCtMxzg,Sharbogast,1,1622717452,0,0,0,0,100,"I&#39;m not use to baking with zucchini so I have to ask, do you peel it before you shred it, or leave the peeling on?  Thank you for your time."
267,14,7178,Zucchini Cupcake,sp_aUSaElGf_7178_c_155477,u_1oKW5azlPIzO65eKwhdP66Fm19p,AuntieRachel,1,1622717083,0,0,0,0,100,"Hi Wesley, I encountered a similar problem. Try cooling your sugar/butter mixture a bit more and that should help. IN fact I could cool it down to less than tepid: like a baby&#39;s bottle."
268,14,7178,Zucchini Cupcake,sp_aUSaElGf_7178_c_277559,u_1oKYZjVjXrYdFWIVffYANp9w0A9,Wesley Chapel Terry,1,1622717690,0,0,0,3,100,Substituted cucumber for zucchini-works well/substituted 2/3 c Splenda Blend for sugar/not a moist cupcake/frosting required 3+ c confectioners sugar for spreading consistency-anything less would create glaze consistency
