Unnamed: 0,recipe_number,recipe_code,recipe_name,comment_id,user_id,user_name,user_reputation,created_at,reply_count,thumbs_up,thumbs_down,stars,best_score,text
86,51,7539,Fluffy Pancakes,sp_aUSaElGf_7539_c_294424,u_1oKaYWk0A8WZtY53ElxZyW7JDiK,AITaylor,1,1622717795,0,0,0,5,100,"These pancakes truly were light, fluffy, and delicious. I added about 1/2 tsp of cinnamon to the dry ingredients and 1 tsp vanilla to the wet ingredients. My family loves vanilla flavored pancakes. I also dropped fresh blueberries onto each pancake while the first side was cooking. I had a bit of trouble combining the melted shortening with the milk and egg. Ultimately, I heated the milk and shortening together in the microwave for about 30 seconds and then whisked them together vigorously while adding the egg. Not sure if that&#39;s the best technique, but I was pleased with the product."
87,51,7539,Fluffy Pancakes,sp_aUSaElGf_7539_c_294400,u_1oKVaB6ZQlqTQ4BbPF44G6vIKUI,hotfudgesundae,1,1622717820,0,0,0,5,100,"These pancakes had  excellent flavor, plus being tender and fluffy. Will definately keep this recipe to make them again."
88,51,7539,Fluffy Pancakes,sp_aUSaElGf_7539_c_294542,u_1oKVZPP8jYZRYPrNWRdDSTevmF4,afoth73,1,1622717801,0,0,0,5,100,These pancakes were way better than Bisquick box mix.  They were way fluffier and delicious!  My husband and 7 year old loved them too!  The best part is the ingredients are things I always have on hand too!!
89,51,7539,Fluffy Pancakes,sp_aUSaElGf_7539_c_376468,u_1oKVuD5cjvKzyxZzEIDPL3yoEhS,busynursemom,1,1622718212,0,0,0,5,100,Yum!  I doubled the batch and added 3/4 cup milk and 3/4 cup buttermilk.  Needed to add a little more milk to thin the batter. Turned out light and fluffy.
90,51,7539,Fluffy Pancakes,sp_aUSaElGf_7539_c_206182,u_1oKVn54QBBEQw9KTkprk2v9BGft,john,1,1622717373,0,0,0,5,100,"I substituted Coconut oil for the shortening, absolutely my all time favorite pancakes.  Thank You for sharing!"
91,51,7539,Fluffy Pancakes,sp_aUSaElGf_7539_c_257232,u_1oKZJOCtw1Kdh4PBLuCXENNyEiK,douglas_in_philly,1,1622717595,0,0,0,5,100,"My ten year old daughter really loved these pancakes!  She declared them the fluffiest ever!  I have to admit that I agree.  They were very simple to make, and delicious!I just made them for the second time, and they were just as good as the first!  So I didn&#39;t just get lucky the first time!Both times, I&#39;ve doubled the recipe.***Update - 2017-05-30***These have become my &#34;go to&#34; pancake recipe for sleepover breakfasts.  Several of her friends have declared them the best pancakes ever.  They&#39;re so easy, and so tasty!"
92,51,7539,Fluffy Pancakes,sp_aUSaElGf_7539_c_295568,u_1oKVdZgVe0ACkmVJamQvB59xGvG,greatwithoutgluten,1,1622717790,0,0,0,4,100,These turned out tasty. I used butter instead of shortening and changed to gluten free all-purpose flour. I also added vanilla extract and used additional milk. I am looking forward to trying different variations on these like adding fruit!
93,51,7539,Fluffy Pancakes,sp_aUSaElGf_7539_c_285880,u_1oKZOQqmSprnvUbMqgfK7b8zsq5,bavarianraspberry,1,1622717771,0,1,0,1,193,"the pancake looked like a potatoe pancake, would not brown."
94,51,7539,Fluffy Pancakes,sp_aUSaElGf_7539_c_298701,u_1oKX52UbWtM4EJmQS9ff6UcuWn8,shellabe1974,1,1622717842,0,0,0,5,100,Theses are the best pancakes I have ever made! The kids and husband love them. The only thing I did to this recipe was added buttermilk just enough to make it more pourable. I have tried a lot of recipes and nothing compares to this one.
95,51,7539,Fluffy Pancakes,sp_aUSaElGf_7539_c_291343,u_1oKZUvRSIkAb0NUFAZGFjxMURVu,smelmo83,1,1622717756,0,0,0,5,100,These are the best pancakes I have ever made! I will never go back to frozen or a box again. This recipe doesn&#39;t take long at all and they turn out perfect everytime!
96,51,7539,Fluffy Pancakes,sp_aUSaElGf_7539_c_268883,u_1oKWr4Hx7DfJooSk8XWmryCA39Y,Nefertiti83,1,1622717676,0,0,0,5,100,Really easy to make and taste great. No more boxed mixes for me :)
97,51,7539,Fluffy Pancakes,sp_aUSaElGf_7539_c_377810,u_1oKVlVN5Xtktc5Dc20w7SEmJLsz,puppypal81,1,1622718195,0,0,0,5,100,Yummy!  :)
98,51,7539,Fluffy Pancakes,sp_aUSaElGf_7539_c_154392,u_1oKWmRTnS4wE3OxYm2Bd806j771,audreyp04,1,1622717105,0,1,0,5,193,"Have tried these now with several substitutes for the shortening - oil, canned pumpkin, sweet potato, applesauce &amp; cinnamon, baby food fruit purees and all work great! Very versatile! Also buttermilk makes them even fluffier. These are our go to pancakes and loved by my toddler!"
99,51,7539,Fluffy Pancakes,sp_aUSaElGf_7539_c_295072,u_1oKWWvykonxY65ADfIjsEU1y3wc,lil momma jenn,1,1622717835,0,0,0,4,100,These taste great but fall apart
100,51,7539,Fluffy Pancakes,sp_aUSaElGf_7539_c_353445,u_1oKZcvUwdtO7xnTE0zktuR9RNvI,amazaw,1,1622718113,0,0,0,5,100,Very good recipe! I used white wheat flour and coconut crystals in place of sugar. Also added vanilla and cinnamon.
101,51,7539,Fluffy Pancakes,sp_aUSaElGf_7539_c_354328,u_1oKVZTi0UOjTtdNBtFIYYHyN2x6,LauraManning,1,1622718078,0,0,0,5,100,"Very good! I also subbed 2 T. of oil for the shortening, and it was plenty."
102,51,7539,Fluffy Pancakes,sp_aUSaElGf_7539_c_117890,u_1oKVbuNwa918T8mUYyd1mvcxhNU,marnie12,1,1622716934,0,0,0,5,100,Awesome!
103,51,7539,Fluffy Pancakes,sp_aUSaElGf_7539_c_244343,u_1oKWkh3rBTwt8vjz46m3zkJcK0N,Annie216,1,1622717542,0,0,0,5,100,Make sure to warm up your milk and to &#39;temper&#39; the egg and butter so it doesn&#39;t congeal.
104,51,7539,Fluffy Pancakes,sp_aUSaElGf_7539_c_215143,u_1oKYMlXrJAGi7WYttag799o9RDi,Tammyjean1969,1,1622717365,0,0,0,5,100,"I was looking for a good pancake recipe, I used this one added not quite a teaspoon of cinnamon, a dash of ground ginger and nutmeg and 1/4 of chopped pecans, they were awesome!"
105,51,7539,Fluffy Pancakes,sp_aUSaElGf_7539_c_249914,u_1oKZJOe5JYcBak3u7ilWRsamqaK,AshCakes,1,1622717572,0,0,0,5,100,"My family loves these pancakes, especially my  five year old! Definitely making these again!"
106,51,7539,Fluffy Pancakes,sp_aUSaElGf_7539_c_151663,u_1oKVZxNyweYeP3lQTMS89TQLWg3,spiker1,1,1622717100,0,0,0,5,100,Great tasting pancakes. The family loved these.
107,51,7539,Fluffy Pancakes,sp_aUSaElGf_7539_c_275295,u_1oKVZvqd1cN8E19DHv8OXXsyi42,KY_Cook,1,1622717721,0,0,0,5,100,So simple to make and so delicious to eat....
108,51,7539,Fluffy Pancakes,sp_aUSaElGf_7539_c_171936,u_1oKXKUSGnEIuq4ycdAG0h9nYU6O,kylachlan,1,1622717200,0,0,0,5,100,I have been looking for a pancake recipe that my children could not get enough of. This is it. They are perfect!!!!
109,51,7539,Fluffy Pancakes,sp_aUSaElGf_7539_c_257269,u_1oKZKRTCs7iuVQd4W03BkAIQHgv,JohannaO,1,1622717615,0,0,0,5,100,"My two-year-old and I really enjoyed these this morning. Only alteration I made was adding a little vanilla extract. Otherwise, we kept it simple and as is. Delicious!"
110,51,7539,Fluffy Pancakes,sp_aUSaElGf_7539_c_205967,u_1oKWmRTnS4wE3OxYm2Bd806j771,audreyp04,1,1622717358,0,0,0,5,100,I substitute 1/4 c. canola oil for the melted shortening and it works great!
111,51,7539,Fluffy Pancakes,sp_aUSaElGf_7539_c_146507,u_1oKW5Jg2yWSsv4ecX5QosBUUQkm,luvya848,1,1622717062,0,0,0,5,100,Good simple recipe
112,51,7539,Fluffy Pancakes,sp_aUSaElGf_7539_c_288426,u_1oKXQkkNRH0ebe91aD98WGpXwzS,LollisMommy,1,1622717750,0,0,0,5,100,"These are a family favorite, and they freeze really well too!"
113,51,7539,Fluffy Pancakes,sp_aUSaElGf_7539_c_342865,u_1oKaRiYi2XL3uUNpxiicaPkE61Z,jennylearnstocook,1,1622718032,0,0,0,4,100,This was the best recipe ever for pancakes!  I tried one morning and the kids loved them.  I just need to double the recipe this time because it was not enough last time.
114,51,7539,Fluffy Pancakes,sp_aUSaElGf_7539_c_118624,u_1oKVadP7LxCJhGM73HAw1lyOptw,jslvsclf,1,1622716938,0,0,0,5,100,"Because of my sight, I am always leery about cooking certain foods; I cannot see down so I don&#39;t know if they are cooked...These pancakes were very good and a big confidence booster-Thanks!"
115,51,7539,Fluffy Pancakes,sp_aUSaElGf_7539_c_314141,u_1oKVuRKIyikPpJDj9eqzjItWG9X,sarahdraper08,1,1622717921,0,0,0,5,100,"This is my new favorite pancake recipe! Very few ingredients, easy to make....but so GOOD. Pancakes are super fluffly (much fluffier than the pic shows). The outside is a slightly crisp golden brown and the middle is a perfect dense &#34;cake.&#34; This will be my Sunday morning pancake recipe from now on!"
116,51,7539,Fluffy Pancakes,sp_aUSaElGf_7539_c_235449,u_1oKVlSUIbWEOUoajBNtwpsR6ElO,wombie,1,1622717521,0,0,0,5,100,"Love this recipe, very fluffy pancakes.  A great way to start the day!"
117,51,7539,Fluffy Pancakes,sp_aUSaElGf_7539_c_183332,u_1oKVgPp1TpkW9qb7G19r2LBSh0d,jicook13,1,1622717241,0,0,0,5,100,"i love pancakes i eat them almost everyday, sometime i will put strawberry pie filling on top, they are so good"
118,51,7539,Fluffy Pancakes,sp_aUSaElGf_7539_c_376388,u_1oKb4sepWm3bUBFxpJewMM8rhBv,ksmarsh1,1,1622718221,0,0,0,5,100,YUM our girls say they are a favorite before school.  Make ahead and put in the frig...
119,51,7539,Fluffy Pancakes,sp_aUSaElGf_7539_c_264740,u_1oKVp2P5r5hxYBqzwYwrk54BxKF,mariekelly,1,1622717654,0,0,0,5,100,"our favorite pancakes, wayyyy better than store mixes...my 11 yr old son makes them its that easy, and we use 1/4 c oil, and more milk"
120,51,7539,Fluffy Pancakes,sp_aUSaElGf_7539_c_334129,u_1oKb3xCmj0NmISfHigeZXGG1P86,letgracereign,1,1622717967,0,0,0,5,100,"This was a wonderful recipe! It&#39;s light, a bit flaky, and overall delicious. I made it for my dad. He loved it and keeps asking me to make it everyday . It&#39;s so easy to make!"
121,51,7539,Fluffy Pancakes,sp_aUSaElGf_7539_c_269726,u_1oKWAs7rDjpm9hIrDE7Uf0N99RQ,lovemyman,1,1622717681,0,0,0,5,100,"really good, i used oil also and just a little more sugar, wonderful!!"
122,51,7539,Fluffy Pancakes,sp_aUSaElGf_7539_c_249744,u_1oKZG3mGH882IHgmMgLo8sSwFHW,cassik,1,1622717582,0,0,0,5,100,My family loves these pancakes! We make them every Saturday and sometimes during the week as well!
123,51,7539,Fluffy Pancakes,sp_aUSaElGf_7539_c_149150,u_1oKVbjKixqonCk3xTIVq9JnlY8q,Laura Moser,1,1622717070,0,0,0,5,100,"Great pancakes.  We added blueberries to our batter.  Turned out perfect, no more buying mixes at the store for this family."
124,51,7539,Fluffy Pancakes,sp_aUSaElGf_7539_c_363425,u_1oKVhbVNV2GkhnPXTH7CsMNSBQ4,eli05,10,1622718105,0,0,0,2,100,We have tried them twice now and don&#39;t like them.
125,51,7539,Fluffy Pancakes,sp_aUSaElGf_7539_c_258677,u_1oKVk98ryYzO2b5OHZUzZ5sQT64,drufen,1,1622717626,0,0,0,5,100,Nice fluffy pancakes.  I used oil instead of shortening and added a a little more milk and make a double batch.  Turned out great.  This will be my  pancake mix from now.  Thanks for the recipe and the tips!
126,51,7539,Fluffy Pancakes,sp_aUSaElGf_7539_c_159420,u_1oKWEQF0LTLyBxYitgQLbdF6mol,glitterpeaches,1,1622717132,0,0,0,4,100,"I also had to add a tad more milk, but they were great and I will make again!"
127,51,7539,Fluffy Pancakes,sp_aUSaElGf_7539_c_135191,u_1oKW1roF2WEOf9ppW2T5BT3KvTb,Danielleccl,1,1622716988,0,0,0,5,100,"Even though I had to add alot of extra milk to thin out the batter, these were the best pancakes I&#39;ve made from scratch in a long time!! Thanks for posting this recipe it&#39;s going into my favorites!!"
128,51,7539,Fluffy Pancakes,sp_aUSaElGf_7539_c_126497,u_1oKVaDxMVcNLJ6Bau5tMfQYaicQ,kathyguerra,1,1622716959,0,0,0,5,100,Delicious!  Those of you who substitued oil: did 2 tbs oil replace the 1/4 cup of shortening?
129,51,7539,Fluffy Pancakes,sp_aUSaElGf_7539_c_202988,u_1oKXWrujEWIk4ng1KjMLLnCUgQM,williamsm,1,1622717339,0,0,0,5,100,I prepared this also for my co-workers breakfast. I add little cinammon to give a better flavour and the taste. it was really a hit. I will make this again. thank you.
130,51,7539,Fluffy Pancakes,sp_aUSaElGf_7539_c_146859,u_1oKVaKqoY6zGlvOLfpoO64PPMnX,nyholm,1,1622717075,0,0,0,4,100,"good, but super thick batter."
131,51,7539,Fluffy Pancakes,sp_aUSaElGf_7539_c_297326,u_1oKacjkrLgQz5OhyXoEaOp3ZYG1,deetero1,1,1622717834,0,0,0,5,100,These were quick and easy and by adding a little more sugar and baking powder they were sweet and fluffy. My grandson ate them right off the griddle and said homemade was better than going out! No more pancakes houses for him!
132,51,7539,Fluffy Pancakes,sp_aUSaElGf_7539_c_150619,u_1oKWm5XmFn0ErMeYx3CQKarWGgF,thep,1,1622717063,0,0,0,5,100,Great recipe.  I would defiantly make these again.
133,51,7539,Fluffy Pancakes,sp_aUSaElGf_7539_c_290182,u_1oKYzch2koYshdIsjO3iP6nbMfR,tom1732,1,1622717799,0,0,0,5,100,These are nice! I like having light pancakes.
134,51,7539,Fluffy Pancakes,sp_aUSaElGf_7539_c_122720,u_1oKVdLzaC5Bv7xEvkKVrXI7E9Gm,MmeBlaise,1,1622716944,0,0,0,5,100,"Cooks faster than my usual recipe for pancakes.  Easy to make.  Big, fluffy, and tasty.  Yum!"
135,51,7539,Fluffy Pancakes,sp_aUSaElGf_7539_c_291958,u_1oKVdnDyDz7Xw0Y1cSyipxzv4qZ,rrfrey21,1,1622717800,0,0,0,5,100,"These are wonderful pancakes!! Very easy to make as a last minute meal any time of the day.  I double the batch and freeze them for my kids, they love how fluffy they are!! I will make these pancakes many more times. Thanks!"
136,51,7539,Fluffy Pancakes,sp_aUSaElGf_7539_c_119448,u_1oKVgzpkv0Uj7OeLMU8QWqheoHn,Mizeet,1,1622716936,0,0,0,5,100,"Best pancakes ever! I added a little more milk because the batter seemed to thick to pour.  Big fluffy panakes, will definitely make again!"
137,51,7539,Fluffy Pancakes,sp_aUSaElGf_7539_c_249747,u_1oKZGHTruBsmoupYam2TvS8iJ83,Elyelle,1,1622717582,0,0,0,5,100,"My family loves these pancakes. They are very light and fluffy and are made of ingredients we always have on hand. We usually double the recipe and it makes about 12 larger pancakes. And we make these with 2tbsp of oil instad of the shortening, like some of the other reviewers."
138,51,7539,Fluffy Pancakes,sp_aUSaElGf_7539_c_357195,u_1oKbdskGtqzGGPprH2SUkrb6Heo,nutmeg85,1,1622718122,0,0,0,4,100,Very light and fluffy. I also used 2 tbs of oil and they came out perfect!
139,51,7539,Fluffy Pancakes,sp_aUSaElGf_7539_c_281378,u_1oKX4O2QHlxxGug9WlWuOneeg5R,cherylrtripp,1,1622717717,0,0,0,5,100,"Thanks for the recipe! They turned out great,and the serving size is perfect.  This was what I was looking for.  Thanks again."
140,51,7539,Fluffy Pancakes,sp_aUSaElGf_7539_c_291362,u_1oKVfW4ZyMujTOSlJ07kYl9McvL,bakingmad,1,1622717780,0,0,0,5,100,"These are the BEST pancakes!  I use 2 Tablespoons of oil instead of the melted shortening, and use buttermilk instead of regular.  The buttermilk will make the batter VERY thick, and you will need to quickly spread it out on the griddle, but makes all the difference.  You can increase the buttermilk to 1 C. to make the batter more pourable and the pancakes will still come out light and fluffy.   I have also doubled the recipe with equally good results."
