Unnamed: 0,recipe_number,recipe_code,recipe_name,comment_id,user_id,user_name,user_reputation,created_at,reply_count,thumbs_up,thumbs_down,stars,best_score,text
79,22,1081,Baked Spaghetti,sp_aUSaElGf_1081_c_162724,u_1oKVZmuIOWbtN4vzlCnwvF4dsNX,bingoqueen63,1,1622717129,0,0,0,5,100,"I cook for bingo, and I have made this several times. Everyone loves it, and it&#39;s easy to make.  I have also made it several times for my family.  They also think it&#39;s super delicious.  I do add salt and pepper.   I triple the recipe and make homemade bread."
80,22,1081,Baked Spaghetti,sp_aUSaElGf_1081_c_173164,u_1oKVjYgYsfzjolJNp5UUU7pjs5W,mdbull4,1,1622717184,0,0,0,0,100,"I have been using this recipe for a long time! It is so good :) if you&#39;re in a hurry you can skip the onion &amp; green pepper &amp; burger, as well as use spaghetti sauce. Although it tastes best following the recipe as stated."
81,22,1081,Baked Spaghetti,sp_aUSaElGf_1081_c_212579,u_1oKVa6fb9ZNJkSaFRDQhulUPwsA,leslie1966,1,1622717391,0,0,0,4,100,I used Italian sausage instead of ground beef. It was really good. Makes a lot!!!
82,22,1081,Baked Spaghetti,sp_aUSaElGf_1081_c_153690,u_1oKVtnnaU7RfiISHoaFVXkhczRb,Deester,1,1622717097,0,0,0,5,100,"Have been making this TOH recipe to rave reviews for years, it is my go to recipe when I make Baked Spaghetti.  Making it tomorrow for my husband to share with his co-workers!"
83,22,1081,Baked Spaghetti,sp_aUSaElGf_1081_c_172595,u_1oKVeq2rJ0OLIv0bTI2TdXZUSxi,kshea,1,1622717180,0,0,0,5,100,I have been making this for years. It is the best! Everyone loves it.
84,22,1081,Baked Spaghetti,sp_aUSaElGf_1081_c_158306,u_1oKVqm9yMaMhX7l5hQOn01OGtwV,SassyLacey,1,1622717129,0,0,0,5,100,"I added some Italian Seasoning, garlic powder, salt &amp; Pepper for a bit more flavor.  I cooked my beef and vegetables in olive oil, for all I believe that all Italian dishes must have olive oil.  Also added it to the spaghetti water.  It needed about 1 1/2 cans mushroom soup and another 1/8 cup water.  I felt that it was a little dry so I willtry adding more tomatoes to it next time.  Took this to a church dinner and still got lots of compliments and requests for the recipe."
85,22,1081,Baked Spaghetti,sp_aUSaElGf_1081_c_259761,u_1oKWzlU7ufvnzLMHtWdqRWNfl00,jponce23,1,1622717607,0,0,0,3,100,"Not bad, it came out a little plain and had no taste (I followed the recipe without any changes). I would add more salt and seasonings before baking this dish. I added seasonings and hot sauce to this after I noticed it had no taste and it eas then edible and I didn&#39;t mind it but my husband barely touched his plate so I wouldn&#39;t make this again."
86,22,1081,Baked Spaghetti,sp_aUSaElGf_1081_c_201923,u_1oKXlXdSwyh2bjsxGsGVHkIFt8Q,VirgoQT,1,1622717307,0,0,0,5,100,"I must say this was absolutely delicious. I made mine with whole wheat spaghetti, ground turkey and followed the rest of the recipe to a tee. I will be making this again, thanks for sharing!"
87,22,1081,Baked Spaghetti,sp_aUSaElGf_1081_c_348589,u_1oKWUIU6AHVKnkA2bA2mwtWz7Bz,Joanna07,1,1622718099,0,0,0,5,100,"unexpectedly good! I was a bit skeptical (mushroom soup?!) but I trusted what the reviewers said gave it a try.  Really good!  My father-in-law and husband both had three helpings!  I did change a couple things: yellow pepper instead of green, and fresh mushroom instead of canned, since this is what I had.  I also left out the meat to keep it vegetarian. I also assembled everything the night before and then popped it into the oven for dinner, which made things that much easier on a busy mom.  I will be making this again."
88,22,1081,Baked Spaghetti,sp_aUSaElGf_1081_c_251374,u_1oKY43dyzVeReftP9DEEV4rf87Q,ArtsBabyDoll,1,1622717563,0,0,0,5,100,My first time baking Spaghetti and absolutely in love with this meal. Hubby and kids loved it and would like me to make this again soon. I used a bigger can of mushroom and used 2 cans of cream of mushroom. LOVE LOVE LOVE this recipe.
89,22,1081,Baked Spaghetti,sp_aUSaElGf_1081_c_317987,u_1oKbGFeBolRCcQ15apTermN0Ofj,C K,1,1622717893,0,0,0,5,100,"This is the #1 favorite of my son, so I make it often.  The whole family loves it!   We cannot eat bell pepper, so I omit them."
90,22,1081,Baked Spaghetti,sp_aUSaElGf_1081_c_201440,u_1oKVoLIb90x2gcLwnYDwovaSour,brillig45,1,1622717307,0,0,0,5,100,"I make this recipe often, and everyone loves it, including the grandkids! I even make it for bunco, getting raves over it! The only addition I make is a very small can of tomato sauce when I add the diced tomatoes.  It&#39;s so delicious and comforting. LOVE this recipe!"
91,22,1081,Baked Spaghetti,sp_aUSaElGf_1081_c_331776,u_1oKVeZxG5B9F3xo8j0fYyq9H0xW,Voncille,1,1622717983,0,0,0,5,100,This very recipe came out in 1995 and I have used it many times since. Everyone loves it!
92,22,1081,Baked Spaghetti,sp_aUSaElGf_1081_c_172789,u_1oKXbsGSWanLzd74rBqHuiMtoOh,ceb08,1,1622717181,0,0,0,5,100,"I have been making this for years, it is one of my families favorites. I make it often for company for something different and it always gets rave reviews. Don&#39;t let the different ingredients detour you. It is a flavor combo that is unexpected, delicious and packed full of veggies."
93,22,1081,Baked Spaghetti,sp_aUSaElGf_1081_c_175981,u_1oKXVpYbFIU90CDLYpJLNHZJE1H,donna fischer,1,1622717205,0,0,0,5,100,I have made this recipe several time. My son-in-law says this is the best. It&#39;s very good.
94,22,1081,Baked Spaghetti,sp_aUSaElGf_1081_c_351973,u_1oKVaFi81jH9ZC4aNzsiajivIXd,Smanzi,1,1622718106,0,0,0,4,100,Very good although I made it without olives (don&#39;t care for them).  Also made a side portion without meat for the vegetarian.  Everyone enjoyed it.
95,22,1081,Baked Spaghetti,sp_aUSaElGf_1081_c_315623,u_1oKbiGbRD5NQp3vjzGJpAw5EYbm,JesSel,1,1622717887,0,0,0,5,100,This is one of the most delicious dinners we have had.  It freezes well too. :)
96,22,1081,Baked Spaghetti,sp_aUSaElGf_1081_c_205928,u_1oKWsqwRyMxMi84k38V4W5GPKqw,Noble3430,1,1622717361,0,0,0,5,100,"I started making this recipe in 1994 when I first saw it in a Taste of Home magazine. I have found none to compare to this version of baked spaghetti. Everyone that tries it wants the recipe. This recipe is not a traditional tomato based type, but is rather creamy with enough oregano to give it that special ooomph! 18 years is a long time to make a recipe. It&#39;s definitely a keeper. This makes quite a bit. I fed my growing family of four way back in 1994 and had leftovers for several days. Now I make it in its full recipe, but freeze much of it so that I can have it later. I don&#39;t add the cheese to the top of the frozen ones until ready to bake. This recipes freezes beautifully."
97,22,1081,Baked Spaghetti,sp_aUSaElGf_1081_c_174441,u_1oKWwjlJYfwM7c6YUp3SSVjztgE,jazzy mama,1,1622717203,0,0,0,5,100,"I have made this a few times now.  I have made a few adjustments, I add only 1 can of tomatoes, also I add garlic salt and Mrs Dash Spicey seasoning (2 tsps each) to the mixture when I add the oregano.  I also add a little paprika to the cream if mushroom sauce before I spread the soup over the casserole.  I feel this adds enough extra spice to give it alot of taste.  Everyone in my home loves this dish."
98,22,1081,Baked Spaghetti,sp_aUSaElGf_1081_c_343156,u_1oKVyQqaa7YoV61eGqIJUwQJVqy,rhonda1,10,1622718032,0,0,0,5,100,"This was the first recipe I ever tried from taste of home back in 1994. It has been a family favorite. I can&#34;t begin to tell you the number of times I have made it or the number of recipes I have given out. The only thing I do differently is instead of diced tomatoes, I use crushed. My family does not like big chunks of tomatoes"
99,22,1081,Baked Spaghetti,sp_aUSaElGf_1081_c_197523,u_1oKXrd4Iyy3aYEgT5789a2qZnRj,ristiles,1,1622717313,0,0,0,5,100,"I made this recipe when it was first published (1994?) and it has been a favorite since that time.  On occasion I have used rotini instead of spaghetti, especially when taking for something special."
100,22,1081,Baked Spaghetti,sp_aUSaElGf_1081_c_200803,u_1oKWxYUPF17CVwttjrP5ro1wQm8,finn5,1,1622717333,0,0,0,5,100,I make this every fall for my guys to take to hunting camp.  It&#39;s their opening night tradition!  Filling--and feeds lots.  Leftovers are great--if there are any!
101,22,1081,Baked Spaghetti,sp_aUSaElGf_1081_c_196486,u_1oKW64VumkGJAsYe55V0Mc4zevZ,lmenard1,1,1622717314,0,0,0,5,100,"I made this recipe about two weeks ago and my husband raved about it.  It makes quite a bit, so we refridged the remainder, reheated it next day at lunch and took the rest to our pastor and wife who were travelling.  Everyone was delighted with it.  Tonight,  I am making it again for family that is coming to dinner.I did do one extra item for this meal though.  I added a CAN of Hunt&#39;s spaghetti sauce with the tomatoes and about a 1/4 of a teaspoon of thyme to boot.  MMMMM good stuff, this."
102,22,1081,Baked Spaghetti,sp_aUSaElGf_1081_c_141113,u_1oKWH2BCvVF0XiHehCquBAvCM12,sheri731,1,1622717038,0,0,0,5,100,Family Favorite
103,22,1081,Baked Spaghetti,sp_aUSaElGf_1081_c_236157,u_1oKYXtml5Q0xgOllRIV4Snt8TuL,tldlspringer,1,1622717526,0,0,0,5,100,"Love, Love, Love this recipe.  One of my favorite recipies!"
104,22,1081,Baked Spaghetti,sp_aUSaElGf_1081_c_140936,u_1oKVaUQbnz9qnC14V12eaEE1cWC,slagathor12,1,1622717039,0,0,0,4,100,Fairly easy to make and rather tasty.  We all went in for seconds on this one.
105,22,1081,Baked Spaghetti,sp_aUSaElGf_1081_c_350247,u_1oKZsxsRKzlXgU3AvgvjvDuRP4z,halgm,1,1622718057,0,0,0,1,100,Very dry - too much spaghetti- not much flavor.  Wouldn&#39;t make this again.  I&#39;ll stick with my regular spaghetti recipe.  Not work the effort.
106,22,1081,Baked Spaghetti,sp_aUSaElGf_1081_c_195132,u_1oKY297h2KxfQxWS8cjPZNhTX8T,TRID,1,1622717279,0,0,0,5,100,I made this for the first time last weekend.  My husband and I really enjoyed it.  I will definitely make this again.
107,22,1081,Baked Spaghetti,sp_aUSaElGf_1081_c_323522,u_1oKawuJQo7CdGD9rLUinngQH80y,teishia12,1,1622717932,0,0,0,5,100,This recipe is a family and friend pleaser!!  My husband adores this recipe and friends can&#39;t get enough!
108,22,1081,Baked Spaghetti,sp_aUSaElGf_1081_c_220322,u_1oKXzlc8OijOwPMoEVaCgeK9AxV,1l2e,1,1622717432,0,0,0,5,100,I&#39;ve made this Taste of Home recipe for years....I do add garlic....and the mushroom soup adds a little extra something to it!  Always get compliments and recipe requests!
109,22,1081,Baked Spaghetti,sp_aUSaElGf_1081_c_197895,u_1oKXv0gtRaZ6o56AYP3MrtsRush,CyndyRH,1,1622717330,0,0,1,5,100,"I made this Spaghetti for my family earlier this year and they loved it.  My daughter isn&#39;t wild about traditional spaghetti sauce, so this recipe caught my attention because it only has the canned tomatoes in it. I have since made this for my church Wednesday Night Family Dinner feeding approx 125 people, and have had nothing but great reviews. I did add a few additional ingredients, fresh garlic, salt &amp; pepper, red peppers in addition to the green, and I mix 1 cup 5 Blend Italian cheese with the cheddar cheese."
110,22,1081,Baked Spaghetti,sp_aUSaElGf_1081_c_208402,u_1oKVZvqd1cN8E19DHv8OXXsyi42,KY_Cook,1,1622717343,0,0,0,3,100,I thought this was pretty good....added garlic cause I think spaghetti HAS to have garlic LOL
111,22,1081,Baked Spaghetti,sp_aUSaElGf_1081_c_347447,u_1oKXv0gtRaZ6o56AYP3MrtsRush,CyndyRH,1,1622718074,0,0,0,5,100,"Tried this at home for a different twist on the normal spaghetti and my family loved it.  I did add garlic powder and salt, other than that it was perfect.  I also cook for my church weekly, so since it was a hit at home I made it for 125+ church members with received great reviews."
112,22,1081,Baked Spaghetti,sp_aUSaElGf_1081_c_363333,u_1oKXvQzDzqUx4zYtEPODpI5Haob,loladooder99,1,1622718105,0,0,0,2,100,We just didn&#39;t care for the taste with the cream of mushroom soup it was just weird. Way to much work for something thats edible but not worth making agian
113,22,1081,Baked Spaghetti,sp_aUSaElGf_1081_c_364650,u_1oKVZqALR2x6YqPly9IMRcwxFoT,vewebber58,1,1622718176,0,0,0,5,100,"We love this spaghetti dish!  No, it&#39;s not like traditional spaghetti-with-sauce dishes, not as spicily seasoned, but in it&#39;s own right it&#39;s a delicious dish.  I love the addition of the black olives in it."
114,22,1081,Baked Spaghetti,sp_aUSaElGf_1081_c_256050,u_1oKZy5TaUoCbkPeecBLeOLmzLmH,Branamme,1,1622717591,0,0,0,5,100,My Mom started using this recipe years ago and it remains a favorite recipe. Wonderful flavor. Easy to make. Will remain a favorite. Family loves it.
115,22,1081,Baked Spaghetti,sp_aUSaElGf_1081_c_304624,u_1oKY0sGwlzMmlnDXgN7TqS7PSzG,Taynah,1,1622717863,0,0,0,0,100,"This is a easy to make recipe and my 6 yr old daughter ate it all up...... although she wasn&#39;t to fond of the mushrooms, but that&#39;s an easy change. Will make again."
116,22,1081,Baked Spaghetti,sp_aUSaElGf_1081_c_173091,u_1oKWrDe3cVqyUdsmI6O42BsM2qp,vbanfield,1,1622717176,0,0,0,5,100,I have been making this recipe since first published.  It is our favorite way for spaghetti.  Have never used meat in it.  Sometimes use the homrmade casserole mix for the mushroom soup and only one 14 oz can of tomatoes.  Great leftovers too!
117,22,1081,Baked Spaghetti,sp_aUSaElGf_1081_c_160807,u_1oKW7Hke2AUFVBYQB9Smgnusuxn,SeraSweetie,1,1622717136,0,0,0,5,100,"I am new to this website and WOW! I made this recipe this week and my husband absolutely loved it! Due to what I had in my pantry, I subbed spaghetti sauce and it turned out very yummy. Thank you so much for such an easy and delicious recipe."
118,22,1081,Baked Spaghetti,sp_aUSaElGf_1081_c_286443,u_1oKZhkg7SCuqvlBRaxG5P3vDSxz,pumpkin1944,1,1622717748,0,0,0,5,100,"The review process asked if I&#39;d make this recipe again and my answer is yes, yes and yes!  My husband was never one to enjoy  spaghetti with a meat sauce; but when a friend served us this recipe, he changed his mind about spaghetti. It&#39;s been years now since we first enjoyed it and it&#39;s something that everyone I&#39;ve ever served  raves about. I&#39;ve taken it to my church Pot Luck dinners on many occasions; followed by passed out many requested copies of the recipe. Thanks Ruth Koberna and Taste of Home for this wonderful recipe.Joyce HalliseyMt. Gilead, NC"
119,22,1081,Baked Spaghetti,sp_aUSaElGf_1081_c_184669,u_1oKX8ZAc3sOEsAHOLA0tNKjBYmI,rwarobick,1,1622717249,0,0,0,5,100,"I LOVE this recipe! I have one exactly the same cut from TOH mag probably 15 years ago. I leave off the peppers &amp; I have made it with sweet italian sausage instead of ground beef &amp; used crushed tomatoes instead of the diced. I use a mixture of Cheddar &amp; Mozzarella. Awesome, serves well &amp; freezes well even in individual containers."
120,22,1081,Baked Spaghetti,sp_aUSaElGf_1081_c_199119,u_1oKWasov8XJpWN3ATXotFfnm5bN,p.ballard,1,1622717325,0,0,0,4,100,I made this with keilbasa and no green peppers or mushrooms...it was wonderful!
121,22,1081,Baked Spaghetti,sp_aUSaElGf_1081_c_365398,u_1oKaOEuhslSXEfdKIZBYAdzBfJh,bethinks,1,1622718166,0,0,0,5,100,"We loved this.   I really liked the addition of the cream of mushroom soup.  My dh, who hates anything that contains cream of anything soup, even loved it."
122,22,1081,Baked Spaghetti,sp_aUSaElGf_1081_c_168194,u_1oKWwjlJYfwM7c6YUp3SSVjztgE,jazzy mama,1,1622717154,0,0,0,5,100,"I followed the recipe with just a few changes.   I used a 14 oz can of diced tomates, subsituted angel hair pasta for the spaghetti, and mixed in  some paprika to the mushroom soup before pouring it over the casserole. I made this, but was not expecting much.  I was surprised.... It was delicious!! My husband LOVED it.  Will definately make again."
123,22,1081,Baked Spaghetti,sp_aUSaElGf_1081_c_143824,u_1oKVbAKAX7mnTrJr7mclCVOAAG7,RD2Cook,1,1622717047,0,0,0,1,100,For all the work this recipe takes; it is SO not worth it! I had to dump it all back into a big skillet and add spaghetti sauce and spices to give it flavor so I didn&#39;t have to eat the bland original. Definitely not worth it!
124,22,1081,Baked Spaghetti,sp_aUSaElGf_1081_c_120198,u_1oKVenrpbhZmpmw97VaXx5liTcl,pissed,1,1622716937,0,0,0,0,100,blech
125,22,1081,Baked Spaghetti,sp_aUSaElGf_1081_c_150943,u_1oKWd6nEk0BrQxwxnVcfhZZ7RGe,coprinter,1,1622717074,0,0,0,0,100,Great recipe. For a different taste  try the &#34;Mushroom Soup with Roasted Garlic&#34; also delicious.
126,22,1081,Baked Spaghetti,sp_aUSaElGf_1081_c_176925,u_1oKVyQqaa7YoV61eGqIJUwQJVqy,rhonda1,10,1622717225,0,0,0,5,100,I have made this since 1994. I always have request for recipe.
127,22,1081,Baked Spaghetti,sp_aUSaElGf_1081_c_364832,u_1oKcqBnOeM0rFSixH5DmLvF5HxB,dogshair,1,1622718160,0,0,0,5,100,We loved it--everything on hand--easy to make
128,22,1081,Baked Spaghetti,sp_aUSaElGf_1081_c_172990,u_1oKX2BsXCa4wdOETeFqH1nFvBao,cwedel93,1,1622717202,0,0,0,5,100,I have been making this since 1994. It&#39;s a favorite for the whole family and others who have it here for dinner ask for the recipe.
129,22,1081,Baked Spaghetti,sp_aUSaElGf_1081_c_347316,u_1oKVauuLoZFmi40ThN15tIlvSRY,rmjjjamadori,1,1622718088,0,0,0,5,100,Tried and true for years. AA++
130,22,1081,Baked Spaghetti,sp_aUSaElGf_1081_c_137779,u_1oKW5yK7iFyTPMDjrntsmLvUAAx,gwen51,1,1622717009,0,0,0,5,100,Excellent recipe!  Serves a large number of people and freezes well.  My family loves it.
131,22,1081,Baked Spaghetti,sp_aUSaElGf_1081_c_253047,u_1oKVaoDvFRlnHTA9ix6pgmJUWiK,shannondobos,1,1613037185,0,0,0,4,100,"<p>My husband and I really enjoyed this baked spaghetti.  My only change I made was to leave out the olives because we aren&#39;t fans of them.  Next time, to appeal more to the kids I will likely used crushed tomatoes instead of diced because they turned their noses up at the &#34;tomato chunks&#34;, and be sure to dice up the peppers smaller than I did.</p>"
132,22,1081,Baked Spaghetti,sp_aUSaElGf_1081_c_308221,u_1oKWW2bCcrUjvxGrFs88VAdyOmo,lcrement,1,1622717869,0,1,0,5,193,"This is a taste of home classic that goes way back.  I&#39;ve made it meatless for the vegetarians in my life, but I personally like it better with the meat.  I always use chopped olives, not the sliced.  It makes fabulous leftovers...which is good because I will eat it every day until it&#39;s gone!  I like to bring this casserole in a disposable foil container when I need a meal to give to a family.  If you enjoy casseroles, this is the jackpot."
133,22,1081,Baked Spaghetti,sp_aUSaElGf_1081_c_243111,u_1oKWwui7aqFKPIsZMTitFsrEx7c,jackie rzomp,1,1622717538,0,0,0,5,100,"Made this recipe many,many times.Never added meat. always made meatless. Husband&#39;s all time favorite.great Lenten recipe."
134,22,1081,Baked Spaghetti,sp_aUSaElGf_1081_c_136223,u_1oKVaDEmLdN4h4Pi1MQWrXVWoSf,mrsoak,1,1622717005,0,0,0,5,100,Everyone loves this recipe.  I make a dish of it for my family and a dish for a friend.  It&#39;s a great hearty twist on spaghetti.
135,22,1081,Baked Spaghetti,sp_aUSaElGf_1081_c_141083,u_1oKWG0HiIDtOd4aEv4OouxZ4XpJ,vikkir35,1,1622717040,0,0,0,5,100,family favorite for YEARS!
136,22,1081,Baked Spaghetti,sp_aUSaElGf_1081_c_347481,u_1oKVZzAQmX5vMT4C2F17HmePGCM,kebmod54,1,1622718078,0,0,0,5,100,Tried this for the 1st time and will have to make it again to keep everybody happy.  Everyone really enjoyed it.
137,22,1081,Baked Spaghetti,sp_aUSaElGf_1081_c_317623,u_1oKaRSGcOslOwShTiMezmpz3v1t,Totally_confused,1,1622717887,0,0,0,5,100,This is soooooooo good
138,22,1081,Baked Spaghetti,sp_aUSaElGf_1081_c_248243,u_1oKWC6SRruPQG1AShb0r6d6rcRT,AMWmomofsix,1,1622717584,0,0,0,3,100,My family didn&#39;t care much for this recipe.
139,22,1081,Baked Spaghetti,sp_aUSaElGf_1081_c_125395,u_1oKVvX3x3TnooMdZTZ7FPIi6htC,KimberlyV65,1,1622716955,0,0,0,5,100,"Delicious recipe!  Was given to me by a lady I work with, and she got it from Taste Of Home!"
140,22,1081,Baked Spaghetti,sp_aUSaElGf_1081_c_315229,u_1oKVc8w0oWOEln9rKiyAE0b7e9f,HeidiLSB,1,1622717923,0,0,0,5,100,This is one of only a few recipes that I repeat constantly.  My husband loves it and will take leftovers to his buddies for lunch.
141,22,1081,Baked Spaghetti,sp_aUSaElGf_1081_c_173060,u_1oKVm1p13M9Qn2a0LkE2EQPCSQW,radcook,1,1622717202,0,0,0,0,100,I have been making this since the first issues of Taste of Home. Its a great recipe.
142,22,1081,Baked Spaghetti,sp_aUSaElGf_1081_c_195177,u_1oKVZm06HuAJvEWFCoYwuCc19vS,l2bake,1,1622717327,0,0,0,5,100,I made this for the first time when I had company over and everyone loved it! This is a great recipe! Thanks for sharing.
143,22,1081,Baked Spaghetti,sp_aUSaElGf_1081_c_159463,u_1oKWpXj9W2rjlIET7l7uS9C8Yvg,blythesc,1,1622717104,0,0,0,5,100,I also have been making this recipe since 1994. My daughter now grown makes this for her family.Her kids now ask her to make it.
144,22,1081,Baked Spaghetti,sp_aUSaElGf_1081_c_153442,u_1oKVm1p13M9Qn2a0LkE2EQPCSQW,radcook,1,1622717071,0,0,0,0,100,Have been making this since it was in the magazine in 94. Its a great recipe.
145,22,1081,Baked Spaghetti,sp_aUSaElGf_1081_c_235996,u_1oKYHgf6aFzO03RTmv30SwE6upv,aunttassy1,1,1622717523,0,0,1,0,100,LOVE THIS!!!  I have 5 kids so I am always looking for recipe&#39;s that freeze well.  Both my husband and I could not tell AT ALL that this had been frozen!  It tasted as though I had just made it!  Very yummy and although I have only made it for company twice both have asked for the recipe.  Kids like it too :)
146,22,1081,Baked Spaghetti,sp_aUSaElGf_1081_c_169805,u_1oKXFVomnsPv7351Rfgr1rd6wmL,paulsmomintexas,1,1622717160,0,0,0,5,100,I got this recipe out of the Taste of Home Magazine probably more than 15 years ago and it is still a favorite of mine and my family.  I always get requests for the recipe.  I make it all the time for new mothers and when I take food for the families when someone passes away because it is easy and everyone loves it.  I keep the olives out and the kids love it too.
147,22,1081,Baked Spaghetti,sp_aUSaElGf_1081_c_367421,u_1oKVjYmNph8Qdy6lvOBspucI9g3,MyLittleChickadees,1,1622718187,0,0,0,0,100,"We&#39;ve love this recipe for years, too!  I&#39;ve made it so many times, mainly to make 2 square pans so I can put one in the freezer."
