Unnamed: 0,recipe_number,recipe_code,recipe_name,comment_id,user_id,user_name,user_reputation,created_at,reply_count,thumbs_up,thumbs_down,stars,best_score,text
174,23,14600,Buttery Cornbread,sp_aUSaElGf_14600_c_308572,u_1oKb0KTuhEcbw4ouNPxtw3zwILl,tastefullydone,1,1622717870,0,0,0,4,100,"This is a very good and moist cornbread. really liked the flavor. Only thing is too much flour - causing it to have too much of a &#34;cake&#34; texture.  Next time I make this I think  I will add less flour and more cornmeal.  Overall a very good cornbread,better than any other recipe I&#39;ve tried."
175,23,14600,Buttery Cornbread,sp_aUSaElGf_14600_c_178503,u_1oKWT274FP7iZbOqwiKuKOwH7P9,wcglanzer,1,1622717224,0,0,0,5,100,I have used this recipe exclusively since the 2002 Taste of Home Recipe book was delivered.  We always have this with Ham &#39;n Beans.
176,23,14600,Buttery Cornbread,sp_aUSaElGf_14600_c_175329,u_1oKXXrDEjiUeCtVvpZaVrdimc1Q,kullot,1,1622717191,0,0,0,5,100,I have made this many times for my family. My kids LOVE this . . . we refer to it as &#34;corncake&#34; because it is so delicious.  It reminds me of what is served at Marie Calender&#39;s restaurant.
177,23,14600,Buttery Cornbread,sp_aUSaElGf_14600_c_228215,u_1oKZFPtHIhSapFegowA7hruGbeS,sonia1209,1,1622717439,0,0,0,5,100,"I&#39;ve been looking for a good corn bread recipe. I&#39;ve tried several others but nothin compares to this one. I added chopped jalepeno for the hubby though. All in all, 5 stars! Oh don&#39;t forget to spread butter!"
178,23,14600,Buttery Cornbread,sp_aUSaElGf_14600_c_249198,u_1oKVq9hkpfNlSw6FOCPRqHARc5X,jeanie toland-scott,1,1622717571,0,0,0,5,100,my family loved this one.
179,23,14600,Buttery Cornbread,sp_aUSaElGf_14600_c_301828,u_1oKWkoGicNxE1NAA6TM2CK0NwXc,babyjag222,1,1622717827,0,0,0,5,100,"This cornbread is A. Mazing.  My whole family loves this recipe, it&#39;s the only one I&#39;ll make."
180,23,14600,Buttery Cornbread,sp_aUSaElGf_14600_c_285420,u_1oKVlHidO2An1QN9A5X8miqGBSp,sjm2526,1,1622717771,0,0,0,5,100,The only cornbread I make! So moist and buttery! It puts traditional cornbread to shame.
181,23,14600,Buttery Cornbread,sp_aUSaElGf_14600_c_314320,u_1oKVdG307ThByORlbGZgITQ8BTk,mko,1,1622717887,0,0,0,5,100,"This is my standard corn bread recipe, too.  We prefer it a little less sweet so I decreased the sugar to 2/3 c. and that works well for us."
182,23,14600,Buttery Cornbread,sp_aUSaElGf_14600_c_220462,u_1oKVncTOUNNYpbtuxEGYCZaLGWA,the pink baker,1,1622717424,0,0,1,0,100,I&#39;ve never heard of putting syrup on corn bread.  It does sound good though.
183,23,14600,Buttery Cornbread,sp_aUSaElGf_14600_c_303073,u_1oKbIJ004E82lX8DAL1AHQV1kWJ,Don Bergor,1,1622717848,0,0,0,5,100,This has became the only recipe I use for cornbread it is fantastic! I love it with honey or maple syrup:)
184,23,14600,Buttery Cornbread,sp_aUSaElGf_14600_c_372761,u_1oKW9R3KGaCyrPHkSuvUIT5mtxf,lbat,1,1622718204,0,0,0,5,100,Wonderful! So moist and flavorful. A big hit with Christmas dinner.
185,23,14600,Buttery Cornbread,sp_aUSaElGf_14600_c_274831,u_1oKXruN8IwjvlqhIklWrGChofzo,alee8837,1,1622717704,0,0,0,5,100,"So good, always a hit at our house. Really good with Pint beans or slow cooked chili."
