Unnamed: 0,recipe_number,recipe_code,recipe_name,comment_id,user_id,user_name,user_reputation,created_at,reply_count,thumbs_up,thumbs_down,stars,best_score,text
0,65,12347,Creamy Coleslaw,sp_aUSaElGf_12347_c_2E0IXiBGh8MnvFOIyya3au6W1hX,u_GEmJoRXDzdOK,cynthia889,20,1661726115,0,3,0,5,732,Made this for a cookout.  My husband asked for it twice within the week after the cookout.  Great old tyme flavor.  Also makes a great dip for veggies and crackers.  I didn&#39;t have celery salt so I very finely minced a celery stalk and that was great.  A little extra crunch with a lot extra flavor!
1,65,12347,Creamy Coleslaw,sp_aUSaElGf_12347_c_2AaQxfXKf1W6qJ4qlDpuF11Rafz,u_oXgqrcPfNGFW,jc2010,1,1655245463,2,5,1,0,563,The recipe won&#39;t print. Had another of your recipes do it last week. Please fugure out what&#39;s wrong.
2,65,12347,Creamy Coleslaw,sp_aUSaElGf_12347_c_2A9xFAyneolwx9XB0SWs81j4bFC,u_iWjGINSSoqyU,danielleylee,10,1654435495,0,2,2,5,603,Super duper easy. I used a bag of broccoli slaw. And instead of ground mustard used whole mustard seed old fashioned mustard. Winner for sure !
3,65,12347,Creamy Coleslaw,sp_aUSaElGf_12347_c_2A0LMhIzcmoDbo90QfrKnB8Tg1h,u_mm4n5ad0k1s3,joycerm53,60,1654141509,0,4,0,5,732,"This is my “go to” recipe for coleslaw!!
I have used different vinegars in this recipe but I agree with Susan, Tarragon is the best!!"
4,65,12347,Creamy Coleslaw,sp_aUSaElGf_12347_c_29tWMh7lZ5mT0Li1xInWLHCMaEb,u_Oy09tLZToDZl,Susan6652,1,1653932815,0,5,5,5,639,"I made this for a cookout and I’m glad I doubled the recipe. The only thing I did different from the original recipe was added Tarragon Vinegar. If you have never tried it, you should! I loved the flavor! It’s a bit sweet, so you can definitely cut that down the sugar if you wish. If doubling, I would also start with a cup of Heinz Mayo and add more later if it needs it."
5,65,12347,Creamy Coleslaw,sp_aUSaElGf_12347_c_29ibwMc4HIKKhpLldlpBRzPfLyf,u_crU3AYglHCi9,redcow,30,1653599090,0,7,0,5,812,I go to this recipe all the time.  I will say that I add 2 T. cider vinegar to the ingredient list.  I keep it in a pint  in refrig so I have it on hand when I want to mix up a small Batch for the 2 of us.  Yummy!!
6,65,12347,Creamy Coleslaw,sp_aUSaElGf_12347_c_28BHetjYBDqcrxYYR6hpq48CbVV,u_XzOrCbqUqOEM,Gregory113,1,1650897002,0,7,0,5,832,"Love this recipe. It is sweet, creamy, a touch of tart, and oh so good. I always follow the recipe the first time and then tweak for my taste if need be. I added 1/2 tsp. celery seed in addition to the original ingredients for the second batch. I have made it numerous times since and it tastes just as good with or without the added seed.  It is a KEEPER!!!"
7,65,12347,Creamy Coleslaw,sp_aUSaElGf_12347_c_20pqZAGmHkzwhfF3Jr6uMRHP2Zs,u_oGnUGaPmSbLH,MCa052,1,1636751930,0,11,11,5,673,"This is really good as is, but I did make a couple of tweaks to suit my palate the second time around. Now I use a package and a half of cole slaw mix; I think it&#39;s too wet otherwise. I reduce the sugar to 2 tbls and add 1 tbls vinegar and a little green onion. I didn&#39;t have celery salt the first time I made it, so I used 3/4 tsp celery seed and increased the seasoned salt to 1 tsp. It worked out well, so that&#39;s what I continue to do. I&#39;ll certainly never buy that jarred slaw dressing again; this is so simple to make and infinitely better."
8,65,12347,Creamy Coleslaw,sp_aUSaElGf_12347_c_1uHYIpLDCDi0k4XKG5aF40dQPOZ,u_n4G3NduEzP6H,Kathryn308,1,1624323904,0,15,4,5,790,"Loved this  recipe.  I added a small chopped red onion and celery seed as I didn&#39;t have celery salt.  I will reduce the sugar next time as I personally found it &#39;too sweet&#39;, but the rest of my family loved it."
9,65,12347,Creamy Coleslaw,sp_aUSaElGf_12347_c_432311,u_1oKVZgu56joKNnwPI7CpL8KvmUs,Alliea,1,1622648873,0,21,9,5,334,I shredded my own cabbage and added Carrots and Sweet onion. I tasted the recipe before I added the mustard or celery seed and it was just the type of dressing I have been looking for to reproduce the coleslaw of one of my favorite restaurant&#39;s so I omitted those ingredients. Very tasty.
10,65,12347,Creamy Coleslaw,sp_aUSaElGf_12347_c_432435,u_1oKVakhxVIBNUxgvWPjxZBGNwrV,grandmascooking22,10,1622648873,0,11,2,5,360,"Left out seasoning salt and added 1 T, celery seed and then regular salt in place of the celery salt.  I loved the creaminess and slight tang the sour cream gave it.  I&#39;ve never put sour cream in coleslaw and it was so yummy.  Very simple but yet tasty recipe."
11,65,12347,Creamy Coleslaw,sp_aUSaElGf_12347_c_432352,u_1tOHukNw6e3pmX8ZyrBsjrtmxiF,RhoadRPh,1,1622648873,0,30,2,4,459,My husband and I both love this recipe but I leave out the sugar and use Stevia instead (one pack for us). And I disagree with the comment about it not being good for leftovers. We think it&#39;s even better the day after.
12,65,12347,Creamy Coleslaw,sp_aUSaElGf_12347_c_432310,u_1tOHumbbTdQ82Qa2GlGbBgbDFNp,GoldButton,0,1622648873,0,1,3,5,120,Lovely will try to have it cream looks yummy also the ingredients thanks for recipe.
13,65,12347,Creamy Coleslaw,sp_aUSaElGf_12347_c_379667,u_1oKbC7zwasm1Wn2KFfCwRWwZv8X,BeatriceDreese,1,1622718165,0,5,1,5,296,Absolutely a wonderful recipe that I have searched for so many years.  The only alteration that we prefer in the mixture is the addition of 1-1 1/2 tsp. fresh ground horseradish.  Makes great even better!
14,65,12347,Creamy Coleslaw,sp_aUSaElGf_12347_c_417769,u_1oKVaM64YH6uHYmdygQgoq2plQs,scotland1,1,1622718418,0,1,0,5,193,This is my go to recipes. Yummy. Delicious. Will make it again
15,65,12347,Creamy Coleslaw,sp_aUSaElGf_12347_c_428120,u_1oKVaSOL1PvbnFxB3chEa0aJJC3,7833louis,1,1622718465,0,0,2,5,100,"yum, yum, yummy! Although this is not great as a left-over so I would recommend figuring out how much your family will eat in one setting and adjusting amounts accordingly. Also, I only had red cabbage ready in the garden so I used that. Thanks for sharing!"
16,65,12347,Creamy Coleslaw,sp_aUSaElGf_12347_c_411657,u_1oKaqe7Zsn1fO4kWiMsQZesgi0p,Guest75361888,1,1622718421,0,1,6,0,111,"Sounds good, the ground mustard &amp; celery salt  sound interesting, might have to give this a try.  We have used a KFC clone for years &amp; you would be very hard pressed to tell the difference between it &amp; the real thing."
17,65,12347,Creamy Coleslaw,sp_aUSaElGf_12347_c_388994,u_1oKbR3cQO3gb3QJhzpVI3Z8mbeD,Jacqueline,1,1622718267,0,23,1,5,459,How can someone rate 1 star when they&#39;re lactose intolerant and can&#39;t fix the recipe?  Anyway...Love this recipe!  Thank you for the submission!  And I did sneak a little granny smith apple in as one of the Kitchen Tips and everyone LOVED it!
18,65,12347,Creamy Coleslaw,sp_aUSaElGf_12347_c_412116,u_1oKdvyyj3d1velR8MrGlEW847Ya,Linda,1,1622718384,0,1,0,5,193,"Tasted this in a restaurant years ago, this is the closest to that recipe  I have ever had , it is wonderful."
19,65,12347,Creamy Coleslaw,sp_aUSaElGf_12347_c_399051,u_1oKc9AhZnnA8sK5TZH838kiQHKL,KathyGuevara,1,1622718352,0,8,1,5,354,I used this recipe exactly as is and we loved this side dish for the 4th of July Stay-at-Home celebration. I bought pre-packaged cabbage/carrot mix but this homemade coleslaw dressing really put it over the top. I will definitely make this a summer family staple dish.
20,65,12347,Creamy Coleslaw,sp_aUSaElGf_12347_c_383715,u_1oKcgebYMSPe6ffmk7rj2Tj4yAJ,RitaMathsen,1,1622718252,0,9,5,0,274,Didn&#39;t bonniesunshine read that a store bought bag of Cole slaw was used? It usually has carrots in it!
21,65,12347,Creamy Coleslaw,sp_aUSaElGf_12347_c_421509,u_1oKe2VzGHcQtOn4BLqncHONKFrK,CynthiaFinlan,1,1622718455,0,6,1,3,319,This was just to sweet for my taste and I only added a Tbsp of sugar. Started over and deleted the sugar and added lime juice for some tang. It tasted great after those adjustments.
22,65,12347,Creamy Coleslaw,sp_aUSaElGf_12347_c_408492,u_1oKcy8Fc0HblLQ1JFYg68iaEUYs,BonnieSunshine,1,1622718353,0,1,12,4,106,Odd. Pic shows carrots but not mentioned in recipe ingredients?
23,65,12347,Creamy Coleslaw,sp_aUSaElGf_12347_c_403758,u_1tR3yk3eFFgwZNS0aFL8fRArztJ,TheresaMattis,1,1622718330,0,1,1,5,142,Love this recipe so quick easy and yummy. I don’t like my coleslaw sweet or tart so followed the recipe and added tomatoes!
24,65,12347,Creamy Coleslaw,sp_aUSaElGf_12347_c_397377,u_1oKYkDJbEuwjASAnRvFXs3YLX1d,skp321,1,1622718323,0,2,1,4,193,I omitted the mustard and used apple cider vinegar for tartness. I also used regular salt and added a little black pepper and diced green onion. This is pretty darn good dressing. The sour cream makes it really creamy and keeps it from being too sweet. I will absolutely make it again. Thanks for sharing it!
25,65,12347,Creamy Coleslaw,sp_aUSaElGf_12347_c_422813,u_1oKbaFPvqu5NNonpkTG4ZDq5vI0,SusanRoder,1,1622718468,0,1,0,0,193,Try using tarragon vinegar for an even better twist! The apples add crunch and flavor; thanks for suggesting it!
26,65,12347,Creamy Coleslaw,sp_aUSaElGf_12347_c_418468,u_1oKVrLXFeBRPIyXcIhehXUU4sbl,BradleyMac,1,1622718419,0,1,1,5,142,This is the only coleslaw recipe that I use. Sometimes I also add onions.
27,65,12347,Creamy Coleslaw,sp_aUSaElGf_12347_c_388257,u_1oKbDFkpxAE5FSpyyiAlcM0ePYy,AmberPowers,1,1622718263,2,0,69,1,100,Has dairy. My family are lactose intolerant.
28,65,12347,Creamy Coleslaw,sp_aUSaElGf_12347_c_404353,u_1oKcsi8zmigz5q3dvEO3b95K7dP,CindyOsborne,1,1622718352,0,7,1,4,338,"Loved this but a little too sweet, added Apple cider vinegar and it came out great ??"
29,65,12347,Creamy Coleslaw,sp_aUSaElGf_12347_c_383247,u_1oKW7P0udJKkoomQRtjQRZNXnpQ,melsmorsels,1,1622718251,0,3,0,5,297,Delicious!!!  I&#39;ve been looking for a great coleslaw recipe and this is it!!  Thank you!! I only had brown sugar and did add a tbls apple cider vinegar.
30,65,12347,Creamy Coleslaw,sp_aUSaElGf_12347_c_411069,u_1oKdlXvldebBTlDGug2qxPLYngj,David Scheer ,1,1622718364,0,1,0,5,193,So easy to make and so tasty
31,65,12347,Creamy Coleslaw,sp_aUSaElGf_12347_c_425221,u_1oKWBfBDTdjRiXVXeYvASif4lvC,katecrid47,1,1622718463,0,2,0,5,253,We loved this coleslaw! I usually buy the jar coleslaw mixer and I will never buy again! This was easy and yummy! Thank you for sharing!!!!
32,65,12347,Creamy Coleslaw,sp_aUSaElGf_12347_c_387039,u_1oKW1mlv1J2VVFASO8Bt3xwVpSX,fmmslkl,1,1622718260,0,3,0,4,297,Good recipe but use half or no sugar.  The first time I made it with the sugar the second  time with half the sugar.  Still a good recipe with less sugar.
33,65,12347,Creamy Coleslaw,sp_aUSaElGf_12347_c_407902,u_1oKbPAqdwfFcnc3xELJnM01PByH,DeborahMcGavock,1,1622718346,0,0,3,3,100,"Needs more flavor. Next time I would add finely diced green pepper and sliced green onions. Also, red wine vinegar in the dressing. A tsp or 2."
34,65,12347,Creamy Coleslaw,sp_aUSaElGf_12347_c_397095,u_1oKbnNYuXjxAqseIorVknDtQarr,Barbara,1,1622718311,0,0,2,4,100,"I make a similar coleslaw, but I like to add fruit.  I add pineapple tidbits, cut mandarine oranges and dried cranberries, have even added diced Granny Smith apples.  I like things sweet rather than savory and this fruit addition adds the sweet I crave."
35,65,12347,Creamy Coleslaw,sp_aUSaElGf_12347_c_399409,u_1oKazauurloW3qjH07ebUbrm2OO,Edwin12020,10,1622718323,0,3,0,5,297,"I usually don’t use sour cream in my slaw, bu this came out fantastic!  I shredded a third of a head of cabbage, two big carrots and half an onion through the food processor.  Outstanding!  Ed"
36,65,12347,Creamy Coleslaw,sp_aUSaElGf_12347_c_393268,u_1oKc6dpsptXPYYQxZoopst6zLYH,Guest7684,1,1622718288,0,5,0,5,354,I have mode this about 5 times now always to rave reviews. It yields a very wet coleslaw so I’ll sometomes back off a bit on the mayo part. I too have always added a tablespoon or so of vinegar.
37,65,12347,Creamy Coleslaw,sp_aUSaElGf_12347_c_131788,u_1oKVabx1v9IOjmZbyC5dIRTPlC5,amsm,20,1622717000,0,0,0,5,100,"Easy and delicious cole slaw! After reading the reviews, I decided to half the recipe for one 14 ounce  bag of cole slaw. I also added a bit of cider vinegar. Perfect side dish for a summer barbecue!"
38,65,12347,Creamy Coleslaw,sp_aUSaElGf_12347_c_314143,u_1oKVl19VUYXtPOB7w8tKpX7k9dZ,melgoody03,1,1622717921,0,0,1,4,100,This is my go-to coleslaw recipe. I give it 4 stars instead of 5 because I always add some cider vinegar to perfect the dressing.
39,65,12347,Creamy Coleslaw,sp_aUSaElGf_12347_c_281900,u_1oKYzWDLswuAoYV4o86F6xxZ41W,pbarstad,1,1622717738,0,0,0,5,100,The best creamy coleslaw that I have found. It reminds me of the coleslaw we get from the famous fried chicken place.
40,65,12347,Creamy Coleslaw,sp_aUSaElGf_12347_c_126968,u_1oKVuCESYUdd930fS1CuPjxXJY8,daisiesandroses,1,1622716962,0,1,0,4,193,"Delicious! I love the flavor the seasoned salt, dry mustard, and celery salt give it. I&#39;ve used normal coleslaw mix and broccoli slaw. I&#39;ve also halved the sugar. It&#39;s all been good. The only reason I give 4 stars is because it needs a splash of vinegar (I use apple cider vinegar). It also is too much dressing. I either double the slaw mix or halve the dressing. That being said, this is the only coleslaw recipe I make! No need for any other."
41,65,12347,Creamy Coleslaw,sp_aUSaElGf_12347_c_355309,u_1oKVsdg4PtZcJQAD00DjfbD1R0u,marcibanes,1,1622718103,0,0,0,4,100,"Very Good, I did not use the coleslaw mix because I had fresh cabbage from the garden.  I really enjoyed the dressing but next time I will add some fresh lemon juice.  I will definitely make this recipe again."
42,65,12347,Creamy Coleslaw,sp_aUSaElGf_12347_c_349532,u_1oKVa1vU0P0wtIMwn8FBys0ptHj,gunslinger,20,1622718053,0,0,0,5,100,"Very creamy and delicious, next time I would add a little vinegar just to give it a little added zing, but that is just my personal preference."
43,65,12347,Creamy Coleslaw,sp_aUSaElGf_12347_c_231040,u_1oKWAXW5iAeblRFTAhvJufawvMd,MonnaL,1,1622717447,0,0,0,5,100,Just made this and put it in the fridge for supper. Delicious!! I did add the white vinegar. Thanks for a great recipe!
44,65,12347,Creamy Coleslaw,sp_aUSaElGf_12347_c_334793,u_1oKbzRcoC1iuAg096zv3Cn0sFRM,HeidiBourque,1,1622717984,0,0,0,5,100,This was amazing. Loved it!!! Nice and creamy. Definitely making this again. Thank you
45,65,12347,Creamy Coleslaw,sp_aUSaElGf_12347_c_235429,u_1oKYL1xSKnLyt7I5iJqBMgWlBsU,Guest2144,1,1622717501,0,11,0,5,433,"Love this recipe!!!  So did most others, I&#39;d consider that a success!!  And to DAVE...I don&#39;t think buying a bag of  coleslaw mix constitutes a lack of originality, just a plain time-saving move.  What you add to it makes it your recipe."
46,65,12347,Creamy Coleslaw,sp_aUSaElGf_12347_c_176651,u_1oKWJ12IjXd6YUHsQy0wbB4DUd4,BayAreaRob,1,1622717205,0,0,0,5,100,I have made this several times and it is perfect.  I add a little white vinegar.
47,65,12347,Creamy Coleslaw,sp_aUSaElGf_12347_c_107880,u_1oKVaY9hf9fWpOLZolUQuTKwVXT,DaveAnderson,1,1622716887,0,1,37,0,102,1 package (14 ounces) coleslaw mix?This goes the same for people who use canned soups in recipes...If you lack the originality to think up your own recipe thenPlease Don&#39;t Post!
48,65,12347,Creamy Coleslaw,sp_aUSaElGf_12347_c_241423,u_1oKVacj3LLa5bBKXd9S4USSCjcP,doreensanzone,1,1622717524,0,0,0,5,100,"Made this for a Super Bowl party and it was indeed SUPER! Creamy and delicious. I added a tablespoon of cider vinegar as others recommended, and was very impressed by the creamy, delicious flavor. I’ll never need another cold slaw recipe!"
49,65,12347,Creamy Coleslaw,sp_aUSaElGf_12347_c_316359,u_1oKVcdepzJe87X1vZ6jf4d2zTg7,sjpoor,1,1622717924,0,0,0,5,100,This is really good.  Only change I made was celery seed instead of celery salt....because I didn&#39;t have any.   I did add some more shredded carrots for color and was able to use 2 bags of slaw.  Added the second bag after salad sat overnight in the refrigerator and dressing had relaxed a little.  Yummy
50,65,12347,Creamy Coleslaw,sp_aUSaElGf_12347_c_158700,u_1oKVimClB8m84nSuRk15Z4xNBKM,FredEvans,1,1622717123,0,0,0,4,100,I agree with Christine ... picnic and folks will rip the bowl out of your hands.
51,65,12347,Creamy Coleslaw,sp_aUSaElGf_12347_c_160571,u_1oKWR4ujwXKGYDUuEdTQgC0l6Zz,cutiemoose,1,1622717136,0,0,3,1,100,"I am definitely in the minority here.  I really, really disliked this recipe.  I made it exactly as stated using a bag of &#34;angel hair cabbage&#34;.  It was so wet I added a second bag and it was still too wet.  It was so sweet I added THREE tablespoons of horseradish and could barely tell I added any.  I gave up and took it to a gathering with a sprinkling of smoky paprika on top.  Very little of it was eaten.  It continued to get more watery with standing and looked less and less appealing."
52,65,12347,Creamy Coleslaw,sp_aUSaElGf_12347_c_271262,u_1oKa0vG5D9XbLkcfKcsC5CGWheG,Christine,1,1622717709,0,0,0,5,100,Scrumptious! And so easy! Didn&#39;t change a thing except for doubling recipe.
53,65,12347,Creamy Coleslaw,sp_aUSaElGf_12347_c_377667,u_1oKVlVN5Xtktc5Dc20w7SEmJLsz,puppypal81,1,1622718219,0,2,0,5,253,Yummy and so easy. Will make it again and again.
54,65,12347,Creamy Coleslaw,sp_aUSaElGf_12347_c_352747,u_1oKVZdmUbQTYMVdbXOpVfRQuHm9,No_Time_To_Cook,1,1622718108,0,0,0,5,100,"Very Good and very creamy!  I added the 2 tablespoons apple cider vinegar as was recommended below and it was really good, but be sure to taste and adjust to your tastes.  I will make this again!"
55,65,12347,Creamy Coleslaw,sp_aUSaElGf_12347_c_243614,u_1oKVZdntxwYzxksw1IqW0kld9jH,redcow,1,1622717553,0,0,0,5,100,Made this tonight and added 2 tablespoons cider vinegar.  Love it!!!  My new favorite.
56,65,12347,Creamy Coleslaw,sp_aUSaElGf_12347_c_142988,u_1oKWELtqasoBJMtjDD5xaNY9MNP,anneconn4,1,1622717047,0,0,0,5,100,Five star when I added about 2 tbs cider vinegar.
57,65,12347,Creamy Coleslaw,sp_aUSaElGf_12347_c_278696,u_1oKVZTHTqi7N4NPqNxPS2XB2asz,mythyagain,1,1622717728,0,0,0,5,100,Super quick and easy.  Makes cole slaw interesting and zippy.  I did not have any sour cream and used just mayonnaise and it was still good
58,65,12347,Creamy Coleslaw,sp_aUSaElGf_12347_c_123280,u_1oKVZrio6gkgxWk5Rf9YriPLADZ,Appy_Girl,20,1622716962,0,0,0,5,100,"Creamy indeed. I love the slightly  sharp edge that the Sour cream adds to this recipe. It seems to lighten up the heaviness that Mayonnaise can sometimes add to a recipe. Due to health issues I did not use any salt at all.  I used Celery Seed, and I  cut back  on the sugar. And to liven  it up even more some Cider Vinegar. Some freshly grinded Black Pepper completes this tasty side dish. One of our favorites during the summer.  I know my family is really going to enjoy this one. Its  a keeper.JanieTaste of Home Volunteer Field Editor"
59,65,12347,Creamy Coleslaw,sp_aUSaElGf_12347_c_368811,u_1oKVZlgwPbb4xAJfv7aJ5rVDToV,Psalm127-3,10,1622718189,0,0,0,0,100,what is ground mustard please? I have dried mustard powder and mustard with mustard seeds. is either one correct?
60,65,12347,Creamy Coleslaw,sp_aUSaElGf_12347_c_375256,u_1oKVb5uSZj7PviMuKwtkrUoN1pf,KarenKeefe,1,1622718155,0,0,0,5,100,"Yes, a splash of vinegar and this turned out just right!"
61,65,12347,Creamy Coleslaw,sp_aUSaElGf_12347_c_106816,u_1oKVZpN5X5TPXtUzjvTzTlTyUgY,salisuz,1,1622716884,0,0,1,3,100,"&gt; I used to work the salad bar at ryan&#39;s - we used the simple ingredients (buttermilk, mayo,  sugar - mixed together and poured across the cole slaw mixture! we used this combo dressing for many of the other fruit salads and broccoli &amp; cauliflower salad &amp; carrot and raisin salad! when making  dressing... 1/2 cup buttermilk, 1/2 cup mayo (kraft or duke&#39;s or sauer&#39;s) and 3/4 cup of sugar... NO salt is added (u get to do that u eat it)"
62,65,12347,Creamy Coleslaw,sp_aUSaElGf_12347_c_125872,u_1oKVbOzFe1yuIWbPevIiv45XKei,MurphyNJ,1,1622716955,0,0,0,5,100,Delicious!  I have made it with only mayo when I haven&#39;t had sour cream in the refrigerator.
63,65,12347,Creamy Coleslaw,sp_aUSaElGf_12347_c_234710,u_1oKa1SbAyoIdrJga3DR0x3EqBv9,jujumcG,1,1622717521,0,0,0,5,100,Love this I add lemon juice
64,65,12347,Creamy Coleslaw,sp_aUSaElGf_12347_c_333814,u_1oKVaHtIchmWmVVeeSOOXMv0lX1,buffetfan,1,1622718017,0,1,1,4,142,"This was a really good slaw but like some other reviewers noted, it did need a bit of vinegar. I added 1 tablespoon of cider vinegar and the flavor elevated. At first I thought it was a lot of mayo and sour cream for only one package of slaw mix but it was the right amount. Before you combine the dressing and slaw, taste to adjust flavor to your tastes. I also added black pepper, just because I like pepper! As a Volunteer Field Editor I recommend this recipe."
65,65,12347,Creamy Coleslaw,sp_aUSaElGf_12347_c_204716,u_1oKVc57zin1tNYP5HDKvcmfaUYt,PageRD,1,1622717367,0,0,0,5,100,"I really love creamy, mayo based cole slaw. This one has a great mix of sweet and sour, although a bit of vinegar might add a little acid to accentuate the flavor. I made it for guests and they all loved it."
66,65,12347,Creamy Coleslaw,sp_aUSaElGf_12347_c_177525,u_1oKVnch3DQNemaCqkbuYSb1P99F,twinkiedog,1,1622717259,0,0,0,5,100,"I have never really been a &#34;coleslaw&#34; person, but my entire family loves this recipe and so do I!!"
67,65,12347,Creamy Coleslaw,sp_aUSaElGf_12347_c_346140,u_1oKZWEk7jfDVJAfJwzds8z5ZiaT,Dr_Buster_King,1,1622718087,0,0,0,4,100,"To make this a &#34;one disher&#34; versus two dishes, I made the dressing first, in a Rubbermaid type container, then added the cabbage mixture. I can flip it every so often in the fridge til dinner time, instead of stirring it.I&#39;ve made it several times since then, and we&#39;ve enjoyed it. We enjoy a hint of vinegar (lime juice, or other acidic) to cut down on the overall sweetness, so I did add that, in the additional makings.  I also cut down on the sugar ever so slightly (personal preference, not the recipe&#39;s fault).To make the slaw the star, we make tortillas on these hot summer nights, using this slaw, a tortilla wrap, and leftover grilled pork (though shrimp, fish, or chicken are all okay, too).Thanks for sharing this recipe. Sorry I did make the modifications, so it isn&#39;t really the original, but, I hate doing dishes, so, I try to conserve whenever possible."
68,65,12347,Creamy Coleslaw,sp_aUSaElGf_12347_c_350871,u_1oKVZxoUMG63M49Uw51JVZDztTg,LBurkey,10,1622718064,0,0,0,5,100,Very easy to fix and good to eat.   Using coleslaw mix really cuts down on prep time.
69,65,12347,Creamy Coleslaw,sp_aUSaElGf_12347_c_306020,u_1oKal1dsgiSw07KrRDjmUtYjvjo,Nootchie,1,1622717835,0,0,0,5,100,"This is a great recipe especially for the appealing &#34;stick to veg&#34; texture of dressing. If thinner is preferred, spruce up with either cider vinegar, or buttermilk or a splash of pineapple juice!  It&#39;s all good!!"
70,65,12347,Creamy Coleslaw,sp_aUSaElGf_12347_c_156655,u_1oKVmSvTvLEhQWBAfwctm7hAR1d,jud--dee,1,1622717098,0,0,0,5,100,I  love this recipe....after having it sit in fridge for couple of hours I add more coleslaw too.    It is the best recipe I have found .....definitely a 5 star recipe.
71,65,12347,Creamy Coleslaw,sp_aUSaElGf_12347_c_237505,u_1oKW3jY8njNpSP9JvOkY2ULrWKO,barsto,1,1622717534,0,0,0,5,100,"Loved this dish .  I did shred  my own  cabbage and added  a little onion, green pepper, carrot and 1/8 tsp  white pepper.  Also substituted  Splenda for the sugar.  This deserves a 5-star review!!!!...  Next time I make this dish, I will either make less dressing or add more cabbage as it is a little &#34;heavy on the sauce&#34;."
72,65,12347,Creamy Coleslaw,sp_aUSaElGf_12347_c_284204,u_1oKVaSjlLCbyDJqKum4t1NwfFZy,alfoa,1,1622717759,0,0,0,3,100,"The flavor is good, but the texture/consistency of the dressing is too thick. Coleslaw dressing is typically more drippy or runny. Since this is a mayonnaise/sour cream base, it&#39;s the same base that&#39;s used in veggie or chip dips (thick). This recipe will do until I find a more traditional one."
73,65,12347,Creamy Coleslaw,sp_aUSaElGf_12347_c_149842,u_1oKVakfYCgfVuJgJskIe58dCnCz,ferryal,10,1622717081,0,0,0,5,100,"Great Recipe!  Made this last night, very easy &amp; yummy!  For health reasons, used light mayo &amp; sour cream, followed the recipe exactly.  Will never buy ready made coleslaw again!Thank you for sharing your recipe."
74,65,12347,Creamy Coleslaw,sp_aUSaElGf_12347_c_301819,u_1oKWlrJPujHlSrr7rukJju9ux9q,jdogg22,10,1622717821,0,2,0,5,253,This coleslaw recipe was excellent!  rave reviews at dinner!  I had a 32 oz. bag of the shredded cabbage which is over double the recipe and decided not to double the dressing mix to cut on calories and after the slaw sat for awhile and I stirred it occasionally the cabbage shrinks and there was plenty of dressing for me.  I am watching my calories and did not change the dressing part.  Hellman&#39;s is my favorite mayo.  I did add craisins also and it was great!  Thank you for sharing!
75,65,12347,Creamy Coleslaw,sp_aUSaElGf_12347_c_378364,u_1oKVZangmN67bJNxpyD1j55VJCj,tsuop,1,1622718197,0,0,0,5,100,"YUMMY!!    I didn&#39;t have celery salt, so I used celery seed also.    The mix of mayo &amp; sour cream did it,  Perfect!!"
76,65,12347,Creamy Coleslaw,sp_aUSaElGf_12347_c_324024,u_1oKWzN0YvavveNI3mDAk5ZhysQT,fudgeybutt,1,1622717946,0,0,0,5,100,This recipe is Amazing!!! Been using it for years. Haven&#39;t came across another one yet that tops it. Thank you for sharing it. Everybody I serve it to loves it! Didn&#39;t change a thing or add anything to the recipe. It&#39;s perfect as is!
