Unnamed: 0,recipe_number,recipe_code,recipe_name,comment_id,user_id,user_name,user_reputation,created_at,reply_count,thumbs_up,thumbs_down,stars,best_score,text
218,8,6086,Apple Pie,sp_aUSaElGf_6086_c_371854,u_1oKaxLE3H2mBgtCI99MwN7MiBGV,amburskye47,1,1622718170,0,0,0,5,100,"Wonderful pie, its the only recipe Ill use."
219,8,6086,Apple Pie,sp_aUSaElGf_6086_c_243862,u_1oKVdjz8a2OHvPFjiM6Z7H5jgcw,needsomezzzs,1,1622717541,0,0,0,5,100,Made this tonight and the flavour is amazing. I did add extra flour to thicken as well (will probably add more next time perhaps an extra 2T) Also added a couple of sprinkles of watkins apple pie spice. Kids probably would have eaten it all if I had let them. I may reduce the sugar a tad next time but still enjoyed just the same.
220,8,6086,Apple Pie,sp_aUSaElGf_6086_c_180198,u_1oKXCmTRLF7ngUmJiGUXA0bchuF,aperu01,1,1622717213,0,0,0,5,100,I just made this apple pie today and it came out wonderful! That&#39;s saying a lot because I am not a big fan of apple pie. I added a tiny bit of clove because I like that flavor. Great recipe!
221,8,6086,Apple Pie,sp_aUSaElGf_6086_c_364861,u_1oKVZmwriM0KG2XqP8kbU6HI0zG,carolynstowers,1,1622718118,0,0,0,5,100,"We loved the pie, after reading the reviews I did added 3 heafing tablespoons of flour to thicken the pie. Came out great I served the Apple Pie for dinner with a scoop of vanilla ice cream on the top."
222,8,6086,Apple Pie,sp_aUSaElGf_6086_c_116315,u_1oKVuf7x1P2B4zTUYpDplSkYN1j,sarahaj99,1,1622716918,0,0,0,5,100,"As a member of our local American Legion, I often donate baked goods to our monthly steak nights. What says America more than homemade apple pie! This recipe is super easy and delicious! Will definitely make again and again!"
223,8,6086,Apple Pie,sp_aUSaElGf_6086_c_322173,u_1oKbn3eUSxX9GVWcPffe3FA0KxW,caity1111,1,1622717902,0,0,0,5,100,"This pie is great! Everyone loves it, everytime. It isn&#39;t too sweet for me. To avoid it being runny, scoop the apples out of the bowl instead of dumping them into the crust. That way, any leftover mixture that didn&#39;t coat onto the apples will remain in the bowl. A+ Recipe!"
224,8,6086,Apple Pie,sp_aUSaElGf_6086_c_229765,u_1oKXV3EopgZW7DgeVGxdLAabfAl,HaileyKl,1,1622717503,0,0,0,5,100,"I&#39;ve never made a pie before, and I used this Apple Pie Recipe as my first attempt and it turned out Great! YUM! :)"
225,8,6086,Apple Pie,sp_aUSaElGf_6086_c_264868,u_1oKaUINF7Uvedq6cqFb6WYsRFPa,rlescalleet7,1,1622717659,0,0,0,5,100,Over and over and over. This is by far the best apple pie recipe I have found.
226,8,6086,Apple Pie,sp_aUSaElGf_6086_c_353586,u_1oKW4ii6zYEtHhuq9XLMwYdWCWl,mamabear223,1,1622718075,0,0,0,5,100,Very good recipe.  Didn&#39;t last long at my house.
227,8,6086,Apple Pie,sp_aUSaElGf_6086_c_306431,u_1oKWVTljKA5RnLqdgdPZMWvceXM,3152004703,1,1622717866,0,0,0,5,100,This is a great recipe! I added 8 cups of apples and 2 tbls of butter. Next time I would add 1/4 tsp of ground cloves to add a little zest to it. It came out soupy but I let it sit overnight and it was fine. I will be making this again for sure!
228,8,6086,Apple Pie,sp_aUSaElGf_6086_c_251158,u_1oKVa94LOmLWeLIdBxex4VQz6Qr,Esther,1,1622717573,0,0,0,5,100,my favorite apple pie recipe.  Sometimes I add a little pumpkin pie spice as well just to spice it up a notch
229,8,6086,Apple Pie,sp_aUSaElGf_6086_c_227718,u_1oKXgLKTeeP8h167zRnJ06h4sFR,mtande4,1,1622717438,0,0,0,5,100,its awesome but my came out runny even though i followed directions exactly and let it cool for 2 hrs.
230,8,6086,Apple Pie,sp_aUSaElGf_6086_c_141323,u_1oKWFpDNxHwBBOIkyxUf9Kf7Mnb,dawnl5105,1,1622717030,0,0,0,5,100,Family Favorite!
231,8,6086,Apple Pie,sp_aUSaElGf_6086_c_353567,u_1oKb5dJBBNXMSqVNDavgQ0H03d9,jennyluvs2cook,1,1622718074,0,0,0,5,100,very good recipe!! very easy to make and tasted wonderful! i also added some caramel syrup to it :) yummmmm
232,8,6086,Apple Pie,sp_aUSaElGf_6086_c_235467,u_1oKYMLA8ilyu5F9NYZVabVZ0IsN,wsherri,1,1622717500,0,0,0,5,100,Love this recipe. I used ready made pie crust by Pillsbury. Other than that i stuck to the recipe. It was a big hit with my family. So easy!!
233,8,6086,Apple Pie,sp_aUSaElGf_6086_c_224562,u_1oKXJTFP0o83qGfCqaPtJ5M3BIz,Mizzy,1,1622717458,0,0,0,5,100,It is a tad bit sweet.. so when I make it next time I will cut down the sugar some. Otherwise it was fantastic!!
234,8,6086,Apple Pie,sp_aUSaElGf_6086_c_163648,u_1oKWtS0ZevWh9FiyW1NRNFtylYD,Bluemoon54,1,1622717128,0,0,0,2,100,"I decided to make it today after reading the reviews, but it was extremely sweet. I won&#39;t make it again."
235,8,6086,Apple Pie,sp_aUSaElGf_6086_c_317551,u_1oKVZal4TPFqydDTMBhijz8o4GR,annalisa_harmon,1,1622717933,0,0,0,5,100,This is sooo good!
236,8,6086,Apple Pie,sp_aUSaElGf_6086_c_376589,u_1oKVaSoynNPsYLGyFHn9Gzy0sLy,imacookingirl,1,1622718191,0,0,0,5,100,Yum Yum! This pie was very easy to make and very delicious.
237,8,6086,Apple Pie,sp_aUSaElGf_6086_c_265352,u_1oKYi2mWuMdij4ssEaxLB62h7fO,stacym,1,1622717649,0,0,0,5,100,Perfect Apple Pie Recipe!  This will stay in my recipe file forever.
238,8,6086,Apple Pie,sp_aUSaElGf_6086_c_279718,u_1oKZauvqXjRuWMMUoutPOXv2uRy,rhomeme,1,1622717704,0,0,0,5,100,Tasted just like apple pie should. YUMMY.
239,8,6086,Apple Pie,sp_aUSaElGf_6086_c_116019,u_1oKVdxubszVO9tIGqXbPRt0FLbr,ilenelish,1,1622716925,0,0,0,5,100,"Apple Pie,Wow!! So yummy. I added 1/2 tsp. of Apple Pie spice to the rest of the ingredients it was great. Thumbs up on this recipe."
240,8,6086,Apple Pie,sp_aUSaElGf_6086_c_322249,u_1oKWH6EI4xkF9jRles78RZXvwbY,moepup,1,1622717941,0,0,0,5,100,this pie is very good classic apple pie
