Unnamed: 0,recipe_number,recipe_code,recipe_name,comment_id,user_id,user_name,user_reputation,created_at,reply_count,thumbs_up,thumbs_down,stars,best_score,text
221,4,17826,Amish Breakfast Casserole,sp_aUSaElGf_17826_c_187581,u_1oKVnJUPzWYci1PJ03AbaJrlTMK,Travlnman02,1,1622717276,0,0,1,5,100,"I made it first time the way the recipe suggests for a breakfast with my son and grandchildren. It was well received. The basic rescipe lends itself to variations of your choice so I&#39;ve used smoke cured Ham, bulk breakfast sausage, smoked sausages, and even crabmeat and shrimp. I added fresh sliced mushrooms, red bellpeppers, and even the long green chile peppers seeded and diced small. I made fresh salsa with Cilantro and served it on the side. Ialso made fresh biscuits with butter and honey and a fresh fruit or melon. Great breakfast."
222,4,17826,Amish Breakfast Casserole,sp_aUSaElGf_17826_c_272623,u_1oKYrPCWtv5lE4TiqyoICNe3Xq4,bpmsr,1,1622717695,0,0,0,5,100,Simply delicious!!! Have made this several times and it&#39;s always a huge hit!  I always add extra meat - sausage and canadian bacon.  I NEVER have leftovers!
223,4,17826,Amish Breakfast Casserole,sp_aUSaElGf_17826_c_241384,u_1oKW2Zu4ez3zVzKjAYbyYjfLbzL,debstamp,1,1622717541,0,1,0,5,193,"Made this for a family brunch and divided into 2 pans (1 w/bacon and 1 without for a vegetarian) and both were a big hit.  I followed various people&#39;s suggestions, substituted cottage cheese with ricotta and used half mexican cheese and half mexican cheese with taco seasoning for a little kick.  Very easy to make and yummy!"
224,4,17826,Amish Breakfast Casserole,sp_aUSaElGf_17826_c_193398,u_1oKXbAmLyyhozYfbgmd3qOU0icB,CookingAmanda,1,1622717300,0,0,0,5,100,"I made this for breakfast for the 4th of July, and it was fantastic. It was super easy and really enjoyable. I did make one substitution. I don&#39;t like cottage cheese, I don&#39;t even like the idea of cottage cheese, so I used ricotta cheese instead and it was perfect. This is a recipe to keep!!"
225,4,17826,Amish Breakfast Casserole,sp_aUSaElGf_17826_c_225715,u_1oKVaZOcZWSQwk3KGP2nT7nqZeG,ilka896,1,1622717442,0,0,0,3,100,It was alright.  My husband did not really like it but he liked that it kept him full for a long time.
226,4,17826,Amish Breakfast Casserole,sp_aUSaElGf_17826_c_203599,u_1oKY6cVIezIjHt3GsAMCtnRQHlX,Ilovemypuppies,1,1622717334,0,0,0,5,100,I put my own spin on this recipe. I didn&#39;t use the bacon but instead use ham and added mushrooms and used cheddar cheese.  I made it for company and everyone enjoyed.
227,4,17826,Amish Breakfast Casserole,sp_aUSaElGf_17826_c_193331,u_1oKXZ82wUw6KGh5xWy5bPsfBt6R,shancooks,1,1622717271,0,0,0,5,100,I made this for an employee breakfast at work today and it was HIT!!
228,4,17826,Amish Breakfast Casserole,sp_aUSaElGf_17826_c_242152,u_1oKWb0Y9Tk0u7oObBSYOQmRo7P2,walkingfit,1,1622717532,0,0,0,5,100,"Made this for some company and it was a big hit. Even though I cooked it for the full time and let it stand before serving, the very center had not set up fully. But that won&#39;t stop me from serving this dish regularly."
229,4,17826,Amish Breakfast Casserole,sp_aUSaElGf_17826_c_220318,u_1oKZLTWeKFco7QoNgjXacLCckAu,slimzsister,1,1622717431,0,0,0,5,100,I&#39;ve made this recipe several times.  Each time I have omitted the onion and replaced the bacon with sausage.  It&#39;s always a hit.
230,4,17826,Amish Breakfast Casserole,sp_aUSaElGf_17826_c_194577,u_1oKYUQKDdHoXRWOqY5HIwiab9jK,stewhep,1,1622717311,0,0,0,5,100,I made this for our LWML breakfast meeting and it was a great hit - any leftovers freeze well....
231,4,17826,Amish Breakfast Casserole,sp_aUSaElGf_17826_c_374229,u_1oKW3vaUaxhcza0SGo1TrO8yCp9,RosannTSarka,1,1622718177,0,0,0,5,100,"Wow!  This is an awesome recipe!I cut it in half, substituted feta for the cheddar and hot pork sausage for the bacon.  Since there are only 3 in my family, that gave me a meal for one breakfast and I froze the other half for another morning.  This is SO easy and my hubby who doesn&#39;t really care for casseroles for breakfast said it was a &#34;keeper&#34;."
232,4,17826,Amish Breakfast Casserole,sp_aUSaElGf_17826_c_317647,u_1oKXJKLOGgPNvqJvIuFlWIJGvV1,Juliaauliveld,1,1622717933,0,0,0,5,100,This is soooooooooooo good
233,4,17826,Amish Breakfast Casserole,sp_aUSaElGf_17826_c_253930,u_1oKZnka8K5EmlNkyB3MqmS2vflC,joannemg,1,1622717629,0,0,0,5,100,My husband liked the recipe. I used ham slices that I had. It was good.
234,4,17826,Amish Breakfast Casserole,sp_aUSaElGf_17826_c_168005,u_1oKWpz82R9D3fqjwyArW1dLfMNu,happygirl_pa,1,1622717177,0,0,0,5,100,I followed the recipe exactly as stated.  It baked to a lovely golden brown. I served today to teachers at a Staff Appreciation Brunch.  They loved it and I brought home an empty container less than an hour later.  I&#39;ve added this to my &#34;go to&#34; list of recipes.
235,4,17826,Amish Breakfast Casserole,sp_aUSaElGf_17826_c_257333,u_1oKWABgDaj9nqnkSQY8f6WQUqKm,Grammy B,1,1622717616,0,0,0,5,100,"My son-in-law says he hates cottage cheese, but he declared this recipe &#34;A keeper&#34;.  Because I was feeding a crowd, I added a few more eggs, a pound of Lil Smokie links sliced (yes, I also added the bacon as directed) and switched the cheddar and swiss for a combo of cheeses we had on hand.  I liked the kick the pepper jack cheese gave it.  Hearty and delish!"
236,4,17826,Amish Breakfast Casserole,sp_aUSaElGf_17826_c_325858,u_1oKVeep1X2cpiA469U1Zdi7cfuE,kerrynjames,1,1622717970,0,0,0,4,100,"This recipe is tasty and easy to make.  I gave it 4 stars as it could be considered a little bland.  Next time, I&#39;m going to try pepperjack instead of swiss.All in all, I liked it and would not hesitate to make this dish again!  Thanks for the recipe!"
237,4,17826,Amish Breakfast Casserole,sp_aUSaElGf_17826_c_325870,u_1oKVeep1X2cpiA469U1Zdi7cfuE,kerrynjames,1,1622717962,0,0,0,4,100,"This recipe is tasty and easy to make.  I gave it 4 stars as it could be considered a little bland.  Next time, I&#39;m going to try pepperjack instead of swiss.All in all, I liked it and would not hesitate to make this dish again!  Thanks for the recipe!"
238,4,17826,Amish Breakfast Casserole,sp_aUSaElGf_17826_c_268107,u_1oKVgRMtmYSTdhwdEKa56FXrbgS,robbinthornton,1,1622717666,0,0,0,4,100,"Quick, simple and delicious!"
239,4,17826,Amish Breakfast Casserole,sp_aUSaElGf_17826_c_250131,u_1oKYfuEs0ObKeG0CJUmzTNkfhW6,K_Ortiz,1,1622717561,0,0,0,5,100,"My family LOVES this casserole!  I had to alter it a bit for my large family.  I use 8-12 eggs, use pepper jack cheese instead of swiss and add a couple spoonfuls of sour cream.  I also substitute sausage when i didn&#39;t have bacon, and it was just as delicious.  This adds to my cooking time, approximately 50-60 minutes total but it is worth the wait."
240,4,17826,Amish Breakfast Casserole,sp_aUSaElGf_17826_c_111363,u_1oKVbOFf7jQN4RQXzZUWTUpgSna,blondentexan,1,1622716905,0,0,0,5,100,Absolutely delicious! A family favourite.
241,4,17826,Amish Breakfast Casserole,sp_aUSaElGf_17826_c_187366,u_1oKXiJ8fzfyEgGd1vULodRXZGUL,careyportell,1,1622717235,0,0,0,5,100,i made breakfast for dinner and the entire casserole was eaten! everyone had seconds.
242,4,17826,Amish Breakfast Casserole,sp_aUSaElGf_17826_c_187826,u_1oKXYO0pMj9qg4Xr5TsEpqlUQE2,revmo,1,1622717278,0,0,0,5,100,I made it without the bacon (I didn&#39;t have any) and it was still fabulous!  Great recipe - thanks!
243,4,17826,Amish Breakfast Casserole,sp_aUSaElGf_17826_c_196769,u_1oKX7QESfiCSHAj7inPNAmsBnfD,Petrich,1,1622717303,0,0,0,5,100,I made this recipe for family visiting from out of town and it was a hit. They took the recipe home and used it for a family gathering over Christmas...everyone wanted the recipe! Easy recipe and excellent tasting.
244,4,17826,Amish Breakfast Casserole,sp_aUSaElGf_17826_c_161966,u_1oKW5ceNy4Z0RmNbMOCfS1EHdFT,Sillyman1,1,1622717139,0,0,0,5,100,"I blended the cottage cheese and eggs (8 eggs) in a blender and added 1/4th cup of milk.  I also substituted cubed ham for the  bacon.  I sauteed up a yellow onion and mushrooms to add.  I omitted the swiss cheese.  I also added salt, pepper, ground mustard, and garlic powder.  This was supper yummy.  My husband likes to eat this with salsa.  Would be okay with ketchup for kids."
245,4,17826,Amish Breakfast Casserole,sp_aUSaElGf_17826_c_327536,u_1oKX6TkZAuqaPVSsrsfwQ0Erfh4,KeriM,1,1622717964,0,0,0,3,100,"This recipe was easy to make and tasty, however I found it very bland. I was worried when preparing it that it would be, but wasn&#39;t sure if the saltiness of the bacon would be enough, so I didn&#39;t alter the recipe except to make it with 10 eggs. After eating it, I would definitely add salt and pepper, and maybe even some green and red peppers. It has the potential to be a wonderful recipe."
246,4,17826,Amish Breakfast Casserole,sp_aUSaElGf_17826_c_325113,u_1oKVazXVQjr6IXTwaeByQPQv44i,ValerieMS,1,1622717919,0,0,0,3,100,"This recipe is ok, but I have another similar recipe we like much better. I think the hashed browns make this a little heavy."
247,4,17826,Amish Breakfast Casserole,sp_aUSaElGf_17826_c_347876,u_1oKXZKyFMEBlPVvJBI4R2FHvfYt,Tammy_Girl,1,1622718080,0,0,0,5,100,"Trust me, you don&#39;t taste the cottage cheese.  My son and husband can&#39;t stand cottage cheese, but they don&#39;t even know it&#39;s in the recipe.  I am so craving this recipe now too."
248,4,17826,Amish Breakfast Casserole,sp_aUSaElGf_17826_c_134855,u_1oKWHstULKW7297GNfJ3BeEPuZi,19fernwood,1,1622716987,0,0,0,4,100,"enjoyed the cottage cheese, made it creamy! easy to make and I used turkey sausage vs. bacon."
249,4,17826,Amish Breakfast Casserole,sp_aUSaElGf_17826_c_241521,u_1oKVq4AZswYYWmOALNhiSw8u8Wu,benenati,1,1622717527,0,0,1,5,100,"made this for Christmas Eve brunch 2011 everyone said it was delicious..next year I will make (2) 9x13&#39;s because it was gone so fast after people took seconds and thirds!!!  I didn&#39;t change anything in the recipe, however, I did make it the day before, covered it and put it in the refrigerator. I took it out 30 minutes before I baked it. It is a keeper and the only breakfast Casserole I will make from now on."
250,4,17826,Amish Breakfast Casserole,sp_aUSaElGf_17826_c_160536,u_1oKVsp0cHeVruiieNI0Wf4EQp1x,sherri6332000,1,1622717114,0,0,0,5,100,"I am eating this as I speak. It is really good, flavorful. I added chopped ham instead of bacon and I had a block of Irish Cheddar so I used that instead of the standard orange. Other than that, the recipe is the same. Oh, and I added a little bit of green onions along with the sweet. The cottage cheese makes it creamy and delicious. Excellent brunch dish"
251,4,17826,Amish Breakfast Casserole,sp_aUSaElGf_17826_c_125970,u_1oKVaZRjV5snsZRKtuKJMvV5rmj,jillanglemyer,1,1622716977,0,0,0,5,100,Delicious!  I have never made a breakfast casserole before because none of the other recipes appealed to me. This one was a big hit for a holiday breakfast.
252,4,17826,Amish Breakfast Casserole,sp_aUSaElGf_17826_c_363263,u_1oKVlSUIbWEOUoajBNtwpsR6ElO,wombie,1,1622718105,0,0,0,5,100,We have tried this with bacon and sausage and enjoyed both.
253,4,17826,Amish Breakfast Casserole,sp_aUSaElGf_17826_c_339003,u_1oKaCFUr0ws9crsQw6xfue9HRYx,C.Laughlin,1,1622718012,0,0,0,4,100,"This was kind of boring by itself, but a good standard to add green chilies and spices. Could probably also use only one cheese."
254,4,17826,Amish Breakfast Casserole,sp_aUSaElGf_17826_c_240661,u_1oKVgGIzDdqGntHDavtrfEQlBbi,drumminmomma,1,1622717522,0,0,0,5,100,"Made this again this morning!  Absolutely LOVE it!  I double the eggs, 12 total and sauté red and green pepper to throw in it!  Delicious!!!!  We even eat it for dinner too!"
255,4,17826,Amish Breakfast Casserole,sp_aUSaElGf_17826_c_342505,u_1oKbFvROUQZv8YRAxo4ZjHSf81O,jlester,1,1622718028,0,0,0,5,100,This was soooo good and easy.  I took it to work and everyone loved it!  I followed the recipe except I did put 10 eggs.  Next time I think I will add green pepper and mushrooms.  You can&#39;t taste the cottage cheese but don&#39;t leave it out...I think it inhances the taste of the other cheeses.
256,4,17826,Amish Breakfast Casserole,sp_aUSaElGf_17826_c_127219,u_1oKW9Us7uaiJJVLTdhdSYBmVzqI,dmitch64,1,1622716979,0,0,0,5,100,Delicious! Kids and adults alike loved it!
257,4,17826,Amish Breakfast Casserole,sp_aUSaElGf_17826_c_195807,u_1oKXoPoIAdpUH062xNG9W4sNRZA,cowgirl_one,1,1622717299,0,0,0,5,100,I made this last year for Christmas Breakfast and all my family loved it!  I cooked the bacon and onion mix the night before and put it in a sealed bowl till the morning and was perfect to mix the last bit and pop in the oven while presents were being opened!  It has been requested for a repeat Christmas Breakfast again this year!
258,4,17826,Amish Breakfast Casserole,sp_aUSaElGf_17826_c_138706,u_1oKWScqhD2CUpsrFml6BHa1ssYq,Twren,1,1622717012,0,0,0,5,100,Excellent!  Everybody wanted more!
259,4,17826,Amish Breakfast Casserole,sp_aUSaElGf_17826_c_268975,u_1oKVa6fb9ZNJkSaFRDQhulUPwsA,leslie1966,1,1622717678,0,0,0,4,100,Really good and easy too.  I used a combo of bacon and sausage that worked out well.
260,4,17826,Amish Breakfast Casserole,sp_aUSaElGf_17826_c_127939,u_1oKVaaUsBxF20g20nk1Th5UN0pu,countess cookie,1,1622716964,0,0,0,5,100,"Delicious!!! Made with 12 eggs and turkey sausage. A very easy and cheap meal that the entire family will enjoy! Also, for those who don&#39;t like cottage cheese, you can&#39;t taste it in this dish a bit!"
261,4,17826,Amish Breakfast Casserole,sp_aUSaElGf_17826_c_113254,u_1oKVnRDdoxCYp1cpMzyYqxYAWPG,ambarr,1,1622716917,0,0,0,5,100,After I made this recipe I have&#39;nt even triedanother one. This is a keeper!
262,4,17826,Amish Breakfast Casserole,sp_aUSaElGf_17826_c_243871,u_1oKVdpotk8j55JIT4Cm4cmfip9q,pinkiepie,1,1622717550,0,0,0,5,100,Made this when I had family in from out of town and every on loved it.  So much they asked for a copy of the recipe.
263,4,17826,Amish Breakfast Casserole,sp_aUSaElGf_17826_c_378111,u_1oKbTOKTYiX942dVUHO0QObmQwd,Shhhari,1,1622718202,0,1,0,5,193,"Yummy! And for &#34;Grampa,&#34; who doesn&#39;t like cottage cheese, you won&#39;t notice it if you put it in a blender with the eggs.I&#39;ve changed the recipe by using less potatoes (hubby can&#39;t eat a lot of carbs!) and adding fresh spinach, mushrooms &amp; bell peppers. It also can be spiced up lots more if that&#39;s your taste. Very adaptable recipe!"
264,4,17826,Amish Breakfast Casserole,sp_aUSaElGf_17826_c_272567,u_1oKYpC5282H0i6zMWmDJxp3sHi5,zachary.abramovitz,1,1622717649,0,0,0,5,100,"Simply Amazing! My wife and I tried this one out a few months ago, and it IMMEADIATELY became a weekly dish. a Must Try!"
265,4,17826,Amish Breakfast Casserole,sp_aUSaElGf_17826_c_188100,u_1oKXQWzD8NbZbd3lQnfzvGPn2Fw,hzhrmyn3,1,1622717306,0,0,0,5,100,"I made the Amish Breakfast Casserole this week for friends. Everyone gave it 10/10. However cholesterol wise, it&#39;s quite a bit when you consider all the cheese. It&#39;s a great recipe for a one dish breakfast. Will do a repeat again when we have guests for breakfast of for a brunch.Ottawa, Ontario, Canada"
266,4,17826,Amish Breakfast Casserole,sp_aUSaElGf_17826_c_233318,u_1oKXtnAElv1qOxUpLoXL0tVDbsl,lluvbear,1,1622717517,0,0,0,4,100,Lot of potatoes and potato taste in this recipe.  Almost tastes like a hashbrown casserole.
267,4,17826,Amish Breakfast Casserole,sp_aUSaElGf_17826_c_313764,u_1oKXZKyFMEBlPVvJBI4R2FHvfYt,Tammy_Girl,1,1622717917,0,0,0,5,100,"This is my first time writing a review for a recipe, but this one deserved a review, it was that good.  This was so tasty; I made it just as directed, except I used a pound of sausage (Bob Evans breakfast sausage).  Be sure to let stand for 10 minutes, in fact, I think 15 minutes is better.  I made it quicker by frying the sausage a day ahead."
268,4,17826,Amish Breakfast Casserole,sp_aUSaElGf_17826_c_131182,u_1oKVn625KRoOk3xMGyV1rbX3I9P,fivstar,1,1622716983,0,0,0,4,100,Does anyone know if this can be made ahead and frozen? It is delicious and I&#39;d like to have it in the freezer for unexpected company.
269,4,17826,Amish Breakfast Casserole,sp_aUSaElGf_17826_c_214080,u_1oKVn625KRoOk3xMGyV1rbX3I9P,fivstar,1,1622717407,0,0,0,4,100,I want to make this casserole for company. Has anyone tried making it and freezing it ahead of time?
270,4,17826,Amish Breakfast Casserole,sp_aUSaElGf_17826_c_216526,u_1oKZDqN4Id1MQmc4VP40y4CkMSq,amymc1217,1,1622717405,0,0,0,5,100,I will make this again and again. My family and co-workers love this. A tip to make it even quicker is that I used a package of the Oscar Meyer real bacon bits you find on the Salad Dressing aisle and it was fantastic!! This is a recipe I will keep forever and so quick and easy to make!
271,4,17826,Amish Breakfast Casserole,sp_aUSaElGf_17826_c_114622,u_1oKVedBvGx0WbjqO50HNLC6F2NN,russwife,1,1622716914,0,0,0,5,100,Am so glad that you posted this as this is more than just a 5 star..everyone loves this thank you for this wonderful recipe.
272,4,17826,Amish Breakfast Casserole,sp_aUSaElGf_17826_c_159937,u_1oKW6QrLN0fJ7y7HUfVmcQag3PP,regrimm,1,1613063273,0,0,0,5,100,"<p>I always use 12 eggs but otherwise follow this to a T, and love it!  Have tried with both bacon and turkey sausage and it&#39;s great both ways!</p>"
273,4,17826,Amish Breakfast Casserole,sp_aUSaElGf_17826_c_287757,u_1oKVeRJ98lQi89TThckB1PGuzSv,scsvatek,1,1622717740,0,0,0,5,100,There are never any leftovers when I make this.  It is hearty and delicious.
274,4,17826,Amish Breakfast Casserole,sp_aUSaElGf_17826_c_191319,u_1oKXaTbHbmK7Mih8jP0D0Og9yDV,nativenewmexican,1,1622717261,0,1,0,5,193,"I made this as a test to see if it&#39;s what I wanted to take to a bridal shower.  It was great!  I did follow the advice of one lady and made it with 12 eggs and 30 oz hash browns so it would be a little bigger. Being from the Southwest, you can&#39;t make an egg dish without throwing in green chili.  I bought the frozen kind and drained it before adding. Since it was bigger I baked it an hour."
275,4,17826,Amish Breakfast Casserole,sp_aUSaElGf_17826_c_132188,u_1oKVtmnPCIzW7CfWOJ3BqM8Igls,tarrahlea,1,1622716998,0,0,0,5,100,Easy and delicious!
276,4,17826,Amish Breakfast Casserole,sp_aUSaElGf_17826_c_194294,u_1oKYSlQh9MYxvIM7pWe6nJ0JtEr,chinamaxx,1,1622717277,0,0,0,5,100,I made this for my kids this morning and they both gave me 2 thumbs up!! Easy and delicious.
277,4,17826,Amish Breakfast Casserole,sp_aUSaElGf_17826_c_306196,u_1oKZUQNpYz6Zi7YNwMnJhORwzx9,SandyLaurie,1,1622717868,0,0,0,5,100,"This is a great recipe!  One reviewer said hers turned out dry.  Gas and electric ovens don&#39;t cook the same.  For anything you cook, if you&#39;re using a gas oven, lower the temp. by 15 degrees."
278,4,17826,Amish Breakfast Casserole,sp_aUSaElGf_17826_c_194184,u_1oKXi9zhdEmozTZQIx9MQhZ0YYc,BowieSuzette,1,1622717275,0,0,0,5,100,"I made this for my husband the other night. He LOVED it. Instead of the cottage cheese, I added a little more shredded cheese and extra hash browns. I also cut up an extra tomato I had laying around and threw some green, orange and red peppers on tops just for color. Was soooo good! Will make it again, very soon!!"
279,4,17826,Amish Breakfast Casserole,sp_aUSaElGf_17826_c_344540,u_1oKWBP40Witwn4DTVLnAVxsJqg7,loopyjane3377,1,1622718052,0,0,0,5,100,This was very tasty and relatively easy to make. Made with bacon and next time I will try the breakfast sausage.
280,4,17826,Amish Breakfast Casserole,sp_aUSaElGf_17826_c_194674,u_1oKYYKGgi8bQS5tCF5aWCuSmn8T,jbstephens,1,1622717325,0,0,0,5,100,I made this for our Ladies Bible Study today and everyone luved it...i did make a few changes because i needed it to make a lager casserole...i used 12 eggs instead of six..my hash-browns was a 30 oz bag..and i added extra cheddar cheese to the top when it was done and left it just long enough 2 melt...we r big on Cheddar Cheese...Was Very Good...might try it another way next time r make as recipe calls 4 . i just needed a bigger casserole this mornin...Thanks 4 sharing ..Will be making it again !!!!!
281,4,17826,Amish Breakfast Casserole,sp_aUSaElGf_17826_c_191989,u_1oKXbEv74Npnw6gJx9YsTW5EXiH,vlm40,1,1622717266,0,0,0,4,100,"I made this casserole yesterday with 1 lb of breakfast sausage. It&#39;s okay, but don&#39;t think it has enough flavor that I would make it again."
282,4,17826,Amish Breakfast Casserole,sp_aUSaElGf_17826_c_247305,u_1oKVcBeTuVU3tWIjoTy7LIH8Dho,swinny,1,1622717535,0,0,0,5,100,My daughter is going back to college this morning and I wanted to make something she would enjoy &amp; get her back on the road to finish up her last year of college. We all enjoyed this very much.
283,4,17826,Amish Breakfast Casserole,sp_aUSaElGf_17826_c_374295,u_1oKcpDpQJuRdWsa5fIppAGgbIoA,Melissa S.,1,1622718174,0,0,0,5,100,Wow!  This was great!  I used extra-sharp cheddar cheese.  My husband and kids loved it.  Thank you for a great recipe I will use a lot.  :)
284,4,17826,Amish Breakfast Casserole,sp_aUSaElGf_17826_c_367238,u_1oKW6sDj2gqrjqX4YlV5AdPJw3s,trishgale,1,1622718146,0,0,0,5,100,"We were snowed in and I made this, and it is fantastic . . . cannot wait to make it again.  I used Bob Evans sausage since I had it on hand and probably used close to 5 cups of shredded hashbrowns to make it firmer.  My husband and I love it, and this is our new favorite breakfast casserole now.  The next time I will use bacon instead to see if it is as good."
285,4,17826,Amish Breakfast Casserole,sp_aUSaElGf_17826_c_175079,u_1oKWBMJKdPcO3l91aXHBqtPCxFh,djmirous,1,1622717190,0,3,0,5,297,I have made this for Christmas morning the last two years.  It is a hit.  I substitue Monterey Jack for the Swiss.  And I cook the bacon and onion up the night before and measure out the other ingredients in a large bowl.  Basically do everything except add the eggs.  I do that in the morning.  I get it out a few minutes earlier and bake it a little longer.  Works really well.
286,4,17826,Amish Breakfast Casserole,sp_aUSaElGf_17826_c_353348,u_1oKaO55Fy3wyqulJzo7NK7OXbQ7,pac12,1,1622718109,0,0,0,5,100,very good made for faimly
287,4,17826,Amish Breakfast Casserole,sp_aUSaElGf_17826_c_194625,u_1oKYWerRb7AUSa0rmVYc5m1Tc2q,Researchergal,1,1622717277,0,0,0,4,100,I made this for our Christmas morning breakfast and we really enjoyed it. Now that I&#39;ve tried it once I would add some additional ingredients next time I made it.
288,4,17826,Amish Breakfast Casserole,sp_aUSaElGf_17826_c_241318,u_1oKZC9UyutfBoBXqilb8FOKhI1R,PeggyJanea56,1,1622717540,0,0,0,5,100,Made this for a Bible Study Brunch and was a huge success.  The potatoes are a welcomed change from bread and the cottage cheese makes it oh so creamy.  Wouldn&#39;t change a thing and will definately make again.
289,4,17826,Amish Breakfast Casserole,sp_aUSaElGf_17826_c_118823,u_1oKVuk0qROjn4THJDjBj48AtU5o,Estherwaayenberg,1,1622716939,0,0,0,5,100,"Being I&#39;m watching the fat intake, I found this recipe easy to defat with turkey bacon and lowfat or no fat cheeses. If you don&#39;t have frozen hash browns, shred or dice the   potatoes."
290,4,17826,Amish Breakfast Casserole,sp_aUSaElGf_17826_c_179220,u_1oKXMKd90d3z57pXGochFaDbdWR,susansimonds,1,1622717209,0,0,0,4,100,I haven&#39;t tried it yet but wonder how the Amish prepared potatoes for it.  I&#39;m SURE they didn&#39;t use frozen hash browns.
291,4,17826,Amish Breakfast Casserole,sp_aUSaElGf_17826_c_324436,u_1oKbkofMv36Q2YoT0igkptIyfDh,patzconklin,1,1622717957,0,0,1,5,100,"This recipe is delicious. To the person who would like to substitute Ricotta instead of cottage cheese, that would work fine also but since Ricotta is alot more expensive you might consider just putting your cootage cheese through a food processor or blender and your cottage cheese hater will not know the difference."
292,4,17826,Amish Breakfast Casserole,sp_aUSaElGf_17826_c_153314,u_1oKW6oFk9zPti7QPIq7t6JW36t6,bagsdeb,1,1622717085,0,0,0,5,100,Has anyone ommited the cottage cheese and used something else? I have one in the family that if they see cottage cheese they won&#39;t use it. Would ricotta cheese work?
293,4,17826,Amish Breakfast Casserole,sp_aUSaElGf_17826_c_174964,u_1oKXC3namOn77bXNZP96YGPSjsc,yeibmom,1,1622717191,0,0,0,5,100,I have made this for Christmas morning the last 3 years in a row.  Delicious for breakfast or dinner.
294,4,17826,Amish Breakfast Casserole,sp_aUSaElGf_17826_c_173523,u_1oKVxlVFMBzmUvhdWckewrNTmA9,lisaviolette,1,1622717185,0,0,0,5,100,I have had this recipe from Taste of Home years ago and it is a staple in my family.  It feeds alot of people and everyone loves it.  I use chives or scallions instead of onion.
295,4,17826,Amish Breakfast Casserole,sp_aUSaElGf_17826_c_325939,u_1oKaTSZFpnXK9vlCHBFJpUqwn81,RhondaKBowman,1,1622717959,0,0,0,5,100,"This recipe is the same one I found in a quilters cookbook several years ago. I make it all the time.  I like the sausage, but I also use Canadian bacon.  It&#39;s easier and a little less fat. Give it a try.  We like this recipe with pancakes."
296,4,17826,Amish Breakfast Casserole,sp_aUSaElGf_17826_c_232975,u_1oKZ7AdGI2vRt0eOUzk025v28MG,SharonHughart,1,1622717494,0,0,0,5,100,Looked this up a few days before Christmas when seraching for breakfast idaes.  We really liked this -- made it for Christmas breaksfast for the fisrt time AND it had nice presentation for guests.  Very easy to make!  I reduced the onion (used sweet onion) because I don&#39;t really care for onions.  I will make again ~ thanks!
297,4,17826,Amish Breakfast Casserole,sp_aUSaElGf_17826_c_254173,u_1oKVaGkDdYZKeRsBkpefH4ROEmG,tood1es,20,1622717586,0,0,0,5,100,My husband LOVED this dish!  He said it needs to replace our annual tradition of Breakfast Pie (see other Taste of Home recipe) for Christmas breakfast.
